name,Price Per Unit,Price Per Measure,Promotion
Anadin Extra,Anadin Extra16 per pack,£1.80,11.3p each,"Offer price £1.80, was £2.19"
Canesten Thrush Combi Internal & External Cream,Canesten Thrush C…,£13.00,,
Centrum Immunity & Cell Protection Tablets,Centrum Immunit…60 per pack,£7.50,12.5p each,
"NiQuitin Clear Patch - Step 1 21mg, 14 Nicotine Patches - Stop Smoking Aid",NiQuitin Clear Patc…14 per pack,£20.00,£1.43 each,
Berocca Energy Food Supplement Orange Effervescent Tablets,Berocca Energ…15 per pack,£4.25,28.3p each,"Offer price £4.25, was £5"
Clarityn Allergy Tablets 10mg Loratadine Allergy and Hayfever Relief,Clarityn Allergy Tabl…30 per pack,£5.20,17.4p each,"Offer price £5.20, was £10.40"
Anadin Paracetamol      ,Anadin Paracetamol      16 per pack,£1.50,9.4p each,
Canescool Soothing Cream Gel,Canescool Soo…15g,£6.00,£40.00 per 100g,
Centrum Advance Tablets,Centrum A…30 per pack,£4.50,15p each,
"NiQuitin Clear Patch -Step 1 21mg, 7 Nicotine Patches - Stop Smoking Aid",NiQuitin Clear Patc…7 per pack,£14.00,£2.00 each,
Canestest Self-Test for Vaginal Infections,Canestest Self-Test for…,£7.50,,
Centrum Advance 50+ Multivitamins,Centrum Advance 5…30 per pack,£4.50,15p each,
Scholl Cracked Heel Cream,Scholl Cracked Heel Cream60ml,£5.00,£8.33 per 100ml,
CanesOasis Cystitis Relief 4g Granules for Oral Solution Cranberry Flavour,CanesOasis Cystitis…6 per pack,£5.65,94.2p each,
Rennie Sugar-Free Heartburn & Indigestion Chewable Tablets,Rennie Sugar-Free…24 per pack,£2.20,9.2p each,
Centrum Advance For Men,Centrum A…30 per pack,£6.50,21.7p each,
Anadin Joint Pain Tablets 200mg,Anadin Joint Pa…16 per pack,£2.20,13.8p each,
 Canesbalance Bacterial Vaginosis Vaginal Gel, Canesbalance Bac…7 per pack,£14.00,£2.00 each,
Niquitin Minis Mint 1.5Mg 100 Lozenges,Niquitin Minis Mint…,£22.00,,
Rennie Orange Heartburn & Indigestion Chewable Tablets,Rennie Orange H…24 per pack,£2.20,9.2p each,
Carex Antibacterial Moisture Plus Handwash,Carex Antibacte…250ml,£1.20,48p per 100ml,
Colgate Cavity Protection Toothpaste,Colgate Cavity Prot…75ml,£1.50,£2.00 per 100ml,
Radox  Feel Awake for Men Shower Gel,Radox  Feel Awake f…250ml,£1.00,40p per 100ml,
Niquitin Minis Mint 4Mg 100 Lozenges,Niquitin Minis Mint 4Mg 100 Lozenges100 per pack,£19.80,19.8p each,
Centrum Men 50 Plus MultiVitamins,Centrum Men 50 Plus MultiVitamins30 per pack,£5.00,16.7p each,"Offer price £5, was £6.50"
Canesten Thrush Combi Soft Gel Pessary & External Cream,Canesten Thrush Combi…100g,£16.00,£16.00 per 100g,
"NiQuitin Mini Mint Nicotine Lozenges -4mg, 60 Minis - Stop Smoking Aid",NiQuitin Mini Mint Nicotine L…60 per pack,£16.00,26.7p each,
Rennie Spearmint Heartburn & Indigestion Chewable Tablets,Rennie Spearmint Heartb…72 per pack,£5.45,7.6p each,
Beconase Hayfever Relief Nasal Spray - Non-drowsy - 100 Sprays,Beconase Hayfever Relief Nasal Spra…100ml,£6,£6.00 per 100ml,
Centrum Women 50 Plus MultiVitamins,Centrum Women 50 Plus MultiVitamins30 per pack,£5,16.7p each,"Offer price £5, was £6.50"
Panadol Extra Soluble,Panadol Extra Soluble24 per pack,£5.25,21.9p each,
Voltarol Back & Muscle Pain Relief Gel,Voltarol Back & Muscle Pain Relief Gel100g,£15,£15.00 per 100g,
Voltarol Joint Pain Relief Gel,Voltarol Joint Pain Relief Gel50g,£11,£22.00 per 100g,
Voltarol Pain-Eze Emugel,Voltarol Pain-Eze Emugel100g,£11,£11.00 per 100g,"Offer price £11, was £13"
4 Head Headache Treatment  ,4 Head Headache Treatment  3.6g,£3.50,£97.22 per 100g,"Offer price £3.50, was £4.50"
Abidec Kid Multivitamin Syrup - Food Supplement Suitable for Kids Aged 1-5 ,Abidec Kid Multivitamin Syrup - Food Suppleme…150ml,£4.50,£3.00 per 100ml,
Adonis Hazelnut Crunch & Cocoa High Protein Keto Bar,Adonis Hazelnut Crunch & Coco…45g,£1.70,£3.77 per 100g,"Offer price £1.70, was £2"
Adonis Peanut Butter & Cocoa High Protein Keto Bar ,Adonis Peanut Butter & Cocoa…45g,£1.70,£3.77 per 100g,"Offer price £1.70, was £2"
Alka-Seltzer Original Aspirin Pain Relief Soluble Tablets,Alka-Seltzer Original Aspirin Pai…,£2,,
Allevia 120mg Tablets ,Allevia 120mg Tablets 15 per pack,£6,40p each,
Allevia 120mg Tablets,Allevia 120mg Tablets30 per pack,£10.50,35p each,
Always Discreet Boutique Incontinence Pants Medium,Always Discreet Boutique In…9 per pack,£8,88.9p each,"Offer price £8, was £9"
Always Discreet Boutique Incontinence Pants Plus Large Black 8 pack,Always Discreet Boutique Incontinence P…8 per pack,£8,£1.00 each,"Offer price £8, was £9"
Always Discreet Boutique Incontinence Pants Plus Medium Peach 9 pack,Always Discreet Boutique Incontinence P…9 per pack,£8,88.9p each,"Offer price £8, was £9"
Always Discreet For Sensitive Bladder Long Plus Pads Value Pack,Always Discreet For Sensitive Bladder…16 per pack,£4.70,29.4p each,Buy 2 for £9
Always Discreet Incontinence Liners Long For Sensitive Bladder 20 pack,Always Discreet Incontinence…20 per pack,£2.25,11.3p each,Buy 2 for £4
Always Discreet Incontinence Liners Normal For Sensitive Bladder 24 pack,Always Discreet Incontinence Li…24 per pack,£2.25,9.4p each,Buy 2 for £4
Always Discreet Incontinence Pads+ Long for Sensitive Bladder 10 pack,Always Discreet Incontinence…10 per pack,£2.75,27.5p each,Buy 2 for £5
Always Discreet Incontinence Pads+ Long For Sensitive Bladder 20 pack,Always Discreet Incontinence…20 per pack,£4.70,23.5p each,Buy 2 for £9
Always Discreet Incontinence Pads+ Long Plus Sensitive Bladder 8 pack,Always Discreet Incontinence…8 per pack,£2.75,34.4p each,Buy 2 for £5
Always Discreet Incontinence Pads Normal for Sensitive Bladder 12 pack,Always Discreet Incontinence…12 per pack,£2.75,22.9p each,Buy 2 for £5
Always Discreet Incontinence Pads Normal For Sensitive Bladder 24 pack,Always Discreet Incontinence…24 per pack,£4.70,19.6p each,Buy 2 for £9
Always Discreet Incontinence Pads Small for Sensitive Bladder 20 pack,Always Discreet Incontinence…20 per pack,£2.75,13.8p each,Buy 2 for £5
Always Discreet Incontinence Pants Plus Black,Always Discreet Incontine…9 per pack,£8,88.9p each,"Offer price £8, was £8.75"
Always Discreet Underwear Boutique Incontinence Pants Plus Large 8 pack,Always Discreet Underwear Bou…8 per pack,£8,£1.00 each,"Offer price £8, was £9"
Always Discreet Underwear Incontinence Pants Normal Large 10 pack,Always Discreet Underwear I…10 per pack,£9,90p each,
Always Discreet Underwear Incontinence Pants Normal Medium 12 pack,Always Discreet Underwear I…12 per pack,£9,75p each,
Always Discreet Underwear Incontinence Pants Plus Large 8 pack,Always Discreet Underwear Incontine…8 per pack,£9,£1.13 each,
Always Discreet Underwear Incontinence Pants Plus M 9 pack,Always Discreet Underwear Inconti…9 per pack,£9,£1.00 each,
Always Discreet Underwear Incontinence Pants Plus XL 7 pack,Always Discreet Underwear Inconti…7 per pack,£9,£1.29 each,
Anadin Extra,Anadin Extra16 per pack,£1.80,11.3p each,"Offer price £1.80, was £2.19"
Anadin Extra Soluble 12 Soluble Tablets,Anadin Extra Soluble 12 Soluble Tablets,£3.50,,
Anadin Joint Pain Tablets 200mg,Anadin Joint Pain Tablets 200mg16 per pack,£2.20,13.8p each,
Anadin Original Caplets,Anadin Original Caplets16 per pack,£1.65,10.3p each,
Anadin Paracetamol      ,Anadin Paracetamol      16 per pack,£1.50,9.4p each,
Anadin Ultra Gel Caps,Anadin Ultra Gel Caps16 per pack,£3,18.8p each,
Andrews Original Salts,Andrews Original Salts150g,£5,£3.33 per 100g,
Anusol Haemorrhoid Treatment Cream,Anusol Haemorrhoid Treatment Cream23g,£4.30,£18.70 per 100g,
Anusol Natural Cream,Anusol Natural Cream30g,£7,£23.33 per 100g,
Anusol Soothing Relief Ointment ,Anusol Soothing Relief Ointment 15g,£6.20,£41.33 per 100g,
Anusol Soothing Relief Suppositories,Anusol Soothing Relief Suppositories12 per pack,£6.80,56.7p each,
Anusol Suppositories,Anusol Suppositories12 per pack,£4.50,37.5p each,
Aveeno Dermexa Daily Emollient Body Wash ,Aveeno Dermexa Daily Emollient Body Wash 300ml,£11,£3.67 per 100ml,
Aveeno Dermexa Daily Emollient Cream ,Aveeno Dermexa Daily Emollient Cream 200ml,£10.50,£5.25 per 100ml,
Balance Activ Bv Pessaries  ,Balance Activ Bv Pessaries  7 per pack,£8.20,£1.17 each,"Offer price £8.20, was £10.20"
Balance Active BV Gel,Balance Active BV Gel7 per pack,£8,£1.14 each,
Barebells Salt Peanut Protein Bar,Barebells Salt Peanut Protein Bar55g,£2.50,£4.55 per 100g,
Bassetts 12-18 Years Multi Vitamins Orange & Passionfruit ,Bassetts 12-18 Years Multi Vitami…30 per pack,£6.25,20.8p each,
Bassetts 3-6 Multi Vitamins & Omega 3 Blackcurrant & Apple,Bassetts 3-6 Multi Vitamins & Ome…30 per pack,£5.75,19.2p each,
Bassetts 3-6 Multivitamin Strawberry ,Bassetts 3-6 Multivitamin Strawberry 30 per pack,£4.49,15p each,
Bassetts 7-11 Multivitamin Raspberry,Bassetts 7-11 Multivitamin Raspberry30 per pack,£5.75,19.2p each,
Bassetts Adult Multi Vitamin Raspberry & Pomegranate,Bassetts Adult Multi Vitamin…30 per pack,£6,20p each,
Bassetts Adult Multi Vitamins Raspberry & Pomegranate Flavour,Bassetts Adult Multi Vitamins Raspb…60 per pack,£10,16.7p each,
Bassetts Vitamins Immune Support 7-11 Years Orange Flavour 30 Chewies,Bassetts Vitamins Immune Supp…,£5.25,,
Bazuka Extra Strength Gel,Bazuka Extra Strength Gel6g,£7.50,£125.00 per 100g,"Offer price £7.50, was £10"
Bazuka Sub - Zero,Bazuka Sub - Zero50ml,£15,£30.00 per 100ml,
Bazuka Treatment Gel,Bazuka Treatment Gel6g,£4.70,£78.33 per 100g,"Offer price £4.70, was £6"
"Becocleanse Nasal Spray - Daily Hygiene, Runny Nose & Allergy Prevention","Becocleanse Nasal Spray - Daily Hygiene, Ru…135ml",£8,£5.93 per 100ml,
Becodefence Allergy Defence Nasal Spray - Non-drowsy - 120 sprays,Becodefence Allergy Defence Nasal Spr…20ml,£10,£50.00 per 100ml,
Becodefence Plus Allergy Defence Nasal Spray - Non-drowsy - 120 sprays,Becodefence Plus Allergy Defence Nasal Sp…20ml,£12,£60.00 per 100ml,
Beconase Hayfever Relief Nasal Spray - Non-drowsy - 100 Sprays,Beconase Hayfever Relief Nasal Spra…100ml,£6,£6.00 per 100ml,
Beechams All-in-One Tablets,Beechams All-in-One Tablets16 per pack,£4,25p each,
Beechams Breathe Clear Hot Honey & Lemon Sachets,Beechams Breathe Clear Hot…10 per pack,£3.50,35p each,
Beechams Flu Plus Caplets,Beechams Flu Plus Caplets16 per pack,£3.85,24.1p each,
Beechams Powder Sachets,Beechams Powder Sachets10 per pack,£2.60,26p each,
Beechams Ultra All In One Capsules,Beechams Ultra All In One Capsules16 per pack,£5.75,35.9p each,
Bell's Healthcare Children's Cough Relief,Bell's Healthcare Children's Cough Relief200ml,£1.90,95p per 100ml,
Benacort Steroid Nasal Spray,Benacort Steroid Nasal Spray10ml,£6.50,£65.00 per 100ml,"Offer price £6.50, was £10"
Benadryl Allergy Natural Relief Spray,Benadryl Allergy Natural Relief Spray15ml,£6,£40.00 per 100ml,
Benadryl Allergy Relief,Benadryl Allergy Relief12 per pack,£4.75,39.6p each,
Benadryl Allergy Relief 24 Capsules,Benadryl Allergy Relief 24 Capsules24 per pack,£7.20,30p each,"Offer price £7.20, was £9"
Benadryl For Children Allergy Solution,Benadryl For Children Allergy Solution70ml,£6,£8.57 per 100ml,
Benadryl One a Day Relief,Benadryl One a Day Relief14 per pack,£6.50,46.4p each,
Benadryl One A Day Tablets ,Benadryl One A Day Tablets 30 per pack,£6.50,21.7p each,"Offer price £6.50, was £10"
Benylin Chesty Coughs Non-Drowsy Liquid,Benylin Chesty Coughs Non-Drowsy Liquid150ml,£5,£3.33 per 100ml,
Benylin Childrens Cough Syrup Apple,Benylin Childrens Cough Syrup Apple125ml,£4,£3.20 per 100ml,
Benylin Dry & Tickly Cough Syrup,Benylin Dry & Tickly Cough Syrup300ml,£8.90,£2.97 per 100ml,
Benylin Herbal Chesty Cough Sugar Free,Benylin Herbal Chesty Cough Sugar Free100ml,£6.50,£6.50 per 100ml,
Benylin Menthol Max,Benylin Menthol Max150ml,£5,£3.33 per 100ml,
Benylin Mucus Cough Honey & Lemon,Benylin Mucus Cough Honey & Lemon150ml,£5,£3.33 per 100ml,
Benylin Mucus Cough Max Honey & Lemon Syrup ,Benylin Mucus Cough Max Honey & Lemon Syrup 300ml,£8.90,£2.97 per 100ml,
Bepanthen Tattoo Intense Care Ointment,Bepanthen Tattoo Intense Care Ointment50g,£6.50,£13.00 per 100g,
Berocca Boost + Guarana Acerola Cherry 10 Effervescent Tablets,Berocca Boost + Guarana Acerola Che…10 per pack,£4.50,45p each,"Offer price £4.50, was £6"
Berocca Energy Food Supplement Blackcurrant Effervescent Tablets,Berocca Energy Food Supplement Blackc…15 per pack,£4.25,28.3p each,"Offer price £4.25, was £5"
Berocca Energy Food Supplement Blackcurrant Effervescent Tablets,Berocca Energy Food Supplement Blackc…45 per pack,£13.65,30.3p each,
Berocca Energy Food Supplement Mango Effervescent Tablets,Berocca Energy Food Supplement Ma…15 per pack,£4.25,28.3p each,"Offer price £4.25, was £5"
Berocca Energy Food Supplement Mango Effervescent Tablets,Berocca Energy Food Supplement Ma…45 per pack,£13.65,30.3p each,
Berocca Energy Food Supplement Mixed Berry Effervescent Tablets,Berocca Energy Food Supplement Mixed…15 per pack,£4.25,28.3p each,"Offer price £4.25, was £5"
Berocca Energy Food Supplement Orange Effervescent Tablets,Berocca Energy Food Supplement Or…15 per pack,£4.25,28.3p each,"Offer price £4.25, was £5"
Berocca Immuno - Energy & Immune Support 15 Tablets,Berocca Immuno - Energy & Imm…15 per pack,£7.50,50p each,
Berocca Orange Effervescent Energy Vitamin Tablets,Berocca Orange Effervescent…45 per pack,£13.65,30.3p each,
BetterYou B-Complete Oral Spray,BetterYou B-Complete Oral Spray25ml,£14.95,£59.80 per 100ml,
BetterYou Children's Health Daily Oral Spray,BetterYou Children's Health Daily Oral Spray25ml,£15.15,£6.06 per 10ml,
BetterYou Conception Daily Oral Spray,BetterYou Conception Daily Oral Spray25ml,£15.15,£6.06 per 10ml,
BetterYou D1000 Vegan Vitamin D Oral Spray  ,BetterYou D1000 Vegan Vitamin D Oral Spray  15ml,£9.95,£66.33 per 100ml,
BetterYou D400 Kid's Vitamin D Daily Oral Spray 3yrs+ ,BetterYou D400 Kid's Vitamin D…15ml,£6.50,£43.33 per 100ml,
BetterYou D400 Kid's Vitamin D Daily Oral Spray under 3yrs,BetterYou D400 Kid's Vitamin D Da…15ml,£6,£40.00 per 100ml,
Betteryou Dlux 1000 Vitamin D Daily Oral Spray,Betteryou Dlux 1000 Vitam…15ml,£7,£4.67 per 10ml,
Betteryou Dlux 3000 Vitamin D Oral Spray,Betteryou Dlux 3000 Vitamin D Oral Spray15ml,£8,£5.33 per 10ml,
"BetterYou Hair, Skin & Nails Daily Oral Spray","BetterYou Hair, Skin & Nails Daily Oral Spray25ml",£20.25,£8.10 per 10ml,
BetterYou Immune Health Daily Oral Spray,BetterYou Immune Health Daily Oral Spray50ml,£12.50,£25.00 per 100ml,
BetterYou Iron 10 Daily Oral Spray ,BetterYou Iron 10 Daily Oral Spray 25ml,£14.95,£59.80 per 100ml,
Betteryou Iron Daily Oral Spray,Betteryou Iron Daily Oral Spray25ml,£10,£4.00 per 10ml,
BetterYou Magnesium Oil Body Spray,BetterYou Magnesium Oil Body Spray100ml,£12.50,£12.50 per 100ml,
BetterYou Magnesium Sleep Lotion,BetterYou Magnesium Sleep Lotion180ml,£9.95,£5.53 per 100ml,
Betteryou Multivitamin Daily Oral Spray,Betteryou Multivitamin Daily Oral Spray25ml,£10,£4.00 per 10ml,
BetterYou Pregnancy Daily Oral Spray,BetterYou Pregnancy Daily Oral Spray25ml,£15.15,£6.06 per 10ml,
BetterYou Vitamin D & K2 Daily Oral Spray  ,BetterYou Vitamin D & K2 Daily Oral Spray  12ml,£9.95,£82.92 per 100ml,
Bio-Kult Advanced Multi Action Formulation,Bio-Kult Advanced Multi Action Formulation30 per pack,£10.50,35p each,
Bio-Synergy Beauty From Within Gummies,Bio-Synergy Beauty From Within Gummies60 per pack,£26.30,43.8p each,
Bio-Synergy Body Perfect Fat Burner Capsules,Bio-Synergy Body Perfect Fat Burner Capsules60 per pack,£20,33.3p each,
Bio-Synergy Body Perfect Gummies,Bio-Synergy Body Perfect Gummies60 per pack,£26.30,43.8p each,
Bio-Synergy Chocolate Whey Better Protein Powder,Bio-Synergy Chocolate Whey…750g,£38.50,£5.13 per 100g,
Bio-Synergy Green Tea and Green Coffee Tea Capsules,Bio-Synergy Green Tea and Gre…90 per pack,£22,24.4p each,
Bio-Synergy Strawberry Whey Better Protein Powder,Bio-Synergy Strawberry Whey…750g,£38.50,£5.13 per 100g,
Bio-Synergy Vanilla Whey Better Protein Powder,Bio-Synergy Vanilla Whey Better Protein Powder750g,£38.50,£5.13 per 100g,
Bio-Synergy Whey Hey Brazilian Coffee Protein Powder,Bio-Synergy Whey Hey Brazilia…908g,£30,£3.30 per 100g,
Bio-Synergy Whey Hey Coconut Protein Powder,Bio-Synergy Whey Hey Coconut Protein Powder908g,£30,£3.30 per 100g,
Bio360 OptiGUT-C (15 Billion Bacteria) Powder from Natures Aid,Bio360 OptiGUT-C (15 Billion Bacter…120g,£15,£12.50 per 100g,
Bio360 Pro-100 Ultra Capsules from Natures Aid,Bio360 Pro-100 Ultra Caps…30 per pack,£45,£1.50 each,
Bioglan Active Curcumin,Bioglan Active Curcumin30 per pack,£24.99,83.3p each,
Bioglan Active Magnesium Tablets,Bioglan Active Magnesium Tablets120 per pack,£16.99,14.2p each,
Bioglan Beauty Collagen Tablets,Bioglan Beauty Collagen Tablets90 per pack,£22.99,25.5p each,
Bioglan Biotic Balance Dark Chocballs ,Bioglan Biotic Balance Dark Chocballs 75g,£14,£1.87 per 10g,
Bioglan Biotic Balance Gummies,Bioglan Biotic Balance Gummies30 per pack,£13.75,45.8p each,
Bioglan Biotic Balance Kid's Milk Chocballs  ,Bioglan Biotic Balance Kid's Milk Chocballs  75g,£9.50,£1.27 per 10g,
Bioglan Biotic Balance Ultimate Flora Capsules ,Bioglan Biotic Balance Ultimate Flora Capsules 30 per pack,£20,66.7p each,
Bioglan Curcumin Gummies,Bioglan Curcumin Gummies30 per pack,£13.75,45.8p each,
Bioglan Smart Kid's Brain Formula Omega-3 Capsules ,Bioglan Smart Kid's Brain For…30 per pack,£9.99,33.3p each,
Bioglan SmartKids Vitagummies Happy Tummies  ,Bioglan SmartKids Vitagum…30 per pack,£7,23.3p each,
Bioglan SmartKids Vitagummies Iron ,Bioglan SmartKids Vitagummies Iron 30 per pack,£7,23.3p each,
Bioglan SmartKids Vitagummies Vitamin D  ,Bioglan SmartKids Vitagummies Vitamin D  30 per pack,£7,23.3p each,
"Bioglan VitaGummies for Adults, Womens Multivitamins",Bioglan VitaGummies for Adult…60 per pack,£9.99,16.7p each,
Bio Kult Infantis,Bio Kult Infantis16 per pack,£13,81.3p each,
Biona Organic Date Syrup ,Biona Organic Date Syrup 350g,£3.70,£1.06 per 100g,
Biona Organic Kimchi,Biona Organic Kimchi350g,£4,£1.14 per 100g,
Biona Organic Sauerkraut ,Biona Organic Sauerkraut 360g,£2,55.6p per 100g,
Biona Organic Seitan Pieces,Biona Organic Seitan Pieces350g,£3.50,£1.00 per 100g,
Biona Organic Tempeh ,Biona Organic Tempeh 400g,£3,75p per 100g,
Biona Peanut Butter,Biona Peanut Butter250g,£3,£1.20 per 100g,
Biona Spelt Fusilli Wholegrain,Biona Spelt Fusilli Wholegrain500g,£2.50,50p per 100g,
Biona Spelt Spaghetti Wholegrain,Biona Spelt Spaghetti Wholegrain500g,£2.50,50p per 100g,
Blistex Lipcare Intensive Moisuriser ,Blistex Lipcare Intensive Moisuriser 5g,£2.50,£50.00 per 100g,
Blistex Lip Infusions Hydration Spf 15,Blistex Lip Infusions Hydration Spf 153.7g,£3,£81.08 per 100g,
Bonjela Adult Sugar Free Oral Pain Relieving Gel,Bonjela Adult Sugar Free Oral Pain Relieving Gel15g,£5,£33.33 per 100g,
Bonjela Cool Mint Adult Gel        ,Bonjela Cool Mint Adult Gel        15g,£5.50,£36.67 per 100g,
Bonjela Junior Oral Gel,Bonjela Junior Oral Gel15g,£4,£26.67 per 100g,
Bounce Caramel Protein Ball ,Bounce Caramel Protein Ball 40g,£2.10,£5.25 per 100g,
Bounce Choc Brownie Protein Ball,Bounce Choc Brownie Protein Ball40g,£2.10,£5.25 per 100g,
Bounce Hazelnut Protein Ball,Bounce Hazelnut Protein Ball40g,£2.10,£5.25 per 100g,
Brave Ape Blueberry & Cinnamon Instant Keto Porridge,Brave Ape Blueberry & Cinnamo…240g,£5.75,£2.40 per 100g,
Brave Crunchy Chickpeas BBQ,Brave Crunchy Chickpeas BBQ115g,£2,£1.74 per 100g,
Brave Crunchy Chickpeas Cookies & Cream,Brave Crunchy Chickpeas Cookies & Cream100g,£2.40,£2.40 per 100g,
Brave Crunchy Chickpeas Dark Chocolate,Brave Crunchy Chickpeas Dark Chocolate100g,£2.40,£2.40 per 100g,
Brave Crunchy Chickpeas Sea Salt,Brave Crunchy Chickpeas Sea Salt115g,£2,£1.74 per 100g,
Breathe Right Nasal Strip Tan Large ,Breathe Right Nasal Strip Tan Large 10 per pack,£4,40p each,
Bronchostop Cough Pastilles - 10 On-the-Go Cough Pastilles,Bronchostop Cough Pastilles - 10…10 per pack,£4,40p each,
Bronchostop Cough Syrup - Traditionally Used to Relieve Any Type of Cough,Bronchostop Cough Syrup - Traditionally Use…120ml,£6,£5.00 per 100ml,
Bronchostop Cough Syrup - Traditionally Used to Relieve Any Type of Cough,Bronchostop Cough Syrup - Traditionally Use…200ml,£9,£4.50 per 100ml,
Bronchostop Junior Cough Syrup,Bronchostop Junior Cough Syrup120ml,£6,£5.00 per 100ml,
Bronchostop Junior From 1 Year Cough Syrup 200Ml,Bronchostop Junior From 1 Year Cough Syrup 200Ml200ml,£9,£4.50 per 100ml,
Burt's Bees Beeswax Lip Balm,Burt's Bees Beeswax Lip Balm4.25g,£4,£9.41 per 10g,
Burt's Bees Ultra Conditioning Lip Balm,Burt's Bees Ultra Conditioning Lip Balm4.25g,£3.50,£8.24 per 10g,
Buscomint Peppermint Oil 0.2Ml 24 Soft Gel Capsules,Buscomint Peppermint Oil 0.2M…,£7.50,,
Buscopan IBS Relief,Buscopan IBS Relief20 per pack,£3.99,20p each,
Buttercup Original Cough Syrup,Buttercup Original Cough Syrup200ml,£5.99,£3.00 per 100ml,
Cadbury Delights Hazelnut,Cadbury Delights Hazelnut5 x 110g,£1.35,24.5p per 100g,
Cadbury Delights Orange,Cadbury Delights Orange5 x 110g,£1.35,24.5p per 100g,
Cadbury Delights Salted Caramel,Cadbury Delights Salted Caramel5 x 110g,£1.35,24.5p per 100g,
Calcough Childrens Syrup  Blackcurrant,Calcough Childrens Syrup  Blackcurrant125ml,£4.50,£3.60 per 100ml,
Calpol 2+ Months Infant Strawberry Liquid Paracetamol,Calpol 2+ Months Infant Straw…100ml,£3.50,£3.50 per 100ml,
Calpol 6+ Sugar Free Strawberry Liquid Paracetamol,Calpol 6+ Sugar Free Strawb…80ml,£3.50,£4.38 per 100ml,
Calpol 6+ Years Sugar Free Strawberry Fastmelts Paracetamol,Calpol 6+ Years Sugar Free Strawb…12 per pack,£4,33.3p each,
Calpol 6+ Years Sugar Free Strawberry Paracetamol Sachets,Calpol 6+ Years Sugar Free Strawb…12 x 5ml,£4,£6.67 per 100ml,
Calpol Infant 2+ Months Sugar Free Strawberry Liquid,Calpol Infant 2+ Months Sugar…100ml,£3.50,£3.50 per 100ml,
Calpol Nasal Drops      ,Calpol Nasal Drops      10ml,£3.50,£35.00 per 100ml,
Calpol Saline Nasal Spray,Calpol Saline Nasal Spray15ml,£4.25,£28.33 per 100ml,
Calpol Sugar Free Infant Sachets,Calpol Sugar Free Infant Sachets12 x 5ml,£4,£6.67 per 100ml,
Calpol Vapour Plug Nightlight 3 Refill Pads,Calpol Vapour Plug Nightlight 3 Refill Pads3 per pack,£7.50,£2.50 each,
Calpol Vapour Plug Refill Pads,Calpol Vapour Plug Refill Pads5 per pack,£7,£1.40 each,
Calprofen Ibuprofen,Calprofen Ibuprofen100ml,£4.25,£4.25 per 100ml,
 Canesbalance Bacterial Vaginosis Vaginal Gel, Canesbalance Bacterial Vaginosis Vaginal Gel7 per pack,£14,£2.00 each,
Canesbalance Bacterial Vaginosis Vaginal Pessaries,Canesbalance Bacterial Vagi…7 per pack,£14,£2.00 each,
Canescool Soothing Cream Gel,Canescool Soothing Cream Gel15g,£6,£40.00 per 100g,
CanesOasis Cystitis Relief 4g Granules for Oral Solution Cranberry Flavour,CanesOasis Cystitis Relief 4g G…6 per pack,£5.65,94.2p each,
Canesten Dual Action Athlete's Foot 1% w/w Cream,Canesten Dual Action Athlet…30g,£5,£16.67 per 100g,
Canesten Thrush Combi Internal & External Cream,Canesten Thrush Combi Internal & External Cream,£13,,
Canesten Thrush Combi Pessary & External Cream,Canesten Thrush Combi Pessary & External Cream10g,£14,£140.00 per 100g,
Canesten Thrush Combi Soft Gel Pessary & External Cream,Canesten Thrush Combi Soft Gel…100g,£16,£16.00 per 100g,
Canestest Self-Test for Vaginal Infections,Canestest Self-Test for Vaginal Infections,£7.50,,
CANNACOFFEE Original CBD Coffee Pods,CANNACOFFEE Original CBD Coffee Pods10 per pack,£7.50,75p each,
Cannaray Cbd Bright Days Oil Drops,Cannaray Cbd Bright Days Oil Drops10ml,£18,£18.00 per 10ml,
Cannaray Cbd Gummies,Cannaray Cbd Gummies30 per pack,£18,60p each,
Cannaray Cbd Night Time Oil Drops,Cannaray Cbd Night Time Oil Drops10ml,£18,£18.00 per 10ml,
Captain Kombucha Ginger Lemon ,Captain Kombucha Ginger Lemon 400ml,£2.50,62.5p per 100ml,
Captain Kombucha Legendary Bubbly Drink Californian Raspberry 400Ml,Captain Kombucha Legendary…400ml,£2.50,62.5p per 100ml,
Captain Kombucha Legendary Bubbly Drink Original,Captain Kombucha Legendary…400ml,£2.50,62.5p per 100ml,
Carbzone Low Carb Dark Chocolate 70%,Carbzone Low Carb Dark Chocolate 70%100g,£2.85,£2.85 per 100g,
Carbzone Low Carb Milk Chocolate,Carbzone Low Carb Milk Chocolate100g,£3,£3.00 per 100g,
Carbzone Low Carb Organic Almond Flour ,Carbzone Low Carb Organic Almond Flour 500g,£12,£24.00 per kg,
Care Senna Tablets 20 Tablets,Care Senna Tablets 20 Tablets,£1.50,,
Carex Antibacterial Hand Gel Aloe Vera,Carex Antibacterial Hand Gel Aloe Vera50ml,£1,£2.00 per 100ml,"Offer price £1, was £1.25"
Carex Antibacterial Love Hearts Hand Gel,Carex Antibacterial Love Hearts Hand Gel50ml,£1,£2.00 per 100ml,"Offer price £1, was £1.25"
Centrum Advance 50+ Multivitamins,Centrum Advance 50+ Multivitamins30 per pack,£4.50,15p each,
Centrum Advance For Men,Centrum Advance For Men30 per pack,£6.50,21.7p each,
Centrum Advance For Women,Centrum Advance For Women30 per pack,£6.50,21.7p each,
Centrum Advance Tablets,Centrum Advance Tablets30 per pack,£4.50,15p each,
Centrum Immunity & Cell Protection Tablets,Centrum Immunity & Cell Protection Tablets60 per pack,£7.50,12.5p each,
Centrum Men 50 Plus MultiVitamins,Centrum Men 50 Plus MultiVitamins30 per pack,£5,16.7p each,"Offer price £5, was £6.50"
Centrum Multi Gummies Mixed 30 Gummies,Centrum Multi Gummies Mixed 30 Gummies,£6.50,,
Centrum Performance Tablets,Centrum Performance Tablets30 per pack,£6.50,21.7p each,
Centrum Women 50 Plus MultiVitamins,Centrum Women 50 Plus MultiVitamins30 per pack,£5,16.7p each,"Offer price £5, was £6.50"
Centrum Women 60 Tablets Multivitamin Multimineral Food Supplement,Centrum Women 60 Tablets Mu…,£13,,
Cetraben Oatmeal Cream,Cetraben Oatmeal Cream190g,£9,£4.74 per 100g,
