name,Price Per Unit,Price Per Measure,Promotion
Nicorette Cools 2mg Lozenge- Icy Mint (Stop Smoking Aid),Nicorette Cools 2mg Lozenge- Ic…80 per pack,£18,22.5p each,
Nicorette Cools 4mg Lozenge- Icy Mint (Stop Smoking Aid),Nicorette Cools 4mg Lozenge- Ic…,£18,,
Nicorette Gum Original Flavour 4Mg,Nicorette Gum Original Flavour 4Mg210 per pack,£24,11.4p each,
Nicorette Icy White 2mg Gum (Stop Smoking Aid),Nicorette Icy White 2mg Gum (Stop Smoking Aid)105 per pack,£15.50,14.8p each,
Nicorette Icy White 2mg Gum (Stop Smoking Aid),Nicorette Icy White 2mg Gum (Stop Smoking Aid),£24,,
Nicorette Icy White 4mg Gum (Stop Smoking Aid),Nicorette Icy White 4mg Gum (Stop Smoking Aid)105 per pack,£15.49,14.8p each,
Nicorette Invisi 25mg Patch (Stop Smoking Aid),Nicorette Invisi 25mg Patch (Stop Smoking Aid)7 per pack,£14,£2.00 each,
Nicorette Nasal Spray,Nicorette Nasal Spray10ml,£23,£23.00 per 10ml,
Nicorette Original 2mg  Gum (Stop Smoking Aid),Nicorette Original 2mg  Gum (Stop Smoking Aid)210 per pack,£24,11.4p each,
Nicorette Original 4mg Gum (Stop Smoking Aid),Nicorette Original 4mg Gum (Stop Smoking Aid)105 per pack,£10,9.5p each,
Nicorette Original Nicotine Gum Sugar Free 2mg,Nicorette Original Nicotine Gum Sugar Free 2mg105 per pack,£15.49,14.8p each,
Nicorette QuickMist Cool Berry Mouthspray  (Stop Smoking Aid),Nicorette QuickMist Cool Berry Mout…150ml,£20,£13.33 per 100ml,
Nicorette QuickMist Mouthspray Freshmint (Stop Smoking Aid),Nicorette QuickMist Mouthspray Fr…,£20,,
Nicorette QuickMist Mouthspray Freshmint (Stop Smoking Aid),Nicorette QuickMist Mouthspray Fr…2 per pack,£29,£14.50 each,
Nicorette Quickmist Smarttrack Mouthspray + App 150 Sprays,Nicorette Quickmist Smarttrack Mo…150 per pack,£17,11.3p each,
Nicotinell 1MG Lozenge 204S,Nicotinell 1MG Lozenge 204S,£20,,
Nicotinell 24 Hour Patch 21 Mg  ,Nicotinell 24 Hour Patch 21 Mg  7 per pack,£9,£1.28 each,"Offer price £9, was £12"
Nicotinell 2mg Lozenge 204'S,Nicotinell 2mg Lozenge 204'S,£20,,
Nicotinell Fruit Nicotine Gum 2mg,Nicotinell Fruit Nicotine Gum 2mg96 per pack,£13,13.5p each,
Nicotinell Lozenge Mint 1 Mg,Nicotinell Lozenge Mint 1 Mg144 per pack,£17.50,12.2p each,
Nicotinell Mint Lozenge 2 Mg      ,Nicotinell Mint Lozenge 2 Mg      144 per pack,£17.50,12.2p each,
Nicotinell Mint Nicotine Gum 2mg,Nicotinell Mint Nicotine Gum 2mg96 per pack,£13,13.5p each,
Nicotinell Mint Nicotine Lozenge 1mg,Nicotinell Mint Nicotine Lozenge 1mg96 per pack,£11,11.4p each,"Offer price £11, was £13"
Nicotinell Mint Nicotine Lozenge 2mg,Nicotinell Mint Nicotine Lozenge 2mg96 per pack,£11,11.4p each,"Offer price £11, was £13"
"NiQuitin Clear Patch - Step 1 21mg, 14 Nicotine Patches - Stop Smoking Aid",NiQuitin Clear Patch - Step 1 2…14 per pack,£20,£1.43 each,
"NiQuitin Clear Patch -Step 1 21mg, 7 Nicotine Patches - Stop Smoking Aid",NiQuitin Clear Patch -Step 1 21…7 per pack,£14,£2.00 each,
"NiQuitin Clear Patch - Step 2 14mg, 7 Nicotine Patches - Stop Smoking Aid",NiQuitin Clear Patch - Step 2 1…7 per pack,£14,£2.00 each,
"NiQuitin Mini Mint Nicotine Lozenges -1.5mg, 60 Minis - Stop Smoking Aid",NiQuitin Mini Mint Nicotine Lozenges -1.5mg…3 x 20 per pack,£16,26.7p each,
"NiQuitin Mini Mint Nicotine Lozenges -4mg, 60 Minis - Stop Smoking Aid",NiQuitin Mini Mint Nicotine Lozenges -4mg…60 per pack,£16,26.7p each,
Niquitin Minis Mint 1.5Mg 100 Lozenges,Niquitin Minis Mint 1.5Mg 100 Lozenges,£22,,
Niquitin Minis Mint 4Mg 100 Lozenges,Niquitin Minis Mint 4Mg 100 Lozenges100 per pack,£19.80,19.8p each,
"NiQuitin Mint Lozenge - 4mg, 72 Nicotine Lozenges -Stop Smoking Aid",NiQuitin Mint Lozenge - 4mg…72 per pack,£10,13.9p each,
Nivea Hydro Care Lip Balm With Spf 15,Nivea Hydro Care Lip Balm With Spf 154.8g,£2,£41.67 per 100g,
Nivea Original Care Lip Balm,Nivea Original Care Lip Balm4.8g,£2.35,£48.96 per 100g,
Nordic Spirit Mocha Strong,Nordic Spirit Mocha Strong,£5.50,,
Nudie Cheese & Onion Cauliflower Crisps,Nudie Cheese & Onion Cauliflower Crisps,£2,,
Nudie Katsu Cauliflower Crisps,Nudie Katsu Cauliflower Crisps22g,£1,£4.55 per 100g,
Nurofen Express 256mg Pain Relief Tablets Ibuprofen,Nurofen Express 256mg Pain Re…16 per pack,£4,25p each,
Nurofen Express Ibuprofen Caplets 256mg,Nurofen Express Ibuprofen Caplets 256mg12 per pack,£3,25p each,
Nurofen Express Pain Relief 200mg Liquid Capsules Ibuprofen,Nurofen Express Pain Relief 200mg…16 per pack,£4,25p each,
Nurofen Express Pain Relief 200mg Liquid Capsules Ibuprofen,Nurofen Express Pain Relief 200mg…10 per pack,£3,30p each,
Nurofen Express Pain Relief 200mg Liquid Capsules Ibuprofen,Nurofen Express Pain Relief 200mg…6 per pack,£2,33.3p each,
Nurofen for Children Orange Oral Suspension 3mths to 9yrs Ibuprofen,Nurofen for Children Orange Oral Suspen…100ml,£3.85,£3.85 per 100ml,
Nurofen for Children Strawberry Oral Suspension 3mths to 9yrs,Nurofen for Children Strawberry Ora…100ml,£3.85,£3.85 per 100ml,
Nurofen Joint & Back Pain Relief Max Strength 10% Gel Ibuprofen,Nurofen Joint & Back Pain Relief Max…40g,£7.50,£18.75 per 100g,
Nurofen Joint & Muscular Pain Relief 200Mg Medicated Plasters,Nurofen Joint & Muscular Pain Relie…2 per pack,£8,£4.00 each,
Nurofen Meltlets Self-Dissolving Pain Relief Tablets Lemon 200mg Ibuprofen,Nurofen Meltlets Self-Dissolvin…12 per pack,£4,33.3p each,
Nurofen Migraine Pain Ibuprofen Caplets 342mg,Nurofen Migraine Pain Ibuprofen Caplets 342mg12 per pack,£3.20,26.7p each,
Nurofen Pain Relief 200mg Soft Capsules Ibuprofen,Nurofen Pain Relief 200mg S…16 per pack,£4,25p each,
Nurofen Pain Relief 200mg Tablets Ibuprofen,Nurofen Pain Relief 200mg Tablets Ibuprofen16 per pack,£2,12.5p each,
Nurofen Pain Relief 256mg Caplets Ibuprofen,Nurofen Pain Relief 256mg Caplets Ibuprofen16 per pack,£3.50,21.9p each,
Nuromol Dual Action Pain Relief,Nuromol Dual Action Pain Relief12 per pack,£4,33.3p each,
Nuromol Dual Action Pain Relief,Nuromol Dual Action Pain Relief16 per pack,£5,31.3p each,
Nuromol Dual Action Pain Relief 6 Tablets,Nuromol Dual Action Pain Relief 6 Tablets6 per pack,£2.50,41.7p each,
Nutrigums Apple Cider Vinegar Gummies,Nutrigums Apple Cider Vinegar Gummies60 per pack,£5.60,9.3p each,"Offer price £5.60, was £8"
Nutrigums Hair Vitamin Complex Gummies Cherry Flavour Gummies,Nutrigums Hair Vitamin Complex Gumm…60 per pack,£8,13.3p each,
Nutrigums Immune Support Gummies Blueberry Flavour Gummies,Nutrigums Immune Suppor…60 per pack,£5.60,9.3p each,"Offer price £5.60, was £8"
Nutrigums Turmeric Black Pepper & Ginger Gummies ,Nutrigums Turmeric Black Pepper & Ginger Gummies 60 per pack,£5.60,9.3p each,"Offer price £5.60, was £8"
Nutrigums Vitamin C Gummies Orange Flavour Gummies,Nutrigums Vitamin C Gummies…60 per pack,£6,10p each,"Offer price £6, was £8"
Nutrigums Vitamin D3 Gummies Lemon Flavour Gummies,Nutrigums Vitamin D3 Gummie…60 per pack,£6,10p each,"Offer price £6, was £8"
Nytol Herbal - Traditional Herbal Remedy Used for Sleeplessness Relief ,Nytol Herbal - Traditional Herbal Remedy…30 per pack,£4,13.3p each,
Nytol Herbal Simply Sleep & Calm Elixir,Nytol Herbal Simply Sleep & Calm Elixir100ml,£5.20,£5.20 per 100ml,
Nytol Simply Sleep Herbal One A Night Tablets,Nytol Simply Sleep Herbal One A Night Tablets21 per pack,£5.20,24.8p each,"Offer price £5.20, was £6"
Ocean's Halo Sea Salt Seaweed Snack,Ocean's Halo Sea Salt Seaweed Snack4g,80p,£20.00 per 100g,
Odor Eaters Deodorising Ultra Comfort Insoles Shoe Care,Odor Eaters Deodorising Ultra C…,£3.80,,
Odor Eaters Foot & Shoe Spray,Odor Eaters Foot & Shoe Spray,£4,,
Oilatum Bath Formula,Oilatum Bath Formula150ml,£5.25,£3.50 per 100ml,
Olbas For Children Decongestant Oil ,Olbas For Children Decongestant Oil 12ml,£4.50,£3.75 per 10ml,
Olbas Inhaler Nasal Stick,Olbas Inhaler Nasal Stick,£2.50,,
Olbas Menthol Pastilles,Olbas Menthol Pastilles45g,£3,£6.67 per 100g,
Olbas Oil Decongestant ,Olbas Oil Decongestant 30ml,£7,£2.33 per 10ml,
One Nutrition Revive & Go Immunity Capsules,One Nutrition Revive & Go Immunity Capsules30 per pack,£22.45,74.8p each,
One Nutrition Vegan Complete Capsules,One Nutrition Vegan Complete Capsules30 per pack,£22.45,74.8p each,
One Nutrition Vitamin B12-Max Oral Spray,One Nutrition Vitamin B12-Max Oral Spray30ml,£13.30,£44.33 per 100ml,
One Nutrition Vitamin D3 Max Oral Spray,One Nutrition Vitamin D3 Max Oral Spray30ml,£13.30,£44.33 per 100ml,
Opticlear Lens Wipes       ,Opticlear Lens Wipes       26 per pack,£1.50,5.8p each,
Optimum Nutrition Chocolate Brownie Protein Crisp Bar,Optimum Nutrition Chocolate B…65g,£1.90,£2.93 per 100g,"Offer price £1.90, was £2.50"
Optimum Nutrition Fruit & Nut Protein Crisp Bar,Optimum Nutrition Fruit & Nut Protein Crisp Bar70g,£1.90,£2.71 per 100g,"Offer price £1.90, was £2.50"
Optimum Nutrition Gold Bcaa Raspberry & Pomegranate,Optimum Nutrition Gold Bcaa R…266g,£22,£8.27 per 100g,"Offer price £22, was £28"
Optimum Nutrition Gold Standard 100% Plant Vanilla,Optimum Nutrition Gold Stan…684g,£14,£2.05 per 100g,
Optimum Nutrition Gold Standard 100% Whey Delicious Strawberry,Optimum Nutrition Gold Standard 100…900g,£30,£3.34 per 100g,"Offer price £30, was £33"
Optimum Nutrition Gold Standard 100% Whey Double Rich Chocolate,Optimum Nutrition Gold Standard 100%…899g,£24,£2.67 per 100g,"Offer price £24, was £33"
Optimum Nutrition Gold Standard 100% Whey Vanilla Ice Cream,Optimum Nutrition Gold Standard 1…900g,£30,£3.34 per 100g,"Offer price £30, was £33"
Optimum Nutrition Gold Standard Pre-Workout Fruit Punch,Optimum Nutrition Gold Standard…330g,£24,£7.27 per 100g,"Offer price £24, was £26"
Optimum Nutrition Plant Protein Bar Chocolate Mint,Optimum Nutrition Plant Pro…60g,£1.90,£3.17 per 100g,"Offer price £1.90, was £2.50"
Optimum Nutrition Plant Protein Bar Chocolate Sea Salt,Optimum Nutrition Plant Protein…60g,£1.90,£3.17 per 100g,"Offer price £1.90, was £2.50"
Optimum Nutrition Whipped Protein Bar Chocolate Caramel,Optimum Nutrition Whipped Prote…60g,£1.90,£3.17 per 100g,"Offer price £1.90, was £2.50"
Optrex Actimist 2In1 Eye Spray,Optrex Actimist 2In1 Eye Spray10ml,£13,£130.00 per 100ml,
Optrex Actimist Double Action Tired And Strained Eyes,Optrex Actimist Double Action…10ml,£16,£160.00 per 100ml,
Optrex Actimist Eye Spray,Optrex Actimist Eye Spray10ml,£13,£130.00 per 100ml,
Optrex Double Action Dry Eye Drops,Optrex Double Action Dry Eye Drops10ml,£10,£100.00 per 100ml,
Optrex Eyedew Dazzling Eye Drops,Optrex Eyedew Dazzling Eye Drops10ml,£5,£50.00 per 100ml,
Optrex Hayfever Relief Eye Drops ,Optrex Hayfever Relief Eye Drops 10ml,£6,£60.00 per 100ml,
Optrex Intensive Dry Eye Drops ,Optrex Intensive Dry Eye Drops 10ml,£5,£50.00 per 100ml,
Optrex Itchy Eyes    ,Optrex Itchy Eyes    10ml,£5,£50.00 per 100ml,
Optrex Multi-Action Eye Wash,Optrex Multi-Action Eye Wash100ml,£4.50,£4.50 per 100ml,
Optrex Night Repair Gel Drops ,Optrex Night Repair Gel Drops 10ml,£10.99,£109.90 per 100ml,
Optrex Refresh Drops,Optrex Refresh Drops10ml,£5,£50.00 per 100ml,
Orajel Dental Gel,Orajel Dental Gel5.3g,£3.50,£66.04 per 100g,
Oral-B Sensitivity & Gum Calm Original Toothpaste,Oral-B Sensitivity & Gum Calm Original Toothpaste75ml,£5,£6.67 per 100ml,
Oshee Vitamin Water Magnesium + B6 ,Oshee Vitamin Water Magnesium + B6 555ml,£1.25,22.5p per 100ml,
Oshee Vitamin Water Vitamins And Minerals ,Oshee Vitamin Water Vitamins And Minerals 555ml,£1.25,22.5p per 100ml,
Osteocare Original,Osteocare Original30 per pack,£5.50,18.3p each,
Otex Express,Otex Express10ml,£5.99,£59.90 per 100ml,
Otex Olive Oil Ear Drops,Otex Olive Oil Ear Drops10ml,£3.20,£32.00 per 100ml,"Offer price £3.20, was £4"
Otrivine Adult Metered Dose 0.1% Nasal Spray,Otrivine Adult Metered Dose 0.1% Nasal Spray10ml,£4,£40.00 per 100ml,"Offer price £4, was £4.49"
Otrivine Allergy Relief 0.1% Nasal Spray ,Otrivine Allergy Relief 0.1% Nasal Spray 10ml,£4.49,£4.49 per 10ml,
Otrivine Congestion Relief Nasal Spray,Otrivine Congestion Relief Nasal Spray10ml,£5.25,£52.50 per 100ml,
Palmer's Coconut Oil Lip Balm SPF 15 ,Palmer's Coconut Oil Lip Balm SPF 15 4g,£1.50,£37.50 per 100g,"Offer price £1.50, was £2"
Panadol Actifast,Panadol Actifast14 per pack,£3.49,24.9p each,
Panadol Actifast Soluble,Panadol Actifast Soluble24 per pack,£5,20.8p each,
Panadol Extra Advance,Panadol Extra Advance14 per pack,£2.40,17.1p each,"Offer price £2.40, was £2.90"
Panadol Extra Soluble,Panadol Extra Soluble24 per pack,£5.25,21.9p each,
Panadol Original Tablets Paracetamol,Panadol Original Tablets Paracetamol12 per pack,£1.20,10p each,
Paw Patrol Digital Thermometer,Paw Patrol Digital Thermometer,£3,,
Peach Pure Tea Tree Oil ,Peach Pure Tea Tree Oil 10ml,£2.50,£25.00 per 100ml,
Peppa Pig Plasters,Peppa Pig Plasters22 per pack,£2.50,11.4p each,
Phd Charge Sherbet Lemon,Phd Charge Sherbet Lemon300g,£20,£6.67 per 100g,
Phd Diet Plant Strawberries & Cream,Phd Diet Plant Strawberries & Cream500g,£18,£3.60 per 100g,
Phd Diet Whey Belgian Chocolate,Phd Diet Whey Belgian Chocolate1kg,£26.99,£2.70 per 100g,
Phd Diet Whey Vanilla,Phd Diet Whey Vanilla1kg,£26.99,£26.99 per kg,
PhD Nutrition Belgian Chocolate Diet Whey Powder,PhD Nutrition Belgian Choco…1kg,£27,£2.70 per 100g,
PhD Nutrition Caramel Crunch Smart Bar ,PhD Nutrition Caramel Crunch Smart Bar 64g,£2.50,£3.91 per 100g,
PhD Nutrition Chocolate Brownie Smart Bar ,PhD Nutrition Chocolate Brownie Smart Bar 64g,£2.50,£3.91 per 100g,
PhD Nutrition Chocolate Peanut Diet Whey Powder,PhD Nutrition Chocolate Peanut Diet Whey Powder1kg,£27,£2.70 per 100g,
PhD Nutrition Choc Peanut Butter Smart Bar,PhD Nutrition Choc Peanut Butter Smart Bar64g,£2.50,£3.91 per 100g,
PhD Nutrition Cookies & Cream Smart Bar,PhD Nutrition Cookies & Cream Smart Bar64g,£2.50,£3.91 per 100g,
PhD Nutrition Dark Choc Raspberry Smart Bar ,PhD Nutrition Dark Choc Raspberry Smart Bar 64g,£2.50,£3.91 per 100g,
PhD Nutrition Salted Caramel Diet Whey Powder,PhD Nutrition Salted Cara…Typically: 1kg,£27,£2.70 per 100g,
PhD Nutrition Strawberry Delight Diet Whey Powder,PhD Nutrition Strawberry Delight Diet Whey Powder1kg,£27,£2.70 per 100g,
Phd Smart Bar Birthday Cake,Phd Smart Bar Birthday Cake64g,£2.25,£3.52 per 100g,
Phd Smart Bar Salted Fudge Brownie,Phd Smart Bar Salted Fudge Brownie64g,£2.25,£3.52 per 100g,
PHD Smart Protein Chocolate Brownie,PHD Smart Protein Chocolate Brownie510g,£18,£3.53 per 100g,
Phd Smart Protein Plant Chocolate Cookie,Phd Smart Protein Plant Chocolate Cookie500g,£18,£36.00 per kg,
Phd Smart Protein Salted Caramel,Phd Smart Protein Salted Caramel510g,£18,£35.29 per kg,
Phillips' Milk of Magnesia Liquid,Phillips' Milk of Magnesia Liquid200ml,£5,£2.50 per 100ml,
Pirinase Allergy Relief Hayfever Nasal Spray,Pirinase Allergy Relief Hayfever Nasal Spray60 per pack,£6,10p each,
Piriteze Allergy Syrup Sugar Free Banana Flavour,Piriteze Allergy Syrup Suga…70ml,£6,£8.57 per 100ml,
Piriteze Allergy Tablets,Piriteze Allergy Tablets14 per pack,£6,42.9p each,
Piriteze Allergy Tablets One a Day,Piriteze Allergy Tablets One a Day7 per pack,£3,42.9p each,
Piriteze One-A-Day Tablets,Piriteze One-A-Day Tablets30 per pack,£7.50,25p each,
Potters Mucus Cough Pastilles ,Potters Mucus Cough Pastilles 20 per pack,£3,15p each,
Pregnacare Conception,Pregnacare Conception30 per pack,£8.50,28.3p each,
Profoot Double Cushion Insoles,Profoot Double Cushion Insoles,£4,,
Profoot Mycosan Fungal Nail Treatment,Profoot Mycosan Fungal Nail Treatment,£20,,
Profoot Soft Gel Corn Wraps  Z,Profoot Soft Gel Corn Wraps  Z,£3,,
Profusion Gluten Free Chickpea Fusilli,Profusion Gluten Free Chickpea Fusilli250g,£2.80,£1.12 per 100g,
Profusion Gluten Free Chickpea Penne,Profusion Gluten Free Chickpea Penne250g,£2.80,£1.12 per 100g,
Profusion Lasagne Sheets,Profusion Lasagne Sheets250g,£3.80,£1.52 per 100g,
Profusion Spaghetti,Profusion Spaghetti250g,£2.80,£1.12 per 100g,
Promensil Maintenance Menopause Original Formula Supplement Tablets ,Promensil Maintenance Menopau…30 per pack,£20.42,68.1p each,
Promensil Menopause Cooling Spray ,Promensil Menopause Cooling Spray 75ml,£14.99,£19.99 per 100ml,
Promensil Starter Menopause Double Strength Supplement Tablets ,Promensil Starter Menopau…60 per pack,£46.99,78.3p each,
Pro Plus Caffeine Tablets,Pro Plus Caffeine Tablets48 per pack,£4,8.3p each,
Pukka Organic Aloe Vera Juice ,Pukka Organic Aloe Vera Juice 1L,£14.99,£1.50 per 100ml,
Pulsin Keto Bar Chocolate Fudge,Pulsin Keto Bar Chocolate Fudge50g,£1.50,£3.00 per 100g,"Offer price £1.50, was £2"
Pulsin Keto Bar Orange Chocolate,Pulsin Keto Bar Orange Chocolate50g,£1.50,£3.00 per 100g,"Offer price £1.50, was £2"
Pulsin Keto Protein Vanilla,Pulsin Keto Protein Vanilla252g,£15,£5.95 per 100g,"Offer price £15, was £19"
Pyrocalm Control 20mg Gastro-Resistant Tablets Omeprazole,Pyrocalm Control 20mg Gastro-Resi…14 per pack,£11,78.6p each,
Pyrocalm Control 20mg Gastro-Resistant Tablets Omeprazole ,Pyrocalm Control 20mg Gastro-Resi…7 per pack,£7,£1.00 each,
Raw Halo Artisan Raw Chocolate Pure Dark,Raw Halo Artisan Raw Chocolate Pure Dark70g,£3,£4.29 per 100g,
Reign Melon Mania Zero Sugar Energy Drink,Reign Melon Mania Zero Sugar Energy Drink500ml,£1.85,37p per 100ml,Buy 2 for £2.60
Reign Orange Dreamsicle Zero Sugar Energy Drink,Reign Orange Dreamsicle Zero Sugar Energy Drink500ml,£1.85,37p per 100ml,Buy 2 for £2.60
Reign Peach Fizz Zero Sugar Energy Drink ,Reign Peach Fizz Zero Sugar Energy Drink 500ml,£1.85,37p per 100ml,Buy 2 for £2.60
Reign Razzle Berry Zero Sugar Energy Drink,Reign Razzle Berry Zero Sugar Energy Drink500ml,£1.60,32p per 100ml,Buy 2 for £2.60
Rennie Deflatine Wind Relief Chewable Tablets,Rennie Deflatine Wind Relief Chewable Tablets18 per pack,£3.20,17.8p each,
Rennie Liquid Heartburn & Indigestion Relief Peppermint,Rennie Liquid Heartburn & Indig…150ml,£4,£2.67 per 100ml,
Rennie Orange Heartburn & Indigestion Chewable Tablets,Rennie Orange Heartburn & Indig…24 per pack,£2.20,9.2p each,
Rennie Peppermint Heartburn & Indigestion Chewable Tablets,Rennie Peppermint Heartburn & Ind…24 per pack,£2.20,9.2p each,
Rennie Peppermint Heartburn & Indigestion Chewable Tablets,Rennie Peppermint Heartburn & Ind…72 per pack,£5.45,7.6p each,
Rennie Peppermint Heartburn & Indigestion Chewable Tablets,Rennie Peppermint Heartburn & Ind…24 per pack,£2.20,9.2p each,
Rennie Spearmint Heartburn & Indigestion Chewable Tablets,Rennie Spearmint Heartburn & Indi…24 per pack,£2.20,9.2p each,
Rennie Spearmint Heartburn & Indigestion Chewable Tablets,Rennie Spearmint Heartburn & Indi…72 per pack,£5.45,7.6p each,
Rennie Sugar-Free Heartburn & Indigestion Chewable Tablets,Rennie Sugar-Free Heartburn & Ind…24 per pack,£2.20,9.2p each,
Replens MD Long Lasting Vaginal Moisturiser,Replens MD Long Lasting Vaginal Moisturiser35g,£11.50,£3.29 per 10g,
Rescue Night Dropper,Rescue Night Dropper10ml,£7.50,£75.00 per 100ml,
Rescue Pastilles Blackcurrant,Rescue Pastilles Blackcurrant50g,£5.75,£11.50 per 100g,
Rescue Remedy Dropper,Rescue Remedy Dropper10ml,£7.50,£75.00 per 100ml,
Sambucol Black Elderberry Immuno Forte Effervescent Tablets,Sambucol Black Elderberry Immuno…15 per pack,£9,60p each,
Sambucol Extra Defence Syrup,Sambucol Extra Defence Syrup120ml,£12.05,£10.04 per 100ml,
Sambucol Immuno Forte Capsules,Sambucol Immuno Forte Capsules30 per pack,£13.99,46.6p each,
Savlon Antiseptic Cream,Savlon Antiseptic Cream30g,£2.20,73.3p per 10g,
Savlon Plus Advanced Healing Gel,Savlon Plus Advanced Healing Gel50g,£4.60,£9.20 per 100g,
Scholl Athletes Foot Spray,Scholl Athletes Foot Spray150ml,£6.90,£4.60 per 100ml,
Scholl Athlete's Foot Spray,Scholl Athlete's Foot Spray250ml,£6,£2.40 per 100ml,
Scholl Corn Pen ,Scholl Corn Pen 4ml,£12,£30.00 per 10ml,
Scholl Corn Treatment Kit,Scholl Corn Treatment Kit,£6,,
Scholl Cracked Heel Cream,Scholl Cracked Heel Cream60ml,£5,£8.33 per 100ml,
Scholl Fungal Nail Treatment Kit,Scholl Fungal Nail Treatment Kit,£20,,
Scholl Gel Active Work Female,Scholl Gel Active Work Female,£12,,"Offer price £12, was £16"
Scholl Gel Active Work Man,Scholl Gel Active Work Man,£12,,"Offer price £12, was £16"
Scholl Light Legs Tights 20 Denier Nude Extra Large,Scholl Light Legs Tights 20 D…,£14.98,,
Scholl Pressure Point Foam Padding   ,Scholl Pressure Point Foam Padding   ,£2.25,,
Scholl Seal & Heal Verruca Removal Gel,Scholl Seal & Heal Verruca Removal Gel1ml,£7,£700.00 per 100ml,
Scholl Shock Reducer Everyday Insoles One Pair,Scholl Shock Reducer Everyday Insoles One Pair,£6,,
Scholl Velvet Smooth Electronic Foot Care System,Scholl Velvet Smooth Electr…,£30,,
Scholl Verruca and Wart Remover Freeze  Treatment,Scholl Verruca and Wart Rem…80ml,£17,£21.25 per 100ml,
Scholl Wart & Verruca Pen ,Scholl Wart & Verruca Pen 2ml,£16,£800.00 per 100ml,
Sci-Mx Total Protein Chocolate,Sci-Mx Total Protein Chocolate450g,£14,£3.11 per 100g,
Sci-Mx Total Protein Strawberry,Sci-Mx Total Protein Strawberry450g,£14,£3.11 per 100g,
Senokot Max Tablets,Senokot Max Tablets10 per pack,£3.50,35p each,
Senokot Tablets Senna,Senokot Tablets Senna20 per pack,£3.50,17.5p each,
Sensodyne Rapid Relief Original Sensitive Toothpaste,Sensodyne Rapid Relief Origin…75ml,£5,£6.67 per 100ml,
Sensodyne Rapid Relief Whitening Sensitive Toothpaste,Sensodyne Rapid Relief Whiten…75ml,£5,£6.67 per 100ml,
Seven Seas Califig,Seven Seas Califig100ml,£6,£6.00 per 100ml,
Seven Seas Cod Liver Oil High Strength Gelatine Free Omega-3 60 Caps,Seven Seas Cod Liver Oil High Strength…60 per pack,£6.80,11.4p each,"Offer price £6.80, was £7"
Seven Seas Cod Liver Oil One A Day Omega-3 Fish Oil & Vitamin D 120 Caps,Seven Seas Cod Liver Oil One A Day Omega-3…120 per pack,£10,8.3p each,
Seven Seas Cod Liver Oil One A Day Omega-3 Fish Oil & Vitamin D 60 Caps,Seven Seas Cod Liver Oil One A Day Omega…60 per pack,£5.50,9.2p each,
Seven Seas Cod Liver Oil Plus Multivitamins Omega-3 Fish Oil 90 Capsules,Seven Seas Cod Liver Oil Plus M…90 per pack,£10,11.1p each,
Seven Seas Cod Liver Oil Plus Omega-3 Fish Oil Liquid With Vitamin D ,Seven Seas Cod Liver Oil Plus Omega-3 Fis…150ml,£3.75,£2.50 per 100ml,
"Seven Seas JointCare Active Glucosamine, Omega-3 & Chondroitin 30 Caps",Seven Seas JointCare Active G…30 per pack,£13,43.3p each,
Seven Seas JointCare Max Glucosamine 1500mg 30 Day Duo Pack,Seven Seas JointCare Max Glucosam…,£21,,
Seven Seas JointCare Supplex & Turmeric with Glucosamine 30 Day Duo Pack,Seven Seas JointCare Supplex &…60 per pack,£20,33.3p each,
Seven Seas JointCare Supplex with Glucosamine & Omega-3 30 Capsules,Seven Seas JointCare Supplex with Gluco…30 per pack,£5.95,19.8p each,"Offer price £5.95, was £7"
Seven Seas Omega & Multivitamins Man Day Duo Pack,Seven Seas Omega & Multivit…3 x 80 per pack,£13.50,5.6p each,
Seven Seas Omega & Multivitamins Woman Duo Pack,Seven Seas Omega & Multiv…3 x 30 per pack,£11.50,12.8p each,
Seven Seas Omega-& Multivitamins Man Day Duo Pack,Seven Seas Omega-& Multivit…3 x 30 per pack,£11.50,12.8p each,
Seven Seas Omega-& Multivitamins Woman Day Duo Pack,Seven Seas Omega-& Multivitam…,£13.50,,
Seven Seas Omega-3 & Immunity with Vitamin C & Vitamin D 30 Day Duo Pack,Seven Seas Omega-3 & Immunity w…30 per pack,£15,50p each,
Seven Seas Omega-3 & Magnesium 30 Day Duo Pack,Seven Seas Omega-3 & Magn…60 per pack,£20,33.3p each,
Seven Seas Omega-3 & Turmeric 30 Day Duo Pack,Seven Seas Omega-3 & Turmeric 30 Day Duo Pack60 per pack,£20,33.3p each,
Seven Seas Omega-3 Fish Oil Extra Strength With Vitamin D Capsules,Seven Seas Omega-3 Fish Oil Extra Stren…30 per pack,£12,40p each,
Seven Seas Omega-3 Fish Oil Max Strength with Vitamin D Capsules,Seven Seas Omega-3 Fish Oil Max Stren…30 per pack,£17,56.7p each,
Seven Seas Omega-3 Fish Oil with Vitamin D Capsules,Seven Seas Omega-3 Fish Oil w…30 per pack,£8,26.7p each,
Seven Seas Pregnancy Trying for a Baby Conception Vitamins 28 Tablets,Seven Seas Pregnancy Trying f…28 per pack,£5.50,19.6p each,
Seven Seas Pregnancy Vitamins with Folic Acid 28 Tablets,Seven Seas Pregnancy Vitamins w…28 per pack,£6,21.4p each,
Seven Seas Pure Cod Liver Oil ,Seven Seas Pure Cod Liver Oil 300ml,£4.50,£1.50 per 100ml,
Shhhh! Earplugs,Shhhh! Earplugs10 per pack,£2.50,25p each,
Skyn Condoms Large ,Skyn Condoms Large 10 per pack,£8,80p each,"Offer price £8, was £10"
Slim-Fast Milkshake Bottle Chocolate 325Ml,Slim-Fast Milkshake Bottle Chocolate 325Ml325ml,£2.15,66.2p per 100ml,
Slim-Fast Milkshake Bottle Vanilla,Slim-Fast Milkshake Bottle Vanilla325ml,£2.15,66.2p per 100ml,
Slim-Fast Milkshake Cafe Latte,Slim-Fast Milkshake Cafe Latte6 x 325ml,£10,51.3p per 100ml,"Offer price £10, was £10.99"
Slim-Fast Milkshake Chocolate,Slim-Fast Milkshake Chocolate6 x 325ml,£10,51.3p per 100ml,"Offer price £10, was £10.99"
Slim-Fast Milkshake Strawberry,Slim-Fast Milkshake Strawberry6 x 325ml,£10,51.3p per 100ml,"Offer price £10, was £10.99"
Slimfast Advanced Keto Fuel Shake Powder Creamy Vanilla,Slimfast Advanced Keto Fuel Sha…320g,£15,£4.69 per 100g,
Slimfast Advanced Keto Fuel Shake Powder Rich Chocolate,Slimfast Advanced Keto Fuel Sha…350g,£15,£4.29 per 100g,
Slimfast Chocolate Caramel Treats,Slimfast Chocolate Caramel Treats6 x 26g,£3.50,£2.24 per 100g,
SlimFast Double Choc Bar 6pk,SlimFast Double Choc Bar 6pk150g,£3.50,£2.33 per 100g,
Slimfast Meal Replacement Choc Chip Bar,Slimfast Meal Replace…4 x 60g,£5.50,£2.29 per 100g,"Offer price £5.50, was £8"
Slimfast Meal Replacement Very Berry Bar,Slimfast Meal Replace…4 x 60g,£5.50,£2.29 per 100g,"Offer price £5.50, was £8"
Slimfast Meal Shake Powder Banana,Slimfast Meal Shake Powder Banana365g,£5,£1.37 per 100g,"Offer price £5, was £8"
