name,Price Per Unit,Price Per Measure,Promotion
Ineos Anti Bacterial Sterile Sanitiser For Hands,Ineos Anti Bacterial Sterile Sanitiser For Hands500ml,£4.35,87p per 100ml,
Ineos Sanitiser Spray For Hands,Ineos Sanitiser Spray For Hands100ml,£2.40,£2.40 per 100ml,
Jakemans Honey & Lemon,Jakemans Honey & Lemon73g,99p,£1.36 per 100g,
Jakemans Throat & Chest,Jakemans Throat & Chest73g,99p,£1.36 per 100g,
Jellyworks Superhero Plasters,Jellyworks Superhero Plasters16 per pack,£1.20,7.5p each,
John West On The Go Tuna Indian Rice Pot Biryani Curry,John West On The Go Tuna Indian…120g,£1.99,£1.66 per 100g,
John West On The Go Tuna Thai Noodle Pot Green Curry,John West On The Go Tuna Thai…120g,£1.99,£1.66 per 100g,
John West Pink Salmon,John West Pink Salmon3 x 80g,£4.25,£1.77 per 100g,
Jungle Formula Insect Repellent Maximum Aerosol,Jungle Formula Insect Rep…125ml,£10,£8.00 per 100ml,
Jungle Formula Maximum Insect Repellent Pump with DEET,Jungle Formula Maximum Insect R…90ml,£10,£111.11 per litre,
Jungle Formula Outdoor & Camping Insect Repellent Factor,Jungle Formula Outdoor & Campin…90ml,£8,£88.89 per litre,
Kalms Day,Kalms Day84 per pack,£4,4.8p each,
Kalms Lavender One-A-Day 14 Capsules,Kalms Lavender One-A-Day 14 Capsules,£6.50,,
Kalms Night            ,Kalms Night            50 per pack,£4,8p each,
Kalms Night (One A Night ),Kalms Night (One A Night )21 per pack,£5,23.8p each,
Keia Nourishing Lip Balm ,Keia Nourishing Lip Balm 10ml,£2.75,£2.75 per 10ml,
Keia Soothing Pillow Mist ,Keia Soothing Pillow Mist 100ml,£3.99,£3.99 per 100ml,
Kleenex Hygiene Kids Mask 5Pk,Kleenex Hygiene Kids Mask 5Pk,£4,,
Knect Personal Water Based Lubricant,Knect Personal Water Based Lubricant75ml,£4.49,£5.99 per 100ml,
Kool'N'Soothe Soft Gel Sheets,Kool'N'Soothe Soft Gel Sheets,£2.60,,
Lanacane Anti-Itch Cream,Lanacane Anti-Itch Cream30g,£4,£13.33 per 100g,
Lavender Oil,Lavender Oil10ml,£2.50,£2.50 per 10ml,
Lemsip Cold & Flu Lemon Sachets,Lemsip Cold & Flu Lemon Sachets10 per pack,£4,40p each,
Lemsip Cough For Mucus ,Lemsip Cough For Mucus 180ml,£8,£4.44 per 100ml,
Lemsip First Action Spray,Lemsip First Action Spray20ml,£7,£35.00 per 100ml,
Lemsip Max All In 1 Capsules,Lemsip Max All In 1 Capsules8 per pack,£2.50,31.3p each,
Lemsip Max Cold & Flu Capsules,Lemsip Max Cold & Flu Capsules16 per pack,£4.25,26.6p each,
Lemsip Max Cold & Flu Lemon Powder for Oral Solution 10 Sachets,Lemsip Max Cold & Flu Lemon Powder fo…10 per pack,£5,50p each,
Lemsip Max Day & Night Cold & Flu Relief Capsules,Lemsip Max Day & Night Cold & Flu Relief Capsules16 per pack,£5.25,32.8p each,
Lemsip Max Infusions Honey & Ginger Sachets,Lemsip Max Infusions Honey & Ginger Sachets10 per pack,£5,50p each,
Lemsip Wild Berry & Hot Orange Hot Drink Max All In One ,Lemsip Wild Berry & Hot Orange…8 per pack,£5.50,68.8p each,
Lift Glucose Tablets Orange,Lift Glucose Tablets Orange10 per pack,99p,9.9p each,Buy 2 for £1.50
Lift Glucose Tablets Raspberry,Lift Glucose Tablets Raspberry10 per pack,99p,9.9p each,Buy 2 for £1.50
Lift Raspberry Fast-Acting Glucose ,Lift Raspberry Fast-Acting Glucose 50 per pack,£2.50,5p each,"Offer price £2.50, was £3.50"
lights by TENA Incontinence Liners,lights by TENA Incontinence Liners24 per pack,£1.90,7.9p each,"Offer price £1.90, was £2.25"
lights by TENA Incontinence Liners Duo,lights by TENA Incontinence Liners Duo48 per pack,£3.75,7.8p each,
lights by TENA Light Incontinence Liners,lights by TENA Light Incontinence Liners28 per pack,£1.90,6.8p each,"Offer price £1.90, was £2.25"
lights by TENA Long Incontinence Liners,lights by TENA Long Incontinence Liners,£1.90,,"Offer price £1.90, was £2.25"
Lockets Honey & Lemon Cough Sweet Lozenges,Lockets Honey & Lemon Cough Sweet Lozenges41g,69p,£1.68 per 100g,
Lyclear Shampoo Head Lice Treatment + Head Lice Comb,Lyclear Shampoo Head Lice Tre…200ml,£12,£6.00 per 100ml,
Ma Baker Giant Bar Apple ,Ma Baker Giant Bar Apple 90g,89p,98.9p per 100g,
Ma Baker Giant Bar Cherry ,Ma Baker Giant Bar Cherry 90g,89p,98.9p per 100g,
Ma Baker Raspberry Flapjacks Sugar'D Out 4 Pack,Ma Baker Raspberry Flapja…4 x 50g,£2.60,13p per 10g,
Ma Baker Sugar'D Out Apricot Flapjacks 4 Pack,Ma Baker Sugar'D Out Apricot Flapjacks 4 Pack4 x 50g,£2.60,13p per 10g,
MacuShield Supplement by Eye Experts Original Formula Capsules ,MacuShield Supplement by Eye Experts…30 per pack,£19,63.3p each,
Mates Skyn Original Condoms,Mates Skyn Original Condoms10 per pack,£8,80p each,"Offer price £8, was £10"
Maximuscle Banana Fudge Plant Max Protein Powder ,Maximuscle Banana Fudge Pla…480g,£21.60,£4.50 per 100g,
Maximuscle Caramel Millionaires Protein Bar,Maximuscle Caramel Millionaires Protein Bar45g,£2.20,£4.89 per 100g,
Maximuscle Chocolate Max Whey Protein Powder ,Maximuscle Chocolate Max…420g,£20,£4.76 per 100g,
Maximuscle Cinnamon Swirl Protein Bar,Maximuscle Cinnamon Swirl Protein Bar45g,£2.20,£4.89 per 100g,
Maximuscle Cookies & Cream Protein Bar,Maximuscle Cookies & Cream Protein Bar45g,£2.20,£4.89 per 100g,
Maximuscle New York Vanilla Cheesecake Protein Bar,Maximuscle New York Vanilla…45g,£2.20,£4.89 per 100g,
Maximuscle Raspberry Coconut Protein Bar,Maximuscle Raspberry Coconut Protein Bar45g,£2.20,£4.89 per 100g,
Maximuscle Salted Caramel Protein Bar,Maximuscle Salted Caramel Protein Bar45g,£2.20,£4.89 per 100g,
Maximuscle Strawberry Max Whey Protein Powder ,Maximuscle Strawberry Max…480g,£20,£4.17 per 100g,
Maximuscle Vanilla Ice Cream Protein Milk,Maximuscle Vanilla Ice Cream Protein Milk330ml,£3,90.9p per 100ml,
Maximuscle Vanilla Max Whey Protein Powder ,Maximuscle Vanilla Max Whey Protein Powder 420g,£20,£4.76 per 100g,
Medahuman Energy ,Medahuman Energy 250ml,£2,80p per 100ml,"Offer price £2, was £2.50"
Medahuman Glow,Medahuman Glow250ml,£2,80p per 100ml,"Offer price £2, was £2.50"
Medahuman Night,Medahuman Night250ml,£2,80p per 100ml,"Offer price £2, was £2.50"
Medahuman Recover ,Medahuman Recover 250ml,£2,80p per 100ml,"Offer price £2, was £2.50"
Medahuman Relax ,Medahuman Relax 250ml,£2,80p per 100ml,"Offer price £2, was £2.50"
Mentholatum Ibuprofen Gel,Mentholatum Ibuprofen Gel35g,£1.85,£5.29 per 100g,
Migraine Kool'n'Soothe Migraine Soft Gel Sheet,Migraine Kool'n'Soothe Migraine Soft Gel Sheet4 per pack,£3.30,82.5p each,
Morrisons 12 Comfort Pads Normal,Morrisons 12 Comfort Pads Normal12 per pack,£1.65,13.8p each,
Morrisons 5cm Fixing Bandage  ,Morrisons 5cm Fixing Bandage  ,80p,,
Morrisons A-Z Multi Vitamins    ,Morrisons A-Z Multi Vitamins    60 per pack,£3.25,5.4p each,
Morrisons Acute Diarrhoea Relief Caps,Morrisons Acute Diarrhoea Relief Caps6 per pack,£1.25,20.8p each,
Morrisons Acute Diarrhoea Relief Caps,Morrisons Acute Diarrhoea Relief Caps6 per pack,£1.35,22.5p each,
Morrisons Adult Multivitamin Gummies Raspberry,Morrisons Adult Multivita…60 per pack,£5,8.3p each,
Morrisons Adult Vitamin C Immune Gummies Orange,Morrisons Adult Vitamin C Immune Gummies Orange60 per pack,£5,8.3p each,
Morrisons Ankle Support Medium       ,Morrisons Ankle Support Medium       ,£3.50,,
Morrisons Antiseptic Wipes ,Morrisons Antiseptic Wipes 10 per pack,£1,10p each,
Morrisons Aqueous Cream,Morrisons Aqueous Cream500g,£5,£1.00 per 100g,
Morrisons Bite & Sting Cream,Morrisons Bite & Sting Cream10g,£3,£30.00 per 100g,
Morrisons Blister Plasters ,Morrisons Blister Plasters 5 per pack,£2.25,45p each,
Morrisons Brightening Eye Drops,Morrisons Brightening Eye Drops10ml,£2.50,£2.50 per 10ml,
Morrisons Bronchial Balsam,Morrisons Bronchial Balsam300ml,£2.50,83.3p per 100ml,
Morrisons Calamine Lotion,Morrisons Calamine Lotion200ml,£2.40,£1.20 per 100ml,
Morrisons Calcium And Vitamin D,Morrisons Calcium And Vitamin D120 per pack,£3,2.5p each,
Morrisons Chesty Cough,Morrisons Chesty Cough300ml,£2.50,83.3p per 100ml,
Morrisons Chewable Vitamin C 200Mg Orange Flavour,Morrisons Chewable Vitamin…60 per pack,£2,3.3p each,
Morrisons Chocolate Whey Powder,Morrisons Chocolate Whey Powder400g,£7.50,£1.88 per 100g,
Morrisons Clear Plasters    ,Morrisons Clear Plasters    40 per pack,£1.20,3p each,
Morrisons Cod Liver Oil & Multivitamins ,Morrisons Cod Liver Oil & Multivitamins 60 per pack,£3,5p each,
Morrisons Cod Liver Oil 500 Mg ,Morrisons Cod Liver Oil 500 Mg 120 per pack,£3.50,2.9p each,
Morrisons Cold Sore Cream,Morrisons Cold Sore Cream2g,£3.50,£175.00 per 100g,
Morrisons Comfort Liners,Morrisons Comfort Liners24 per pack,£1.65,6.9p each,
Morrisons Comfort Liners Long,Morrisons Comfort Liners Long20 per pack,£1.65,8.3p each,
Morrisons Comfort Pads Extra,Morrisons Comfort Pads Extra10 per pack,£1.65,16.5p each,
Morrisons Comfort Pads Extra Plus,Morrisons Comfort Pads Extra Plus8 per pack,£1.65,20.6p each,
Morrisons Comfort Pants Large,Morrisons Comfort Pants Large10 per pack,£6.25,62.5p each,
Morrisons Comfort Pants Medium,Morrisons Comfort Pants Medium12 per pack,£6.25,52.1p each,
Morrisons Comfort Pants Super Protection Large,Morrisons Comfort Pants Super Protection Large12 per pack,£8,66.7p each,
Morrisons Comfort Pants Super Protection Medium,Morrisons Comfort Pants Super Protection Medium12 per pack,£8,66.7p each,
Morrisons Contact Lens Solution,Morrisons Contact Lens Solution250ml,£4,£1.60 per 100ml,
Morrisons Corn Removal Plasters 5'S,Morrisons Corn Removal Plasters 5'S,£3.50,,
Morrisons Cracked Heal Balm,Morrisons Cracked Heal Balm56g,£3,£5.36 per 100g,
Morrisons Cystitis Relief Sachets,Morrisons Cystitis Relief Sachets6 per pack,£1.50,25p each,
Morrisons Dark Skin Tone Plasters,Morrisons Dark Skin Tone Plasters40 per pack,£1.20,3p each,
Morrisons Dry Eye Drops,Morrisons Dry Eye Drops10ml,£2.50,£2.50 per 10ml,
Morrisons Dry Eye Mist,Morrisons Dry Eye Mist15ml,£6,£4.00 per 10ml,
Morrisons Dry Tickly Cough,Morrisons Dry Tickly Cough300ml,£2.50,83.3p per 100ml,
Morrisons Dual Action Blackcurrant Lozenges ,Morrisons Dual Action Blackcurrant Lozenges 36 per pack,£3,8.3p each,
Morrisons Dual Action Lozenges Honey & Lemon ,Morrisons Dual Action Lozenges Honey & Lemon 36 per pack,£3,8.3p each,
Morrisons Elastic Tubular Bandage ,Morrisons Elastic Tubular Bandage 1m,£2.25,£2.25 per 1m,
Morrisons Elastic Tubular Bandage Size D 75mm x 1m,Morrisons Elastic Tubular B…,£2.25,,
Morrisons Energise Effervescent Vitamins,Morrisons Energise Effervescent Vitamins20 per pack,£1.35,6.8p each,
Morrisons Express Pain Relief,Morrisons Express Pain Relief16 per pack,£2.89,18.1p each,
Morrisons Extra Tough Plasters,Morrisons Extra Tough Plasters20 per pack,£1.20,6p each,
Morrisons Eye Wash,Morrisons Eye Wash300ml,£4,£1.33 per 100ml,
Morrisons Fabric Dressing Strips ,Morrisons Fabric Dressing Strips 10 per pack,£1.49,14.9p each,
Morrisons Fabric Strapping ,Morrisons Fabric Strapping 3m,£2.25,75p per 1m,
Morrisons First Aid Spray,Morrisons First Aid Spray100ml,£2,£2.00 per 100ml,
Morrisons Flexi-Tip Thermometer,Morrisons Flexi-Tip Thermometer,£7.50,,
Morrisons Folic Acid,Morrisons Folic Acid180 per pack,£2.50,1.4p each,
Morrisons Foot Care Blister Plasters 5Pk,Morrisons Foot Care Blister Plasters 5Pk5 per pack,£3,60p each,
Morrisons Glucosamine & Chrondroitin,Morrisons Glucosamine & Chrondroitin30 per pack,£4,13.3p each,
Morrisons Glucosamine Sulphate 500 Mg ,Morrisons Glucosamine Sulphate 500 Mg 30 per pack,£2.50,8.3p each,
Morrisons Hayfever And Allergy Relief Tablets,Morrisons Hayfever And Allergy Relief Tablets14 per pack,£2.15,15.4p each,
Morrisons Heartburn & Indigestion Liquid,Morrisons Heartburn & Indigestion Liquid200ml,£2.65,£1.33 per 100ml,
Morrisons Herbals Echinacea Tablets,Morrisons Herbals Echinacea Tablets30 per pack,£3.50,11.7p each,
Morrisons Herbals St John's Wort Tablets,Morrisons Herbals St John's Wort Tablets30 per pack,£3.50,11.7p each,
Morrisons High Strength Cod Liver Oil 1000 Mg ,Morrisons High Strength Cod Liver Oil 1000 Mg 60 per pack,£3.75,6.3p each,
Morrisons High Strength Evening Primrose Oil 1000 Mg,Morrisons High Strength Eveni…30 per pack,£3,10p each,
Morrisons High Strength Glucosamine Vitamins ,Morrisons High Strength Glucosamine Vitamins 30 per pack,£4,13.3p each,
Morrisons High Strength Vitamin D Vitamins ,Morrisons High Strength Vitamin D Vitamins 90 per pack,£3.25,3.6p each,Winter Immune Booster Bundle for £8
Morrisons Hydrocolloid Dressings,Morrisons Hydrocolloid Dressings5 per pack,£2.60,52p each,
Morrisons Hydrocolloid Plasters ,Morrisons Hydrocolloid Plasters 16 per pack,£2.25,14.1p each,
Morrisons Ibuprofen 200mg Caplets,Morrisons Ibuprofen 200mg Caplets16 per pack,45p,2.8p each,
Morrisons Ibuprofen 200mg Tablets,Morrisons Ibuprofen 200mg Tablets16 per pack,45p,2.8p each,
Morrisons Ibuprofen Caplets,Morrisons Ibuprofen Caplets16 per pack,45p,2.8p each,
Morrisons Incontinence Pads Male,Morrisons Incontinence Pads Male10 per pack,£3,30p each,
Morrisons In Shape Chocolate Meal Replacement Drink,Morrisons In Shape Chocolate…348g,£5.50,£1.58 per 100g,
Morrisons In Shape Strawberry Meal Replacement Drink,Morrisons In Shape Strawberry…348g,£5.50,£1.58 per 100g,
Morrisons In Shape Vanilla Meal Replacement Drink,Morrisons In Shape Vanilla Meal Replacement Drink348g,£5.50,£1.58 per 100g,
Morrisons Iron 14 Mg ,Morrisons Iron 14 Mg 120 per pack,£2.50,2.1p each,
Morrisons Irritated Eye Drops,Morrisons Irritated Eye Drops10ml,£3.50,£3.50 per 10ml,
Morrisons Junior Paracetamol Suspension,Morrisons Junior Paracetamol Suspension100ml,£2.15,£2.15 per 100ml,
Morrisons Kids Chewable Multivitamins,Morrisons Kids Chewable Multivitamins90 per pack,£3,3.3p each,
Morrisons Kids Multivitamin & Omega Gummies Orange,Morrisons Kids Multivitamin…60 per pack,£5,8.3p each,
Morrisons Kids Multivitamin Gummies Strawberry,Morrisons Kids Multivitam…60 per pack,£5,8.3p each,
Morrisons Kids Vitamin C Immune Gummies Blackcurrant,Morrisons Kids Vitamin C Immu…60 per pack,£5,8.3p each,
Morrisons Knee Support Large,Morrisons Knee Support Large,£4.50,,
Morrisons Laxative Tablets,Morrisons Laxative Tablets20 per pack,£2.65,13.3p each,
Morrisons Lens Wipes 26 Pack,Morrisons Lens Wipes 26 Pack,£1.35,,
Morrisons Light Skin Tone Plasters,Morrisons Light Skin Tone Plasters40 per pack,£1.20,3p each,
Morrisons Long Lasting Pain Relief Ibuprofen Capsules,Morrisons Long Lasting Pain R…8 per pack,£2,25p each,
Morrisons Magnesium 375 Mg  ,Morrisons Magnesium 375 Mg  45 per pack,£3,6.7p each,
Morrisons Maxi Night Comfort Pads ,Morrisons Maxi Night Comfort Pads 6 per pack,£1.65,27.5p each,
Morrisons Max Strength Cold & Flu Day & Night Capsules,Morrisons Max Strength Cold & F…16 per pack,£2.50,15.6p each,
Morrisons Max Strength Cold & Flu Relief All In One Capsules,Morrisons Max Strength Cold & Flu R…16 per pack,£3,18.8p each,
Morrisons Max Strength Cold & Flu Relief Capsules,Morrisons Max Strength Cold & Flu Relief Capsules16 per pack,£2.50,15.6p each,
Morrisons Max Strength Cold & Flu Relief Sachets,Morrisons Max Strength Cold & Flu Relief Sachets10 per pack,£3.30,33p each,
Morrisons Max Strength Congestion Relief Capsules,Morrisons Max Strength Cong…12 per pack,£2.15,17.9p each,
Morrisons Medium Skin Tone Plasters,Morrisons Medium Skin Tone Plasters40 per pack,£1.20,3p each,
Morrisons Menopause Vitamins ,Morrisons Menopause Vitamins 30 per pack,£3.25,10.8p each,
Morrisons Men's A - Z 50+ Vitamins ,Morrisons Men's A - Z 50+ Vitamins 30 per pack,£3.50,11.7p each,
Morrisons Men'S Health Vitamins ,Morrisons Men'S Health Vitamins 30 per pack,£3.50,11.7p each,
Morrisons Microporous Tape ,Morrisons Microporous Tape ,£1.29,,
Morrisons Moleskin Roll,Morrisons Moleskin Roll,£3.70,,
Morrisons Morrisons Max Strength Lemon Cold & Flu Relief Sachets,Morrisons Morrisons Max Strength Lemo…10 per pack,£3,30p each,
Morrisons Multi Vitamins    ,Morrisons Multi Vitamins    60 per pack,£1,1.7p each,
Morrisons Multi Vitamins & Iron ,Morrisons Multi Vitamins & Iron 180 per pack,£3.50,1.9p each,
Morrisons Nasal Decongestant Spray,Morrisons Nasal Decongestant Spray15ml,£1.90,£12.67 per 100ml,
Morrisons Nicotine Replacement Lozenges 2Mg,Morrisons Nicotine Repl…72 per pack,£7,9.7p each,
Morrisons Nicotine Replacement Lozenges 4Mg,Morrisons Nicotine Repl…72 per pack,£7,9.7p each,
Morrisons Non-Adherent Dressing Pads,Morrisons Non-Adherent Dressing Pads5 per pack,£1.29,25.8p each,
Morrisons One-A-Day Hayfever & Allergy Relief Cetirizine Tablets,Morrisons One-A-Day Hayfever & Allerg…30 per pack,£2.89,9.6p each,
Morrisons One-A-Day Hayfever & Allergy Relief Tablets Loratadine,Morrisons One-A-Day Hayfever & Allerg…30 per pack,£2.89,9.6p each,
Morrisons One-a-Day Hay Fever Relief Tablets,Morrisons One-a-Day Hay Fever Relief Tablets14 per pack,£2.15,15.4p each,
Morrisons Orange Antacid Tablets,Morrisons Orange Antacid Tablets48 per pack,£2.69,5.6p each,
Morrisons Orange Flavour Chewable Vitamin C 1000 Mg,Morrisons Orange Flavour Chew…60 per pack,£3.50,5.8p each,Winter Immune Booster Bundle for £8
Morrisons Organic Muesli ,Morrisons Organic Muesli 500g,£2.50,50p per 100g,
Morrisons Organic Quinoa Flakes ,Morrisons Organic Quinoa Flakes 500g,£4.50,90p per 100g,
Morrisons Paracetamol 500 Mg Caplets,Morrisons Paracetamol 500 Mg Caplets16 per pack,39p,2.4p each,
Morrisons Paracetamol 500Mg Capsules,Morrisons Paracetamol 500Mg Capsules16 per pack,99p,6.2p each,
Morrisons Paracetamol 6+ Suspension,Morrisons Paracetamol 6+ Suspension80ml,£2.05,£2.56 per 100ml,
Morrisons Paracetamol Plus Caplets,Morrisons Paracetamol Plus Caplets16 per pack,£1,6.3p each,
Morrisons Peach Ethical Spectacle Spray & Cloth,Morrisons Peach Ethical Spectacle Spray & Cloth50ml,£2,£4.00 per 100ml,
Morrisons Peppermint Antacid Tablets,Morrisons Peppermint Antacid Tablets48 per pack,£2.69,5.6p each,
Morrisons Pregnancy Test Kits,Morrisons Pregnancy Test Kits2 per pack,£3.50,£1.75 each,
Morrisons Saline Solution,Morrisons Saline Solution360ml,£2,55.6p per 100ml,
Morrisons Self Adhesive Dressing ,Morrisons Self Adhesive Dressing 5 per pack,£1.49,29.8p each,
Morrisons Silicone Plasters,Morrisons Silicone Plasters12 per pack,£2,16.7p each,
"Morrisons Skin, Hair & Nails Vitamins ","Morrisons Skin, Hair & Nails Vitamins 30 per pack",£3.25,10.8p each,
Morrisons Sterile Cuts & Graze Plasters ,Morrisons Sterile Cuts & Graze Plasters 5 per pack,£1.49,29.8p each,
Morrisons Support Bandage  ,Morrisons Support Bandage  ,£3,,
Morrisons Tired Eye Drops,Morrisons Tired Eye Drops10ml,£2.50,£25.00 per 100ml,
Morrisons Travel First Aid Kit,Morrisons Travel First Aid Kit,£7.35,,
"Morrisons Vegan Omega 3,6 & 9","Morrisons Vegan Omega 3,6 & 930 per pack",£3,10p each,
Morrisons Vitamin B Complex ,Morrisons Vitamin B Complex 120 per pack,£2.50,2.1p each,Winter Immune Booster Bundle for £8
Morrisons Vitamin C & Zinc,Morrisons Vitamin C & Zinc60 per pack,£2.25,3.8p each,
Morrisons Vitamin C And Zinc Effervescent Vitamins,Morrisons Vitamin C And Zinc Effervescent Vitamins20 per pack,£1.35,6.8p each,
Morrisons Vitamin C Effervescent Vitamins,Morrisons Vitamin C Effervescent Vitamins20 per pack,£1.35,6.8p each,
Morrisons Vitamin E 400Iu ,Morrisons Vitamin E 400Iu 30 per pack,£2,6.7p each,
Morrisons Washproof Plasters    ,Morrisons Washproof Plasters    40 per pack,£1.20,3p each,
Morrisons Women's A - Z 50+ Vitamins ,Morrisons Women's A - Z 50+ Vitamins 30 per pack,£3.50,11.7p each,
Morrisons Women'S Health Vitamins ,Morrisons Women'S Health Vitamins 30 per pack,£3.50,11.7p each,
Motusol Pain Relief Gel 1.16% W/W 30g,Motusol Pain Relief Gel 1.16% W/W 30g30g,£4.79,£15.97 per 100g,
Motusol Pain Relief Gel 1.16% W/W 50g,Motusol Pain Relief Gel 1.16% W/W 50g50g,£5.50,£1.10 per 10g,"Offer price £5.50, was £6.79"
Motusol Pain Relief Gel 2.32% W/W 50g,Motusol Pain Relief Gel 2.32% W/W 50g50g,£7,£1.40 per 10g,"Offer price £7, was £8.99"
Musclefood High Protein Bar Cookies & Cream ,Musclefood High Protein Bar Cookies & Cream 45g,£1.50,£3.33 per 100g,
Musclefood High Protein Bar Salted Caramel ,Musclefood High Protein Bar Salted Caramel 45g,£1.50,£3.33 per 100g,
Myprotein Clear Whey Isolate Orange & Mango,Myprotein Clear Whey Isolate Orange & Mango261g,£15,£5.75 per 100g,
Myprotein Clear Whey Isolate Peach Tea,Myprotein Clear Whey Isolate Peach Tea244g,£15,£6.15 per 100g,
Myprotein Gooey Filled Cookie Double Choc & Caramel,Myprotein Gooey Filled Cookie…75g,£2.50,£3.33 per 100g,
Myprotein Layered Treat Without The Cheat Choc Sundae,Myprotein Layered Treat Witho…60g,£2.50,£4.17 per 100g,
Myprotein Layered Treat Without The Cheat Peanut Butter,Myprotein Layered Treat Without…60g,£2.50,£4.17 per 100g,
Nasacort Nasal Spray,Nasacort Nasal Spray15ml,£6,£4.00 per 10ml,
Natures Aid 100% MCT Oil Premium Coconut Oil ,Natures Aid 100% MCT Oil Premium Coconut Oil 500ml,£19,£3.80 per 100ml,
Natures Aid 100% MCT Oil Premium Coconut Oil Supplement Capsules ,Natures Aid 100% MCT Oil Premium Coco…120 per pack,£22.70,18.9p each,
Natures Aid Advanced Acidophilus Complex Supplement Capsules ,Natures Aid Advanced Acidophilus Co…60 per pack,£9,15p each,
"Natures Aid Calcium, Magnesium & Vitamin D3 Tablets ","Natures Aid Calcium, Magnesiu…90 per pack",£6,6.7p each,
"Natures Aid Calcium, Magnesium & Zinc Supplement Tablets","Natures Aid Calcium, Magnesium…90 per pack",£8,8.9p each,
Natures Aid Chewable Vitamin C Supplement Capsules 500mg ,Natures Aid Chewable Vitamin C Su…50 per pack,£5.20,10.4p each,
Natures Aid Collagen Beauty Formula Supplement Capsules ,Natures Aid Collagen Beauty For…90 per pack,£20,22.2p each,
"Natures Aid Complete EFA Omega's 3,6 & 9 Soft Gel Capsules ",Natures Aid Complete EFA Omega's…90 per pack,£13,14.4p each,
Natures Aid Cranberry Supplement Tablets 5000mg ,Natures Aid Cranberry Suppl…30 per pack,£5,16.7p each,
Natures Aid Evening Primrose Oil Soft Gel Capsules 1000mg,Natures Aid Evening Primrose Oil…,£12.50,£12.50 each,
Natures Aid Evening Primrose Oil Soft Gel Capsules 1000mg,Natures Aid Evening Primrose Oil…90 per pack,£15,16.7p each,
"Natures Aid Ginger, Turmeric & Bromlelain Supplement Tablets ","Natures Aid Ginger, Turmeric & Brom…60 per pack",£8,13.3p each,
Natures Aid  Ginkgo Biloba Supplement Tablets 6000mg,Natures Aid  Ginkgo Biloba Su…90 per pack,£10,11.1p each,
Natures Aid Glucosamine MSM & Chondroitin ,Natures Aid Glucosamine MSM & Chondroitin 90 per pack,£15,16.7p each,
Natures Aid High Strength Co-Enzyme Q10 Supplement Soft Gels 100mg,Natures Aid High Strength C…90 per pack,£41,45.6p each,
Natures Aid High Strength Vitamin D3 Tablets 1000iu ,Natures Aid High Strength Vitamin D3 Tablets 1000iu 90 per pack,£6.50,7.2p each,
Natures Aid Infant's & Kid's Iron Mini Drops 10mg 3mnths - 5yrs ,Natures Aid Infant's & Kid's Iron Min…50ml,£8.30,£16.60 per 100ml,
Natures Aid Low Acid Vitamin C Tablets 1000mg ,Natures Aid Low Acid Vitamin C Tablets 1000mg 90 per pack,£8,8.9p each,
Natures Aid Magnesium Citrate Supplement Capsules 119mg,Natures Aid Magnesium Citrate S…60 per pack,£8.95,14.9p each,
Natures Aid Maximum Strength Vitamin D3 Tablets 5000iu ,Natures Aid Maximum Strength Vi…60 per pack,£10,16.7p each,
Natures Aid Microbiotics Pro-30 Max Super Strength Supplement Capsules ,Natures Aid Microbiotics Pro…30 per pack,£17,56.7p each,
Natures Aid Mini Drops DHA Omega-3 for Infants & Children,Natures Aid Mini Drops DHA Omega…50ml,£10,£20.00 per 100ml,
Natures Aid Mini Drops Immune Plus for Infants & Children,Natures Aid Mini Drops Immune Plu…,£8.95,£8.95 each,
Natures Aid Mini Drops Vitamin C Sprinkles,Natures Aid Mini Drops Vitamin C Sprinkles90g,£7.25,£8.06 per 100g,
Natures Aid PremEeze Agnus Castus Capsules 400mg,Natures Aid PremEeze Agnus…60 per pack,£10,16.7p each,
Natures Aid Probiotic Complex Supplement Capsules ,Natures Aid Probiotic Compl…60 per pack,£11.79,19.6p each,
Natures Aid Sea Buckthorn Oil Omega-7 Soft Gel Supplement Capsules 500mg ,Natures Aid Sea Buckthorn Oil O…60 per pack,£16.50,27.5p each,
Natures Aid Superfoods Tumeric Supplement Capsules 8200mg,Natures Aid Superfoods Tumeric Su…30 per pack,£9.95,33.2p each,
Natures Aid Super Strength Omega-3 Fish Oil Softgels,Natures Aid Super Strength Om…60 per pack,£12,20p each,
Natures Aid Super Strength Vitamin D3 Tablets 4000iu ,Natures Aid Super Strength Vi…60 per pack,£9.30,15.5p each,
Natures Aid Ubiquinol reduced Co-Q-10 Soft Gels 50mg ,Natures Aid Ubiquinol reduced…30 per pack,£16,53.3p each,
Natures Aid Ucalm 300mg T St John's Wort Extract Tablets ,Natures Aid Ucalm 300mg T St John…60 per pack,£9.99,16.7p each,
Natures Aid Vegetarian Flaxseed Oil 1000mg Capsules,Natures Aid Vegetarian Flaxse…90 per pack,£9,10p each,
Natures Aid Vitamin B12 Supplement Tablets 1000ug ,Natures Aid Vitamin B12 Sup…90 per pack,£8.50,9.4p each,
Natures Aid Vitamin B Complex 50 + C Supplement Tablets ,Natures Aid Vitamin B Complex 5…30 per pack,£5.50,18.3p each,
Natures Aid Vitamin E Supplement Soft Gels 400iu ,Natures Aid Vitamin E Suppl…60 per pack,£12,20p each,
Natures Aid Zinc + C Supplement Lozenges ,Natures Aid Zinc + C Supplement Lozenges 30 per pack,£4,13.3p each,
Naturya Flaxseed Apple & Cinnamon,Naturya Flaxseed Apple & Cinnamon240g,£4.80,£2.00 per 100g,
Naturya Flaxseed Mix Berry,Naturya Flaxseed Mix Berry240g,£4.80,£2.00 per 100g,
Naturya Under Skin Vanilla,Naturya Under Skin Vanilla140g,£7.99,£5.71 per 100g,
Nelsons Arnica Cream,Nelsons Arnica Cream30g,£3.75,£12.50 per 100g,
Nexba Elder Lemon Kombucha ,Nexba Elder Lemon Kombucha 1L,£2.75,£2.75 per litre,
Nexba Mango Kombucha ,Nexba Mango Kombucha 330ml,£1.50,45.5p per 100ml,
Nexium Heartburn Remedies 14 Tablets ,Nexium Heartburn Remedies 14 Tablets 14 per pack,£13,92.9p each,
Nexium Heartburn Remedies 7 Tablets ,Nexium Heartburn Remedies 7 Tablets 7 per pack,£6,85.7p each,
Nicorette 15mg Inhalator (Stop Smoking Aid),Nicorette 15mg Inhalator (Stop Smoking Aid)20 per pack,£23,£1.15 each,
