name,Price Per Unit,Price Per Measure,Promotion
Cl-Ear Olive Oil Ear Drops ,Cl-Ear Olive Oil Ear Drops 15ml,£3,£20.00 per 100ml,
Clarityn Allergy 1mg/ml Syrup Mixed Berries Flavour,Clarityn Allergy 1mg/ml Syrup…60ml,£4.40,£7.33 per 100ml,"Offer price £4.40, was £5"
Clarityn Allergy Tablets 10mg Loratadine Allergy and Hayfever Relief,Clarityn Allergy Tablets 10mg Loratadin…14 per pack,£5.85,41.8p each,
Clarityn Allergy Tablets 10mg Loratadine Allergy and Hayfever Relief,Clarityn Allergy Tablets 10mg Loratadin…30 per pack,£5.20,17.4p each,"Offer price £5.20, was £10.40"
Cleanmarine For Kids,Cleanmarine For Kids60 per pack,£12,20p each,
Cleanmarine MenoMin Menopause Supplement Capsules ,Cleanmarine MenoMin Menopau…60 per pack,£24,40p each,
Cleanmarine Women's Hormone Regulator Supplement Capsules ,Cleanmarine Women's Hormone Regul…60 per pack,£23,38.3p each,
Clearblue Digital Pregnancy Test Single,Clearblue Digital Pregnancy Test Single,£10,,
Clearblue Pregnancy Test Combo Pack Double Check + Date,Clearblue Pregnancy Test Combo…,£6,,
Clearblue Pregnancy Test Digital Ultra Early Digital Tests,Clearblue Pregnancy Test Digital…2 per pack,£16.99,£8.50 each,
Clearblue Pregnancy Test Early Detection Test,Clearblue Pregnancy Test Early Detection Test2 per pack,£11,£5.50 each,
Clearblue Pregnancy Test Rapid Detection 2 Tests,Clearblue Pregnancy Test Rapid Detection 2 Tests,£8.50,,
Clearblue Visual & Digital Sticks Pregnancy Test,Clearblue Visual & Digital Sticks Pregnancy Test3 per pack,£18.99,£6.33 each,
Clear Ear Express Ear Drops,Clear Ear Express Ear Drops12ml,£4.50,£37.50 per 100ml,
Clear Ear Pain Relief Ear Drops,Clear Ear Pain Relief Ear Drops,£9,,
Colgate Sensitive Instant Relief Enamel Repair Toothpaste,Colgate Sensitive Instant Relief…75ml,£2.50,£3.33 per 100ml,
Colgate Sensitive Instant Relief Multi Protection Toothpaste,Colgate Sensitive Instant Relief Mu…75ml,£2.50,£3.33 per 100ml,
Colgate Sensitive Instant Relief Repair & Prevent Toothpaste,Colgate Sensitive Instant Relief Re…75ml,£2.50,£3.33 per 100ml,
Colpermin IBS Relief Capsules 20 Sustained Release Capsules              ,Colpermin IBS Relief Capsules 20 Sustained…20 per pack,£6.20,31p each,
Compeed Blister Plasters Medium,Compeed Blister Plasters Medium6 per pack,£5,83.3p each,
Compeed Blister Plasters Mixed,Compeed Blister Plasters Mixed6 per pack,£6,£1.00 each,
Compeed Blister Plasters Mixed Sizes ,Compeed Blister Plasters Mixed Sizes 5 per pack,£5.50,£1.10 each,
Compeed Cold Sore Patch,Compeed Cold Sore Patch15 per pack,£6,40p each,
Complan Meal Replacement Chocolate ,Complan Meal Replacement Chocolate 4 x 55g,£4.25,£1.93 per 100g,
Complan Meal Replacement Strawberry ,Complan Meal Replacement Strawberry 4 x 55g,£4.75,£2.16 per 100g,
Covonia Berry Blast Lozenges  ,Covonia Berry Blast Lozenges  51g,£1.35,£2.65 per 100g,
Covonia Chesty Cough Mixture ,Covonia Chesty Cough Mixture 300ml,£7,£2.33 per 100ml,
Covonia Chesty Cough Mixture,Covonia Chesty Cough Mixture150ml,£4.75,£3.17 per 100ml,
Covonia Chesty Sugar Free,Covonia Chesty Sugar Free150ml,£5,£3.33 per 100ml,
Covonia Dry & Tickly Cough Linctus,Covonia Dry & Tickly Cough Linctus150ml,£4.75,£3.17 per 100ml,
Covonia Lozenges Sugar Free,Covonia Lozenges Sugar Free30g,£1.35,£4.50 per 100g,
Cura-Heat Pain Relief Heat Patch Acute Back Pain Max Size,Cura-Heat Pain Relief Heat Patch…2 per pack,£4.50,£2.25 each,
Cura - Heat Pain Relief Heat Patch Neck & Shoulders,Cura - Heat Pain Relief Heat…3 per pack,£5.20,£1.73 each,
Cura Heat Pads,Cura Heat Pads3 per pack,£3.50,£1.17 each,
Cussons Antibacterial Carex Protects Moisture Plus Hand Gel,Cussons Antibacterial Carex Prote…50ml,£1,£2.00 per 100ml,"Offer price £1, was £1.25"
Cuticura Cucumber Hand Gel,Cuticura Cucumber Hand Gel100ml,£1,£1.00 per 100ml,"Offer price £1, was £2"
Daktarin Dual Action Active Spray ,Daktarin Dual Action Active Spray 100g,£4.75,£4.75 per 100g,
Daktarin Dual Action Cream,Daktarin Dual Action Cream15g,£3.50,£23.33 per 100g,
Deep Blue Covid19 Antigen Covid Test,Deep Blue Covid19 Antigen Covid Test,£1.99,,
Deep Freeze Gel                   ,Deep Freeze Gel                   100g,£4.75,£4.75 per 100g,
Deep Freeze Patch,Deep Freeze Patch,£5.75,,
Deep Freeze Spray  ,Deep Freeze Spray  150ml,£4,£2.67 per 100ml,
Deep Heat Max Strength Gel,Deep Heat Max Strength Gel35g,£5,£14.29 per 100g,
Deep Heat Muscle Massage Roll On ,Deep Heat Muscle Massage Roll On 50ml,£5,£10.00 per 100ml,
Deep Heat Relief Gel                   ,Deep Heat Relief Gel                   50g,£4.50,£9.00 per 100g,
Deep Heat Rub              ,Deep Heat Rub              67g,£3,£4.48 per 100g,
Deep Heat Spray ,Deep Heat Spray 150ml,£4,£2.67 per 100ml,
Deep Heat Warming Belt 2 Warming Belts,Deep Heat Warming Belt 2 Warming Belts2 per pack,£7.50,£3.75 each,
Deep Heat Well Patch       ,Deep Heat Well Patch       4 per pack,£6,£1.50 each,
Deep Relief Actiflex Patch,Deep Relief Actiflex Patch4 per pack,£6,£1.50 each,
Dettol Anti-Septic Liquid ,Dettol Anti-Septic Liquid 250ml,£2.50,£1.00 per 100ml,
Dextro Energy Orange     ,Dextro Energy Orange     ,75p,,
Dulcoease 100Mg Capsules 60S,Dulcoease 100Mg Capsules 60S,£9,,
Dulcolax 5mg Adult Pico Liquid ,Dulcolax 5mg Adult Pico Liquid 100ml,£4,£4.00 per 100ml,
Dulcolax 5Mg Gastro - Resistant Tablets 20S,Dulcolax 5Mg Gastro - Resistant Tablets 20S,£3,,
Durex Extra Safe Thick Condoms,Durex Extra Safe Thick Condoms20 per pack,£13.50,67.6p each,"Offer price £13.50, was £14.99"
Durex Extra Safe Thick Condoms,Durex Extra Safe Thick Condoms12 per pack,£10.99,91.6p each,
Durex Extra Safe Thick Condoms,Durex Extra Safe Thick Condoms6 per pack,£6.49,£1.08 each,
Durex Intense Delight Vibrating Bullet,Durex Intense Delight Vibrating Bullet,£7.50,,"Offer price £7.50, was £10"
Durex Intense Vibrations Ring,Durex Intense Vibrations Ring,£5,,
Durex Lubricant Feel,Durex Lubricant Feel50ml,£4,£8.00 per 100ml,"Offer price £4, was £4.50"
Durex Mutual Climax Condoms ,Durex Mutual Climax Condoms 12 per pack,£13.50,£1.13 each,"Offer price £13.50, was £15"
Durex Naturals Extra Sensitive Intimate Gel,Durex Naturals Extra Sensitive Intimate Gel100ml,£8,£8.00 per 100ml,"Offer price £8, was £10"
Durex Naturals Water Based Pure Lubricant Gel,Durex Naturals Water Based Pure Lubricant Gel100ml,£8,£8.00 per 100ml,"Offer price £8, was £10"
Durex Originals Close Fit Condoms,Durex Originals Close Fit Condoms12 per pack,£7.50,62.5p each,
Durex Play Feel Pleasure Gel,Durex Play Feel Pleasure Gel100ml,£8,£8.00 per 100ml,
Durex Play Massage 2-in-1 Aloe Vera Lubricant Gel,Durex Play Massage 2-in-1 A…200ml,£8.50,£4.25 per 100ml,
Durex Play Silicone Based Perfect Glide Lubricant Gel,Durex Play Silicone Based Perfect Glide Lubricant Gel50ml,£10.50,£21.00 per 100ml,
Durex Play Water Based Strawberry Lubricant Gel,Durex Play Water Based Strawberry Lubricant Gel100ml,£8,£8.00 per 100ml,
Durex Play Water Based Tingling Lubricant Gel,Durex Play Water Based Tingling Lubricant Gel100ml,£8,£8.00 per 100ml,
Durex Pleasure Me Condoms,Durex Pleasure Me Condoms20 per pack,£13.50,67.5p each,"Offer price £13.50, was £15"
Durex Pleasure Me Ribbed and Dotted Condoms,Durex Pleasure Me Ribbed and Dotted Condoms12 per pack,£10.99,91.6p each,
Durex Real Feel Non Latex Condoms,Durex Real Feel Non Latex Condoms12 per pack,£13.50,£1.13 each,"Offer price £13.50, was £15"
Durex Reel Feel Condoms,Durex Reel Feel Condoms18 per pack,£20,£1.11 each,
Durex Thin Feel Condoms ,Durex Thin Feel Condoms 20 per pack,£13.50,67.6p each,"Offer price £13.50, was £14.99"
Durex Thin Feel Condoms ,Durex Thin Feel Condoms 12 per pack,£10.99,91.6p each,
Durex Thin Feel Condoms  ,Durex Thin Feel Condoms  6 per pack,£6.49,£1.08 each,
Durex Thin Feel Condoms,Durex Thin Feel Condoms12 per pack,£13,£1.08 each,
Durex Thin Feel Extra Lubricated Condoms,Durex Thin Feel Extra Lubricated Condoms12 per pack,£11.50,95.5p each,"Offer price £11.50, was £13"
Durex Thin Feel XL Wide Condoms,Durex Thin Feel XL Wide Condoms12 per pack,£13,£1.08 each,
E45 Eczema Repair Cream,E45 Eczema Repair Cream50ml,£21,£42.00 per 100ml,
E45 Lotion ,E45 Lotion 500ml,£9.50,£1.90 per 100ml,
Earex Advance Ear Drops ,Earex Advance Ear Drops 12ml,£5,£41.67 per 100ml,
Elastoplast Disney Frozen Plasters,Elastoplast Disney Frozen Plasters,£3,,
Elastoplast Elastic Fabric Roll Plaster 2.5cm X 3m,Elastoplast Elastic Fabric Roll Plaster 2.5cm X 3m,£3.25,,
Elastoplast Fabric Plasters ,Elastoplast Fabric Plasters 40 per pack,£3,7.5p each,
"Elastoplast Hypoallergenic Plasters, Sensitive Skin ","Elastoplast Hypoallergenic Plasters, Sensitive Skin 20 per pack",£2.70,13.5p each,
Elastoplast Paw Patrol,Elastoplast Paw Patrol20 per pack,£3,15p each,
"Elastoplast Water Resistant  Plasters, All-Purpose",Elastoplast Water Resistant…40 per pack,£3,7.5p each,
Eucalyptus Oil ,Eucalyptus Oil 10ml,£2.50,£2.50 per 10ml,
Eurax Cream                       ,Eurax Cream                       30g,£3.50,£11.67 per 100g,
Feather & Down Magnesium Sleep Salts ,Feather & Down Magnesium Sleep Salts 500g,£8,£1.60 per 100g,
Feather & Down Pillow Spray,Feather & Down Pillow Spray100ml,£7,£7.00 per 100ml,
Feather & Down Pillow Spray Duo ,Feather & Down Pillow Spray Duo 2 x 50ml,£8,£8.00 per 100ml,
Feminax Express Ibuprofen Lysine 342mg Tablets,Feminax Express Ibuprofen…16 per pack,£4.50,28.1p each,
Feroglobin Capsules,Feroglobin Capsules30 per pack,£5,16.7p each,
Feroglobin Liquid   ,Feroglobin Liquid   200ml,£4.25,£2.13 per 100ml,
Fishermans Friend Original,Fishermans Friend Original3 x 25g,£2.30,£3.07 per 100g,
Flarin Joint & Muscular Pain Relief 200Mg Ibuprofen Soft Capsules,Flarin Joint & Muscular Pain Relief 2…12 per pack,£5.25,43.8p each,
Floradix Floravital Liquid Iron and Vitamin Gluten Free Formula,Floradix Floravital Liquid Iron and V…250ml,£12,£4.80 per 100ml,
Floradix Kindervital Kid's Fruity Liquid calcium and Vitamin Formula 3yrs+,Floradix Kindervital Kid's Fruity Liquid ca…250ml,£10,£4.00 per 100ml,
Floradix Kindervital Kid's Liquid Calcium and Vitamin Formula 3yrs+,Floradix Kindervital Kid's Liquid Calci…500ml,£17.20,£3.44 per 100ml,
Floradix Liquid Iron and Vitamin Formula ,Floradix Liquid Iron and Vitamin Formula 250ml,£12,£4.80 per 100ml,
Floradix Liquid Iron and Vitamin Formula,Floradix Liquid Iron and Vitamin Formula500ml,£18,£3.60 per 100ml,
Floradix Magnesium Liquid Formula,Floradix Magnesium Liquid Formula250ml,£9,£3.60 per 100ml,
Fulfil Chocolate Brownie Vitamin & Protein Bar ,Fulfil Chocolate Brownie Vitamin & Protein Bar 55g,£2.70,£4.91 per 100g,
Fulfil Chocolate Hazelnut Whip Vitamin & Protein Cereal Bar,Fulfil Chocolate Hazelnut Whip Vi…55g,£2.70,£4.91 per 100g,
Fulfil Chocolate Peanut Butter Protein Bar,Fulfil Chocolate Peanut Butter Protein Bar,£2.70,,
Fulfil Chocolate Salted Caramel Vitamin & Protein Bar,Fulfil Chocolate Salted Caram…55g,£2.70,£4.91 per 100g,
Fulfil White Chocolate Peanut & Caramel ProteinBar,Fulfil White Chocolate Pean…,£2.70,,
Full Marks Solution         ,Full Marks Solution         100ml,£5.25,£5.25 per 100ml,
Full Marks Solution 5 Minute Treatment 4 Treatments,Full Marks Solution 5 Minute…200ml,£12,£6.00 per 100ml,
Fybogel Chews,Fybogel Chews30 per pack,£10,33.3p each,
"Fybogel Hi - Fibre Orange Flavour, 30 Sachets","Fybogel Hi - Fibre Orange Flavour, 30 Sachets",£7.50,,
Fybogel Hi Fibre Orange    ,Fybogel Hi Fibre Orange    10 per pack,£4.10,41p each,
Galphar Ibuprofen 200mg Caplets,Galphar Ibuprofen 200mg Caplets16 per pack,45p,2.8p each,
Galpharm Aspirin 75mg Gastro-Resistant 28 Tablets,Galpharm Aspirin 75mg Gastr…,£1.50,,
Galpharm Esomeprazole Tablets,Galpharm Esomeprazole Tablets14 per pack,£9,64.3p each,
Galpharm Ibuprofen Capsules ,Galpharm Ibuprofen Capsules 16 per pack,80p,5p each,
Galpharm Ibuprofen Soft Liquid Capsules,Galpharm Ibuprofen Soft Liquid Capsules16 per pack,£2,12.5p each,
Galpharm Nicotine Replace 2mg Gum Peppermint Flavour ,Galpharm Nicotine Replace 2mg…96 per pack,£9,9.4p each,
Galpharm Nicotine Replace 2mg Lozenges,Galpharm Nicotine Replace 2mg Lozenges36 per pack,£4,11.1p each,
Galpharm Nicotine Replace 4mg Gum Peppermint Flavour ,Galpharm Nicotine Replace 4mg…96 per pack,£9,9.4p each,
Galpharm Rehydration Sachets,Galpharm Rehydration Sachets6 per pack,£2,33.3p each,
Gavinatura Heartburn & Indigestion Relief Tablets,Gavinatura Heartburn & Indigestion Relief Tablets14 per pack,£9,64.3p each,
Gaviscon Advance Double Strength Heartburn & Indigestion Aniseed Flavour,Gaviscon Advance Double Strengt…300ml,£11.50,£3.83 per 100ml,
Gaviscon Advance Peppermint ,Gaviscon Advance Peppermint 300ml,£11.50,£3.83 per 100ml,
Gaviscon Advance Tablets,Gaviscon Advance Tablets24 per pack,£7.50,31.3p each,
Gaviscon Double Action Aniseed ,Gaviscon Double Action Aniseed 300ml,£9.75,£3.25 per 100ml,
Gaviscon Double Action Heartburn & Indigestion Liquid Mint Flavour,Gaviscon Double Action Heartburn & Indi…300ml,£9.75,£3.25 per 100ml,
Gaviscon Double Action Heartburn & Indigestion Liquid Mint Flavour,Gaviscon Double Action Heartburn & Indi…150ml,£6,£4.00 per 100ml,
Gaviscon Double Action Heartburn & Indigestion Mint Flavour Tablets,Gaviscon Double Action Heartburn & Indi…48 per pack,£9.50,19.8p each,
Gaviscon Double Action Heartburn & Indigestion Mint Flavour Tablets,Gaviscon Double Action Heartburn & Indi…24 per pack,£6,25p each,
Gaviscon Double Action Heartburn & Indigestion Mint Flavour Tablets,Gaviscon Double Action Heartburn & Indi…12 per pack,£3.75,31.3p each,
Gaviscon Double Action Heartburn & Indigestion Mint Flavour Tablets,Gaviscon Double Action Heartburn & Indi…8 per pack,£2.75,34.4p each,
Gaviscon Double Action Heartburn & Indigestion Mixed Berries Tablets,Gaviscon Double Action Heartburn & Indi…24 per pack,£6,25p each,
Gaviscon Double Action Liquid Aniseed,Gaviscon Double Action Liquid Aniseed600ml,£14,£2.33 per 100ml,
Gaviscon Double Action Liquid Heartburn & Indigestion Relief Mint Flavour,Gaviscon Double Action Liquid H…600ml,£12.50,£2.08 per 100ml,
Gaviscon Double Action Liquid Mixed Berry,Gaviscon Double Action Liquid Mixed Berry150ml,£6,£4.00 per 100ml,
Gaviscon Double Action Liquid Mixed Berry,Gaviscon Double Action Liquid Mixed Berry300ml,£9.75,£3.25 per 100ml,
Gaviscon Double Action Mixed Berry Tablets,Gaviscon Double Action Mixed Berry Tablets12 per pack,£3.75,31.3p each,
Gaviscon Double Action Tablets Mixed Berry ,Gaviscon Double Action Tablets Mixed Berry 48 per pack,£9.50,19.8p each,
Gaviscon Heartburn & Indigestion Peppermint Flavour,Gaviscon Heartburn & Indigest…600ml,£11,£1.83 per 100ml,
Gaviscon Heartburn & Indigestion Relief Peppermint Flavour Tablets,Gaviscon Heartburn & Indige…48 per pack,£7,14.6p each,
Gaviscon Heartburn & Indigestion Relief Tablets Peppermint Flavour Tablets,Gaviscon Heartburn & Indigestio…24 per pack,£4,16.7p each,
Gaviscon Liquid Aniseed,Gaviscon Liquid Aniseed200ml,£5.75,£2.88 per 100ml,
Gaviscon Liquid Heartburn & Indigestion Relief Aniseed Flavour,Gaviscon Liquid Heartburn & Indiges…600ml,£11,£1.83 per 100ml,
Gaviscon Liquid Peppermint,Gaviscon Liquid Peppermint200ml,£5.75,£2.88 per 100ml,
Germolene Dual Action Antiseptic Cream,Germolene Dual Action Antiseptic Cream55g,£3,£5.45 per 100g,
"Germoloids Haemorrhoid Suppositories, Piles Treatment with Anaesthetic ",Germoloids Haemorrhoid Suppos…24 per pack,£6.30,26.3p each,
Germoloids Triple Action Cream,Germoloids Triple Action Cream55g,£6.50,£1.18 per 10g,
Getein Covid Test 5 pack,Getein Covid Test 5 pack,£7.99,,
Get More Vits Multivitamin Berry Chewing Gum,Get More Vits Multivitamin Berry Chewing Gum10 per pack,£1.25,12.5p each,
Get More Vits Multivitamin Peppermint Chewing Gum ,Get More Vits Multivitamin Peppermint Chewing Gum 10 per pack,£1.25,12.5p each,
Glycerin Suppository ,Glycerin Suppository 12 per pack,£2.50,20.8p each,
Green Origins Superboost Coffee & Vanilla Plant Protein Powder,Green Origins Superboost Coffee & V…125g,£10,£8.00 per 100g,
Green Origins Superboost Strawberry & Acerola Plant Protein Powder,Green Origins Superboost Strawberry & A…125g,£10,£8.00 per 100g,
Green Origins Superboost Superberries Plant Protein Powder,Green Origins Superboost Superber…125g,£10,£8.00 per 100g,
Grenade Oreo Protein Bar,Grenade Oreo Protein Bar60g,£2.20,£3.67 per 100g,"Offer price £2.20, was £2.85"
Grenade Protein Bar Birthday Cake ,Grenade Protein Bar Birthday Cake 60g,£2.20,£3.67 per 100g,"Offer price £2.20, was £2.85"
Grenade Protein Bar Caramel Chaos,Grenade Protein Bar Caramel Chaos60g,£2.20,£3.67 per 100g,"Offer price £2.20, was £2.85"
Grenade Protein Bar Chocolate Chip Cookie Dough,Grenade Protein Bar Choco…60g,£2.20,£3.67 per 100g,"Offer price £2.20, was £2.85"
Grenade Protein Bar Chocolate Chip Salted Caramel ,Grenade Protein Bar Chocola…60g,£2.20,£3.67 per 100g,"Offer price £2.20, was £2.85"
Grenade Protein Bar Fudged Up ,Grenade Protein Bar Fudged Up 60g,£2.20,£3.67 per 100g,"Offer price £2.20, was £2.85"
Grenade Protein Bar Jaffa Quake,Grenade Protein Bar Jaffa Quake60g,£2.20,£3.67 per 100g,"Offer price £2.20, was £2.85"
Grenade Protein Bar Lemon Cheesecake,Grenade Protein Bar Lemon Cheesecake60g,£2.20,£3.67 per 100g,"Offer price £2.20, was £2.85"
Grenade Protein Bar Peanut Nutter,Grenade Protein Bar Peanut Nutter60g,£2.20,£3.67 per 100g,"Offer price £2.20, was £2.85"
Grenade Protein Bar White Chocolate Cookie,Grenade Protein Bar White Chocolate Cookie60g,£2.20,£3.67 per 100g,"Offer price £2.20, was £2.85"
Grenade Protein Bar White Chocolate Salted Peanut,Grenade Protein Bar White C…60g,£2.20,£3.67 per 100g,"Offer price £2.20, was £2.85"
Guardium Acid Reflux Control Gastro Resistant Tablets,Guardium Acid Reflux Control…7 per pack,£6,85.7p each,"Offer price £6, was £7"
Guardium Acid Reflux Control Gastro Resistant Tablets,Guardium Acid Reflux Control…14 per pack,£12,85.7p each,
Haemorrhoid Relief Ointment ,Haemorrhoid Relief Ointment 25g,£3.50,£14.00 per 100g,
Haliborange Adult Calm Cherry Gummies,Haliborange Adult Calm Cherry Gummies30 per pack,£11.65,38.8p each,
Haliborange Adult Gut Health Strawberry,Haliborange Adult Gut Health Strawberry30 per pack,£11,36.7p each,
Haliborange Adult High Strength Immune Support Orange Gummies 1000IU,Haliborange Adult High Strength Immune…45 per pack,£11.65,25.9p each,
Haliborange Adult Immune Vitamins ,Haliborange Adult Immune Vitamins 30 per pack,£11,36.7p each,
Haliborange Adult Multi Vitamin ,Haliborange Adult Multi Vitamin 30 per pack,£11,36.7p each,
Haliborange Adult Multivitamin Energy & Immune Support Orange Gummies ,Haliborange Adult Multivitami…30 per pack,£11.65,38.8p each,
Haliborange Adult's Beauty Collagen Pineapple Gummies ,Haliborange Adult's Beauty Coll…30 per pack,£11.65,38.8p each,
Haliborange Adult's Gut Health Digestion Support Strawberry Gummies ,Haliborange Adult's Gut Health Digestio…30 per pack,£11.65,38.8p each,
Haliborange Adult's Immune Support Lime Gummies  ,Haliborange Adult's Immune…30 per pack,£11.65,38.8p each,
Haliborange Adult Vitamin D ,Haliborange Adult Vitamin D 45 per pack,£11,24.4p each,
Haliborange Calcium & Vit D Softies 30's Strawberry,Haliborange Calcium & Vit D Softies 30's Strawberry30 per pack,£5.50,18.3p each,
Haliborange Kids Iron & Vit C Strawberry Flavour Softie ,Haliborange Kids Iron & Vit C S…30 per pack,£6,20p each,
Haliborange  Kid's Softies Calcium & Vitamin D Strawberry Gummies 3-12yrs ,Haliborange  Kid's Softies Calc…60 per pack,£9.50,15.8p each,
Haliborange Kid's Softies Calcium & Vitamin D Strawberry Gummies 3-7yrs,Haliborange Kid's Softies Cal…30 per pack,£5.50,18.3p each,
Haliborange Kid's Softies Iron + Vitamin C  Strawberry Gummies 3-12yrs,Haliborange Kid's Softies Iro…30 per pack,£6.40,21.3p each,
Haliborange Kid's Softies Multivitamin Orange Gummies 3-12yrs,Haliborange Kid's Softies Multivita…30 per pack,£4.50,15p each,
Haliborange Kid's Softies Vegan Multivitamins Blueberry Gummies 3-12yrs,Haliborange Kid's Softies Veg…30 per pack,£6.05,20.2p each,
Haliborange Kids Vitamin D Softies 30s,Haliborange Kids Vitamin D Softies 30s30 per pack,£5.50,18.3p each,
Haliborange Mr Happy Softies 30's Strawberry,Haliborange Mr Happy Softies 30's Strawberry30 per pack,£5,16.7p each,
Haliborange Multivitamin  Softies 30's Strawberry,Haliborange Multivitamin  Softies 30's Strawberry30 per pack,£5,16.7p each,
Haliborange Multivitamin  Softies 60's Strawberry,Haliborange Multivitamin  Softies 60's Strawberry,£10,,
Haliborange Omega 3 Softies 30's Orange,Haliborange Omega 3 Softies 30's Orange30 per pack,£5.50,18.3p each,
Haliborange Omega 3 Softies 60's Orange,Haliborange Omega 3 Softies 60's Orange,£10,,
Haliborange Omega 3 Teen Softies 30's Orange,Haliborange Omega 3 Teen Softies 30's Orange30 per pack,£6,20p each,
Haliborange Vitamin D Softies,Haliborange Vitamin D Softies30 per pack,£5.55,18.5p each,
"Haliborange Whole Family Vitamin A, C & D Orange Chewable Tablets ","Haliborange Whole Family Vitamin A, C &…120 per pack",£8.05,6.7p each,
Halls Cherry Flavour Menthol Action Sugar Free Throat Sweet,Halls Cherry Flavour Menthol Acti…32g,75p,£2.34 per 100g,
Halls Extra Strong Menthol Action Throat Sweet,Halls Extra Strong Mentho…33.5g,75p,£2.24 per 100g,
Halls Original Sugar Free Throat Sweet,Halls Original Sugar Free Throat Sweet32g,75p,£2.34 per 100g,
Halls Soothers Blackcurrant Throat Sweet,Halls Soothers Blackcurrant Throat Sweet45g,75p,£1.67 per 100g,
Halls Soothers Cherry,Halls Soothers Cherry10 per pack,75p,7.5p each,
Halls Soothers Throat Sweet Variety Pack 4 Pack,Halls Soothers Throat Sweet Variety Pack 4 Pack180g,£2.25,£1.25 per 100g,
HayMax Organic Pollen Balm,HayMax Organic Pollen Balm5ml,£2.50,£50.00 per 100ml,
Health & Her Menopause Multi Nutrient Support,Health & Her Menopause Multi Nutrient Support,£15,,"Offer price £15, was £20"
Health & Her Perimenopause Mind+ Multi Nutrient Support,Health & Her Perimenopause Mind…30 per pack,£13.50,45p each,"Offer price £13.50, was £20"
Health & Her Perimenopause Multi Nutrient Support,Health & Her Perimenopause…,£15,,"Offer price £15, was £20"
Health & Her Sleep+ Multi Nutrient Support,Health & Her Sleep+ Multi Nutrient Support30 per pack,£15,50p each,"Offer price £15, was £20"
Hedrin Treat And Go Mousse,Hedrin Treat And Go Mousse100ml,£6.50,£6.50 per 100ml,
Hell Energy Drink Classic,Hell Energy Drink Classic250ml,70p,28p per 100ml,
HIGH5 Berry Electrolyte Sports Drink Tablets ,HIGH5 Berry Electrolyte Sports Drink Tablets 20 per pack,£6.99,35p each,
HIGH5 Berry Energy Gel Multipack ,HIGH5 Berry Energy Gel Multipack 6 x 44g,£7.95,£3.01 per 100g,
HIGH5 Citrus Electrolyte Sports Drink Tablets ,HIGH5 Citrus Electrolyte Sports Drink Tablets 20 per pack,£6.99,35p each,
HIGH5 Citrus Energy Drink Powder,HIGH5 Citrus Energy Drink Powder1kg,£18,£1.80 per 100g,
HIGH5 Energy Gel Taster Pack ,HIGH5 Energy Gel Taster Pack 8 per pack,£11.95,£1.49 each,
HIGH5 Orange Energy Gel Multipack ,HIGH5 Orange Energy Gel Multipack 6 x 44g,£7.95,£3.01 per 100g,
HIGH5 Raspberry Caffeine Energy Gel ,HIGH5 Raspberry Caffeine Energy Gel 40g,£2.30,£5.75 per 100g,
HIGH5 Tropical Electrolyte Sports Drink Tablets ,HIGH5 Tropical Electrolyte Sports Drink Tablets 20 per pack,£6.99,35p each,
HIGH5 ZERO Blackcurrant Electrolyte Sports Drink Tablets ,HIGH5 ZERO Blackcurrant Electroly…20 per pack,£7.65,38.3p each,
HIGH5 ZERO Strawberry & Kiwi Electrolyte Sports Drink Tablets ,HIGH5 ZERO Strawberry & Kiwi Electr…20 per pack,£7.65,38.3p each,
"Higher Nature Everyday Essentials Complete Omegas 3, 6, 7 & 9 Capsules ",Higher Nature Everyday Essent…90 per pack,£24,26.7p each,
Higher Nature Everyday Essentials High Strength B Complex Vitamin Capsules ,Higher Nature Everyday Essentia…90 per pack,£20,22.2p each,
Higher Nature Everyday Essentials Magnesium Effervescent Tablets 200mg,Higher Nature Everyday Essent…20 per pack,£6,30p each,
Higher Nature Everyday Essentials Multivitamin Effervescent Tablets 200mg,Higher Nature Everyday Essentia…20 per pack,£6,30p each,
Higher Nature Everyday Essentials Super Magnesium Capsules 300mg,Higher Nature Everyday Esse…90 per pack,£19,21.1p each,
Higher Nature Everyday Essentials Vitamin C Effervescent Tablets 1000mg,Higher Nature Everyday Essent…20 per pack,£4.50,22.5p each,
Higher Nature Everyday Essentials Vitamin D3 Capsules 2000iu,Higher Nature Everyday Essentials V…120 per pack,£12,10p each,
Higher Nature Immune Effervescent,Higher Nature Immune Effervescent20 per pack,£6.50,32.5p each,
Higher Nature Kid's Growing Bones Strawberry Chewable Tablets 3yrs+,Higher Nature Kid's Growing…90 per pack,£20,22.2p each,
Higher Nature Super Potency Fish Oil,Higher Nature Super Potency Fish Oil90 per pack,£35,38.9p each,
Hri Clear Complexion Tablets,Hri Clear Complexion Tablets60 per pack,£5.50,9.2p each,
Hri Coldcare Tablets,Hri Coldcare Tablets30 per pack,£2,6.7p each,
Hri Good Mood Tablets,Hri Good Mood Tablets30 per pack,£9,30p each,
Hri Milk Thistle Tablets,Hri Milk Thistle Tablets30 per pack,£13,43.3p each,
HRI Water Balance Tablets    ,HRI Water Balance Tablets    60 per pack,£4.50,7.5p each,
Imodium Instants Loperamide Hydrochloride ,Imodium Instants Loperamide Hydrochloride 12 per pack,£6.50,54.2p each,
Imodium Instants Tablets,Imodium Instants Tablets6 per pack,£3.80,63.3p each,
Imodium Original Capsules,Imodium Original Capsules12 per pack,£5.50,45.8p each,
Imodium Original Capsules 2mg,Imodium Original Capsules 2mg6 per pack,£3.30,55p each,
Imodium Plus Comfort Tablets,Imodium Plus Comfort Tablets6 per pack,£4.50,75p each,
