name,Price Per Unit,Price Per Measure,Promotion
Lenor Outdoorable Fabric Conditioner 55 Washes,Lenor Outdoor…770ml,£3.00,£3.90 per litre,
Flash Power Mop Liquid Refill Sea Minerals ,Flash Power Mop…1.25L,£4.00,£3.20 per litre,
Bold All-in-1 Pods Washing Capsules Spring Awakening Washes,Bold All-in-1…33 per pack,£7.00,21.2p each,"Offer price £7, was £10"
Bold All In 1 Pods Washing Capsules Spring Awakening Washes,Bold All In 1…51 per pack,£14.00,27.5p each,
Bold 2-in-1 Washing Liquid Pink Blossom Washes,Bold 2-in-1 Washi…1.995L,£7.00,35.1p per 100ml,"Offer price £7, was £9"
Lenor Outdoorable Fabric Conditioner 55 Washes,Lenor Outdoor…770ml,£3.00,£3.90 per litre,
Fairy Platinum Plus Auto Dishwasher Tablets Lemon,Fairy Platinum Plus…42 per pack,£9.00,21.4p each,"Offer price £9, was £11"
Flash Speed Mop Replacement Cloths,Flash Speed…12 per pack,£5.00,41.7p each,
Bold All-in-1 Pods Washing Capsules Pink Blossom Washes,Bold All-in-1 Pod…51 per pack,£14.00,27.5p each,
Bold All in 1 Pods Washing Capsules Lavender and Camomile Washes ,Bold All in 1 P…13 per pack,£3.50,26.9p each,"Offer price £3.50, was £4.50"
Lenor Ruby Jasmine Fabric Conditioner 48 Washes   ,Lenor Ruby Jasmine…1.68L,£3.00,£1.78 per litre,"Offer price £3, was £3.50"
Daz All In 1 Pods Whites & Colours Washing Liquid Capsules,Daz All In 1 Pods…12 per pack,£3.00,25p each,
Bold Washing Powder 38 Washes,Bold Washing…2.47kg,£7.00,£2.83 per kg,
Fairy All In One Dishwasher Tablets Lemon,Fairy All In One Dish…19 per pack,£4.00,21.1p each,
Bold All in 1 Pods Washing Capsules Lavender and Camomile Washes,Bold All in 1 P…33 per pack,£7.00,21.2p each,"Offer price £7, was £10"
Lenor Spring Awakening Tumble Dryer Sheets,Lenor Spring Aw…34 per pack,£2.00,5.9p each,"Offer price £2, was £3"
Bold All-in-1 Pods Washing Capsules Lavender & Camomile,Bold All-in-1 Pod…25 per pack,£7.00,28p each,
Lenor Fabric Conditioner Spring Awakening Scent 83 Washes,Lenor Fabric…2.9L,£4.75,£1.64 per litre,
Morrisons Dental Sticks Medium,Morrisons Denta…7 per pack,95p,13.6p each,
Morrisons Super Absorbent Cat Litter,Morrisons Sup…10L,£4.50,45p per litre,
Pedigree Schmackos Adult Dog Treats Meaty Multi Mix 20 Strips,Pedigree Schmac…144g,£1.95,£1.35 per 100g,Buy 2 for £2.50
Lenor Outdoorable Fabric Conditioner 55 Washes,Lenor Outdoorable Fabric…770ml,£3.00,£3.90 per litre,
Lenor Summer Breeze Fabric Conditioner 33 Washes,Lenor Summer Breeze…1.155L,£2.25,£1.95 per litre,
Lenor Gold Orchid Fabric Conditioner 30 Washes,Lenor Gold Orchid Fabric…1.05L,£3.25,£3.10 per litre,
Daz Washing Liquid 47 Washes,Daz Washing Liquid 47 Washes1.645L,£6.00,£3.65 per litre,
Flash Speed Mop Refills Pads,Flash Speed Mop Refills Pads20 per pack,£5.00,25p each,
Comfort Sensitive Skin Fabric Conditioner Pure 33 Washes,Comfort Sensitive Skin…0.99L,£2.25,£2.27 per litre,
Bold All-in-1 Pods Washing Capsules Spring Awakening Washes,Bold All-in-1 Pods Washing Capsul…13 per pack,£3.50,26.9p each,"Offer price £3.50, was £4.50"
Bold All in 1 Pods Washing Capsules Exotic Bloom Washes,Bold All in 1 Pods Washing Caps…33 per pack,£7,21.2p each,"Offer price £7, was £10"
Fairy Original All In One Auto Dishwashing Tablet,Fairy Original All In One Auto Dishwashing Tablet60 per pack,£9,15p each,"Offer price £9, was £11"
Lenor Outdoorable Fabric Conditioner x35,Lenor Outdoorable Fabric Conditioner x35490ml,£2.50,£5.10 per litre,"Offer price £2.50, was £4.50"
Viakal Classic Limescale Remover Spray,Viakal Classic Limescale Remover Spray500ml,£3,£6.00 per litre,
Viakal Fresh Limescale Remover Spray With Febreze,Viakal Fresh Limescale Remo…500ml,£3,£6.00 per litre,
	 Persil Bio Washing Liquid Laundry Detergent 53 Washes,	 Persil Bio Washing Liquid Lau…1431ml,£9,£6.29 per litre,
7th Heaven Renew You Collagen Wrinkle Filler,7th Heaven Renew You Collagen Wrinkle Filler,£3,,
7th Heaven Renew You Detox & Replenish Hydrogel Mask,7th Heaven Renew You Detox &…,£5,,
ACE For Colours Stain Remover ,ACE For Colours Stain Remover 1L,£2,£2.00 per litre,
ACE For Colour Stain Remover Spray,ACE For Colour Stain Remover Spray650ml,£3.25,£5.00 per litre,
Ace For Whites Stain Remover Power Mousse Spray,Ace For Whites Stain Remo…700ml,£3.25,£4.64 per litre,
ACE Ultra For Whites Fabric Stain Remover,ACE Ultra For Whites Fabric Stain Remover1L,£2,£2.00 per litre,
Addis 12 Litre Mop Pail & Wringer ,Addis 12 Litre Mop Pail & Wringer ,£7.99,£7.99 each,
Addis Bamboo Chenille Tile Wall Duster,Addis Bamboo Chenille Tile Wall Duster,£4.99,£4.99 each,
"Addis Bamboo Dustpan & Brush Set, Bamboo","Addis Bamboo Dustpan & Brush Set, Bamboo",£9.99,£9.99 each,
"Addis Bamboo Natural Ostrich Feather Long Reach Duster, Bamboo",Addis Bamboo Natural Ostrich Feathe…,£9.99,£9.99 each,
"Addis Bamboo Window Shower Glass Squeegee, 23cm Wide, Bamboo",Addis Bamboo Window Shower Glass Sq…,£3.99,£3.99 each,
Addis ComfiGrip Handled 100% Fluffy Microfibre Duster,Addis ComfiGrip Handled 100%…,£6,£6.00 each,
Addis ComfiGrip Long Handled Bottle Brush,Addis ComfiGrip Long Handled Bottle Brush,£3.49,£3.49 each,
Addis ComfiGrip Metallic Graphite Large Dustpan & Brush Set  ,Addis ComfiGrip Metallic Graphite L…,£6.85,£6.85 each,
Addis ComfiGrip Squeegee,Addis ComfiGrip Squeegee,£3.50,£3.50 each,
Addis ComfiGrip Washing Up Dish Brush with Scraper,Addis ComfiGrip Washing Up…,£3.40,£3.40 each,
Addis Fluffy Microfibre Mop,Addis Fluffy Microfibre Mop,£10,£10.00 each,
"Addis Jumbo Dish Brush, Metallic","Addis Jumbo Dish Brush, Metallic",£1.49,£1.49 each,
Addis Large Soft Clothes Pegs ,Addis Large Soft Clothes Pegs 20 per pack,£4,20p each,
Addis Medium Soft Clothes Pegs ,Addis Medium Soft Clothes Pegs 24 per pack,£4,16.7p each,
Addis Metallic Graphite ComfiGrip Tile and Grout Cleaning Brush  ,Addis Metallic Graphite ComfiGrip Til…,£2.49,£2.49 each,
Addis  Mixed Colours Microfibre Super Sponge Pad  Set of 5,Addis  Mixed Colours Microfibre S…5 per pack,£5,£1.00 each,
Addis Wooden Clothes Pegs ,Addis Wooden Clothes Pegs 36 per pack,£3.05,8.5p each,
Airwick Active Fresh Room Spray Jasmine Bouquet,Airwick Active Fresh Room…237ml,£4.50,£1.90 per 100ml,
Airwick Aerosol Free Automatic Spray Eucalyptus,Airwick Aerosol Free Auto…,£8,,"Offer price £8, was £11"
Airwick Aerosol Free Automatic Spray Fresh Cotton,Airwick Aerosol Free Automa…,£8,,"Offer price £8, was £11"
Airwick Aerosol Free Automatic Spray Refill Cotton,Airwick Aerosol Free Automa…228ml,£5,£2.19 per 100ml,"Offer price £5, was £6"
Airwick Aerosol Free Automatic Spray Refill Eucalyptus,Airwick Aerosol Free Automatic…,£5,,"Offer price £5, was £6"
Airwick Aerosol Spray Cherry Blossom,Airwick Aerosol Spray Cherry Blossom250ml,£3,£12.00 per litre,
Airwick Aerosol Spray Cotton,Airwick Aerosol Spray Cotton250ml,£3,£12.00 per litre,
Airwick Aerosol Spray Spring Delight,Airwick Aerosol Spray Spring Delight250ml,£3,£12.00 per litre,
Airwick Aerosol Spray White Vanilla Bean,Airwick Aerosol Spray White Vanilla Bean250ml,£3,£12.00 per litre,
Airwick Candle Lavender Meadow,Airwick Candle Lavender Meadow,£3,,"Offer price £3, was £4"
Airwick Candle White Vanilla Bean,Airwick Candle White Vanilla Bean,£4,,
Air Wick Freshmatic Autospray Mulled Wine,Air Wick Freshmatic Autospray Mulled Wine2 x 250ml,£7.25,£1.45 per 100ml,
Airwick Freshmatic Kit & Refill Lavender,Airwick Freshmatic Kit & Refill Lavender,£6,,"Offer price £6, was £11"
Airwick Freshmatic Kit & Refill Morning Meadow,Airwick Freshmatic Kit & Refill Morning Meadow,£6,,"Offer price £6, was £8"
Airwick Freshmatic Kit & Refill Spring Delight,Airwick Freshmatic Kit & Refill Spring Delight,£6,,"Offer price £6, was £8"
Airwick Freshmatic Refill Crisp Linen & Lilac,Airwick Freshmatic Refill Crisp Linen & Lilac,£3.75,,"Offer price £3.75, was £4.25"
Airwick Freshmatic Refill Lavender,Airwick Freshmatic Refill Lavender,£3.75,,"Offer price £3.75, was £4.25"
Airwick Freshmatic Refill Pink Sweet Pea 250ml,Airwick Freshmatic Refill Pink Sweet Pea 250ml,£3.75,,"Offer price £3.75, was £4.25"
Airwick Freshmatic Refill Smooth Satin & Moonlily,Airwick Freshmatic Refill Smooth Satin & Moonlily,£3.75,,"Offer price £3.75, was £4.25"
Airwick Freshmatic Refill Spring Breeze & Vanilla,Airwick Freshmatic Refill Spring Breeze & Vanilla250ml,£3.75,£1.50 per 100ml,"Offer price £3.75, was £4.25"
Airwick Freshmatic Refill Stacey Morning Meadow,Airwick Freshmatic Refill Stacey Morning Meadow,£3.75,,"Offer price £3.75, was £4.25"
Airwick Freshmatic Refill Wild Rose & Patchouli,Airwick Freshmatic Refill Wild Rose & Patchouli,£3.75,,"Offer price £3.75, was £4.25"
Airwick Freshmatic Twin Refill Crisp Linen & Lilac,Airwick Freshmatic Twin Refill Crisp Linen & Lilac2 per pack,£7.25,£3.63 each,
Airwick Freshmatic Twin Refill Lavender,Airwick Freshmatic Twin Refill Lavender2 per pack,£7.25,£3.63 each,
Airwick Freshmatic Twin Refill Spring Delight,Airwick Freshmatic Twin Refill Spring Delight2 x 250ml,£7.25,£14.50 per litre,
Airwick Mist Kit & Refill Peony & Jasmine,Airwick Mist Kit & Refill Peony & Jasmine,£12.50,,
Airwick Mist Kit & Refill Stacey Morning Meadow,Airwick Mist Kit & Refill Stacey Morning Meadow,£12,,
Airwick Mist Refill Peony & Jasmine,Airwick Mist Refill Peony & Jasmine,£5.60,,
Airwick Mist Refill Stacey Morning Meadow,Airwick Mist Refill Stacey Morning Meadow,£4.50,,
Airwick Odour Neutralising Room Spray Fresh Cotton,Airwick Odour Neutralising…,£4.50,,
Airwick Odour Neutralising Spray Morning Meadow,Airwick Odour Neutralisin…237ml,£3.25,£1.37 per 100ml,
Airwick Plug In Kit & Refill Crisp Linen & Lilac,Airwick Plug In Kit & Refill Crisp Linen & Lilac,£6,,
Airwick Plug In Kit & Refill Stacey Morning Meadow,Airwick Plug In Kit & Refill Stacey Morning Meadow,£4.25,,
Airwick Plug In Refill Crisp Linen & Lilac,Airwick Plug In Refill Crisp Linen & Lilac,£3.75,,
Airwick Plug In Refill Pink Sweet Pea,Airwick Plug In Refill Pink Sweet Pea,£3.75,,
Airwick Plug In Refill Purple Lavender Meadow,Airwick Plug In Refill Purple Lavender Meadow,£3.75,,
Airwick Plug In Refill Spring Breeze & Vanilla,Airwick Plug In Refill Spring Breeze & Vanilla,£3.75,,
Airwick Plug In Refill Stacey Morning Meadow,Airwick Plug In Refill Stacey Morning Meadow,£3.25,,
Airwick Plug In Refill White Vanilla Bean,Airwick Plug In Refill White Vanilla Bean,£3.75,,
Airwick Plug In Refill Wild Rose & Patchouli,Airwick Plug In Refill Wild Rose & Patchouli,£3.75,,
Airwick Plug In Twin Refill Wild Rose & Patchouli,Airwick Plug In Twin Refill Wild Rose & Patchouli,£6.25,,"Offer price £6.25, was £7"
Airwick Reed Diffuser Stacey Morning Meadow 33ml,Airwick Reed Diffuser Stace…,£4.99,,
Airwick Reed Diffuser Wild Rose & Patchouli 33ml,Airwick Reed Diffuser Wild…,£4.99,,"Offer price £4.99, was £10.50"
Ajax Plant Based Biodegradable Wipes,Ajax Plant Based Biodegradable Wipes70 per pack,£5,7.1p each,
Ambi Pur Febreze Air Freshener Plug-In Refill Cotton Fresh 20ML,Ambi Pur Febreze Air Freshener Plug-I…,£6,,
Andrex Classic Clean Mega Toilet Roll ,Andrex Classic Clean Mega Toilet Roll 9 per pack,£7.99,88.8p each,"Offer price £7.99, was £8.75"
Andrex Classic Clean Toilet Roll,Andrex Classic Clean Toilet Roll9 per pack,£5.75,63.9p each,
Andrex Classic Clean Toilet Roll,Andrex Classic Clean Toilet Roll4 per pack,£3.15,78.8p each,
Andrex Classic Clean Toilet Roll,Andrex Classic Clean Toilet Roll12 per pack,£6.99,58.3p each,
Andrex Classic Clean Washlets,Andrex Classic Clean Washlets4 per pack,£5,£1.25 each,
Andrex Classic Clean Washlets Single Pack ,Andrex Classic Clean Washlets Single Pack 36 per pack,£1.50,4.2p each,Buy 3 for £3
Andrex Gentle Clean Toilet Roll,Andrex Gentle Clean Toilet Roll4 per pack,£2.65,66.3p each,
Andrex Gentle Clean Toilet Roll,Andrex Gentle Clean Toilet Roll9 per pack,£5,55.6p each,
Andrex Pure Care Washlets,Andrex Pure Care Washlets36 per pack,£1.75,4.9p each,Buy 3 for £3
Andrex Pure Care Washlets Quad ,Andrex Pure Care Washlets Quad 4 x 36 per pack,£6,4.2p each,
Andrex Supreme Quilts Toilet Roll,Andrex Supreme Quilts Toilet Roll4 per pack,£3.35,83.8p each,
Andrex Supreme Quilts Toilet Roll,Andrex Supreme Quilts Toilet Roll16 per pack,£10,62.5p each,"Offer price £10, was £11.85"
Andrex Supreme Quilts Toilet Roll,Andrex Supreme Quilts Toilet Roll9 per pack,£6.75,75p each,
Andrex Ultra Care Toilet Rolls,Andrex Ultra Care Toilet Rolls16 per pack,£11.85,74.1p each,
Andrex Ultra Care Toliet Roll,Andrex Ultra Care Toliet Roll9 per pack,£4.99,55.4p each,"Offer price £4.99, was £6.75"
Andrex Ultra Care Washlets Flushable Toilet Wipes,Andrex Ultra Care Washlets…36 per pack,£1.75,4.9p each,Buy 3 for £3
Ariel + Active Defence Washing Liquid Gel 38 Washes,Ariel + Active Defence Washin…1330ml,£10,£7.52 per litre,
Ariel +Active Odour Defence All in 1 Pods Washing Capsules,Ariel +Active Odour Defence All i…29 per pack,£9,31p each,
Ariel + Lenor Freshness All-in-1 Pods Washing Capsules Washes,Ariel + Lenor Freshness All-in-1 Po…29 per pack,£9,31p each,
Ariel + Lenor Freshness Washing Liquid Gel 38 Washes,Ariel + Lenor Freshness Washi…1330ml,£10,£7.52 per litre,
Ariel Colour All-in-1 Pods Washing Capsules Washes ,Ariel Colour All-in-1 Pods Wa…33 per pack,£7,21.2p each,"Offer price £7, was £10"
Ariel Colour All in1 pods Washing Capsules Washes,Ariel Colour All in1 pods W…51 per pack,£14,27.5p each,
Ariel Colour All in Pods Washing Capsules Washes,Ariel Colour All in Pods Wa…13 per pack,£3.50,26.9p each,"Offer price £3.50, was £4.50"
Ariel Colour Washing Liquid Gel 24 Washes,Ariel Colour Washing Liquid Gel 24 Washes840ml,£5,£5.95 per litre,
Ariel Colour Washing Liquid Washes,Ariel Colour Washing Liquid Washes1785ml,£10,56p per 100ml,
Ariel Original All-in-1 Pods Washing Capsules Washes,Ariel Original All-in-1 Pods…13 per pack,£3.50,26.9p each,"Offer price £3.50, was £4.50"
Ariel Original All -in -one Pods Washing Capsules Washes,Ariel Original All -in -one Pod…51 per pack,£14,27.5p each,
Ariel Original All in 1 pods Washing Capsules,Ariel Original All in 1 pods Washing Capsules25 per pack,£7,28p each,
Ariel Original All in 1 Pods Washing Capsules Washes,Ariel Original All in 1 Pods…33 per pack,£7,21.2p each,"Offer price £7, was £10"
Ariel Original Washing Liquid Gel 24 Washes,Ariel Original Washing Liquid Gel 24 Washes840ml,£5,£5.95 per litre,
Ariel Original Washing Liquid Washes,Ariel Original Washing Liquid Washes1.225L,£6,49p per 100ml,"Offer price £6, was £8"
Ariel Original Washing Liquid Washes,Ariel Original Washing Liquid Washes1785ml,£10,56p per 100ml,
Ariel Original Washing Powder 50 Washes,Ariel Original Washing Powder 50 Washes3.25kg,£11,£3.38 per kg,
Ariel Platinum + Lenor All-in-1 pods Washing Capsules Washes,Ariel Platinum + Lenor All-in-1 pod…39 per pack,£10.50,26.9p each,
Ariel Platinum + Lenor All-in-1 pods Washing Capsules Washes ,Ariel Platinum + Lenor All-in-1 pod…44 per pack,£10.50,23.9p each,
Ariel Platinum Stain Remover Washing Liquid Gel 38 Washes,Ariel Platinum Stain Remover Wash…1330ml,£10,£7.52 per litre,
Ariel Plus Platinum Extra Stain Removal All-in-1 Pods Washing Capsules,Ariel Plus Platinum Extra Stain Removal A…29 per pack,£9,31p each,
Ariel Washing Liquid Gel Original 35 Washes,Ariel Washing Liquid Gel Original 35 Washes1225ml,£8,£6.53 per litre,
Ariel Washing Powder Original 40 Washes,Ariel Washing Powder Original 40 Washes2.6kg,£9,£3.46 per kg,
Astonish Freshness Selection Concentrated Disinfectant,Astonish Freshness Selection Co…300ml,£1.25,£4.17 per litre,
Astonish Hob Cleaner,Astonish Hob Cleaner500ml,£2,£4.00 per litre,
Astonish Linen Fresh Ready To Use Disinfectant,Astonish Linen Fresh Ready To Use Disinfectant550ml,£1.25,£2.27 per litre,
Astonish Mould & Mildew Spray,Astonish Mould & Mildew Spray750ml,£1.25,£1.67 per litre,
Astonish Pink Roses Ready To Use Disinfectant,Astonish Pink Roses Ready To Use Disinfectant550ml,£1.25,£2.27 per litre,
Astonish Specialist Clean & Revive,Astonish Specialist Clean & Revive350g,£3,£8.57 per kg,
Astonish Specialist Leather Conditioning Cream,Astonish Specialist Leath…250ml,£3,£12.00 per litre,
Astonish Specialist Oven & Grill Cleaner & Sponge 250G,Astonish Specialist Oven & Gril…,£4,,
Baco EasyCut Cling Film Refill 60m,Baco EasyCut Cling Film Refill 60m,£3.75,,
Bacofoil All Purpose Medium Zipper Bags 12 Pack,Bacofoil All Purpose Medi…12 per pack,£3,25p each,
Bacofoil All Purpose Small Zipper Bags 15 Pack,Bacofoil All Purpose Small Zipper Bags 15 Pack15 per pack,£2.50,16.7p each,
Bacofoil Extra Wide Non-Stick Foil 5m,Bacofoil Extra Wide Non-Stick Foil 5m,£3.40,,"Offer price £3.40, was £4"
Bacofoil Kitchen Foil 10m,Bacofoil Kitchen Foil 10m,£4,,
Bacofoil Non Stick Baking Paper With Non Slip Base 10m,Bacofoil Non Stick Baking Paper…,£2.90,,"Offer price £2.90, was £3.50"
Bacofoil Pvc Free Cling Film 30m,Bacofoil Pvc Free Cling Film 30m,£3.50,,
Bacofoil The Non-Stick Kitchen Foil 20m ,Bacofoil The Non-Stick Kitchen Foil 20m ,£4.40,,"Offer price £4.40, was £5.25"
Bamboo & Recycled Plastic Dustpan & Brush 33.5cm,Bamboo & Recycled Plastic D…,£19.99,£19.99 each,
Bamboo & Recycled Plastic Pivoting Squeegee 24.1cm,Bamboo & Recycled Plastic P…,£11.99,£11.99 each,
BEAST Super Strong 50L Drawstring Swing Bin Bags,BEAST Super Strong 50L Draw…10 per pack,£3.50,35p each,
BEAST Super Strong 70L Drawstring Bin Bags,BEAST Super Strong 70L Drawstring Bin Bags10 per pack,£3.75,37.5p each,
Beldray Deep Clean Power Clean Scrubber Brush,Beldray Deep Clean Power…,£24.30,£24.30 each,
Beldray Dustpan and Brush Set,Beldray Dustpan and Brush Set,£10.45,£10.45 each,
Bic Home Candle BBQ Lighter,Bic Home Candle BBQ Lighter,£3.50,,
Bio-Bean Coffee Logs Premium Eco Briquettes 16 Logs,Bio-Bean Coffee Logs Premium…,£8,,
Bloo Acticlean Toilet Blocks,Bloo Acticlean Toilet Blocks2 x 38g,£1.50,£19.74 per kg,
Bloo Acticlean Zesty Lemon with Bicarb,Bloo Acticlean Zesty Lemon with Bicarb2 x 50g,£1.50,£15.00 per kg,
Bloo Blue Active Bleach,Bloo Blue Active Bleach50g,£2.50,£50.00 per kg,
Bloo Blue Active Fresh Flowers,Bloo Blue Active Fresh Flowers50g,£2.50,£50.00 per kg,
Bloo Brilliant Gel Arctic Ocean Toilet Rim Block,Bloo Brilliant Gel Arctic Ocean Toilet Rim Block42g,£2.50,£5.95 per 100g,
Bloo Fragrance Switch Apple Lily,Bloo Fragrance Switch Apple Lily,£2.50,,
Bloo Hygiene Bathroom Spray,Bloo Hygiene Bathroom Spray,£2,,
Bloo Incistern Cube Limescale Prevention ,Bloo Incistern Cube Limescale Prevention 2 x 50g,£2.50,£25.00 per kg,
Bloo Incistern Cube Original Blue ,Bloo Incistern Cube Original Blue 2 x 50g,£2.50,£25.00 per kg,
Bloo Lemon Power Fizz Tabs,Bloo Lemon Power Fizz Tabs12 per pack,£3.15,26.3p each,
Bloo Limescale Prevention Toilet Blocks 5 In 1 Twin,Bloo Limescale Prevention Toilet Blocks 5 In 1 Twin,£1.50,,
Bloo Max Colours Blue,Bloo Max Colours Blue,£1.85,,
Bloo Power Active Flowers Twin Toilet Rim Block,Bloo Power Active Flowers Twin Toilet Rim Block2 x 50g,£2.50,£2.50 per 100g,
Bloo Power Active Fragrance Boost Flowers,Bloo Power Active Fragrance Boost Flowers50g,£1.50,£30.00 per kg,
Bloo Power Active Fragrance Boost Lemon,Bloo Power Active Fragrance Boost Lemon50g,£1.50,£30.00 per kg,
Bloo Power Active Lemon,Bloo Power Active Lemon2 per pack,£2.50,£1.25 each,
Bloo Purple Active Lavender,Bloo Purple Active Lavender50g,£2.50,£5.00 per 100g,
Bold 2-In-1 Sparkling Bloom & Yellow Poppy Washing Liquid Gel  35 Washes,Bold 2-In-1 Sparkling Bloom & Y…1295ml,£8,£6.18 per litre,
Bold 2-in-1 Washing Liquid Pink Blossom Washes,Bold 2-in-1 Washing Liqui…1.995L,£7,35.1p per 100ml,"Offer price £7, was £9"
Bold 2-in-1 Washing Powder Lavender & Camomile ,Bold 2-in-1 Washing Powde…70 per pack,£11.50,16.4p each,
Bold 2In1 Gel Mrs Hinch 27 Washes,Bold 2In1 Gel Mrs Hinch 27 Washes945ml,£5,52.9p per 100ml,
Bold 2 in 1 Pink Blossom Washing Liquid Washes,Bold 2 in 1 Pink Blossom Washing Liquid Washes1085ml,£6.50,59.9p per 100ml,
Bold 2in1 Washing Liquid Gel Lavender and Camomile 35 Washes,Bold 2in1 Washing Liquid Gel Lavend…1295ml,£8,£6.18 per litre,
Bold 2 in1 Washing Liquid Gel Spring Awakening 24 Washes,Bold 2 in1 Washing Liquid Gel S…840ml,£5,£5.95 per litre,
Bold 2 In 1 Washing Liquid Gel Summer Breeze 24 Washes,Bold 2 In 1 Washing Liquid Gel…840ml,£5,£5.95 per litre,
Bold 2in1 Washing Liquid Lavender & Camomile Washes,Bold 2in1 Washing Liquid Lave…108ml,£6.50,£6.02 per 100ml,
Bold 2 in1 Washing Liquid Lavender and Camomile Washes,Bold 2 in1 Washing Liquid Laven…1680ml,£7,41.7p per 100ml,"Offer price £7, was £9"
Bold All-in-1 Pods Washing Capsules Lavender & Camomile,Bold All-in-1 Pods Washing Caps…25 per pack,£7,28p each,
Bold All-in-1 Pods Washing Capsules Pink Blossom Washes,Bold All-in-1 Pods Washing Caps…51 per pack,£14,27.5p each,
Bold All-in-1 Pods Washing Capsules Spring Awakening Washes,Bold All-in-1 Pods Washing Capsul…13 per pack,£3.50,26.9p each,"Offer price £3.50, was £4.50"
Bold All-in-1 Pods Washing Capsules Spring Awakening Washes,Bold All-in-1 Pods Washing Capsul…33 per pack,£7,21.2p each,"Offer price £7, was £10"
Bold All in 1 Pods Washing Capsules Exotic Bloom Washes,Bold All in 1 Pods Washing Caps…33 per pack,£7,21.2p each,"Offer price £7, was £10"
Bold All in 1 Pods Washing Capsules Lavender and Camomile Washes ,Bold All in 1 Pods Washing…13 per pack,£3.50,26.9p each,"Offer price £3.50, was £4.50"
Bold All in 1 Pods Washing Capsules Lavender and Camomile Washes,Bold All in 1 Pods Washing…33 per pack,£7,21.2p each,"Offer price £7, was £10"
Bold All in 1 pods Washing Capsules Pink Blossom,Bold All in 1 pods Washing…25 per pack,£7,28p each,
Bold All In 1 Pods Washing Capsules Spring Awakening Washes,Bold All In 1 Pods Washing Capsul…51 per pack,£14,27.5p each,
Bold All In 1 Pods Washing Liquid Capsules,Bold All In 1 Pods Washing Liquid Capsules36 per pack,£10,27.8p each,
Bold Pink Tulips And White Jasmine Capsules Mrs Hinch,Bold Pink Tulips And White Ja…36doz,£8.50,2p each,
Bold Washing Powder 38 Washes,Bold Washing Powder 38 Washes2.47kg,£7,£2.83 per kg,
Brabantia 40 Litre Grey Foldable Laundry Basket,Brabantia 40 Litre Grey Foldable Laundry Basket,£33,£33.00 each,
Brabantia Black Premium Peg Bag ,Brabantia Black Premium Peg Bag ,£11.20,£11.20 each,
Brasso Metal Polish Liquid,Brasso Metal Polish Liquid175ml,£4.25,£24.29 per litre,
Brasso Metal Polish Wadding,Brasso Metal Polish Wadding75g,£4.25,£56.67 per kg,
Brillo Pads,Brillo Pads10 per pack,£1.60,16p each,
Bryant & May Extra Long Matches,Bryant & May Extra Long Matches,£1,,
Buster Bathroom Plughole Unblocker,Buster Bathroom Plughole Unblocker300ml,£4.35,£14.50 per litre,
By Candlelight Candle Lighter Single,By Candlelight Candle Lighter Single,£2.40,,
Calgon Water Softener Anti Bacterial Gel,Calgon Water Softener Anti Bacterial Gel750ml,£7.50,£10.00 per litre,
Calgon Water Softener Limescale Prevention Gel,Calgon Water Softener Limescale Prevention Gel750ml,£7,£9.33 per litre,
Calgon Water Softener Limescale Prevention Tablets,Calgon Water Softener Limes…15 per pack,£6,40p each,
California Scents Car Scents New Car Air Freshener,California Scents Car Scent…,£5,,
Calvin Klein Eternity Now For Men Edt Spray,Calvin Klein Eternity Now For Men Edt Spray30ml,£18,£60.00 per 100ml,
Carrinet Veggio Reusable Fruit & Veg Bags,Carrinet Veggio Reusable Fruit & Veg Bags5 per pack,£6.99,£1.40 each,
Cherry Blossom Deluxe Shine & Go Black,Cherry Blossom Deluxe Shine & Go Black11ml,£4.25,£386.36 per litre,
Cherry Blossom Deluxe Shine & Go Neutral,Cherry Blossom Deluxe Shine & Go Neutral11ml,£4.25,£386.36 per litre,
Cherry Blossom Flat Lace Black 140cm,Cherry Blossom Flat Lace Black 140cm,£2.50,,
Cherry Blossom Flat Lace White 120cm,Cherry Blossom Flat Lace White 120cm,£2.50,,
Cherry Blossom Foam Comfort Insole,Cherry Blossom Foam Comfort Insole,£2.95,,
Cherry Blossom Heel Grip,Cherry Blossom Heel Grip,£1.50,,
Cherry Blossom Shine & Go Neutral,Cherry Blossom Shine & Go Neutral,£2.75,,
Cherry Blossom Shoe Care Brush Set,Cherry Blossom Shoe Care Brush Set,£3.95,,
Cherry Blossom Shoe Cleaner,Cherry Blossom Shoe Cleaner200ml,£5.25,£26.25 per litre,
Cherry Blossom Shoe Deodoriser,Cherry Blossom Shoe Deodoriser200ml,£5.25,£26.25 per litre,
Cherry Blossom Shoe Polish Black ,Cherry Blossom Shoe Polish Black 40g,£1.75,£4.38 per 100g,
Cherry Blossom Shoe Polish Light Tan ,Cherry Blossom Shoe Polish Light Tan 40g,£1.75,£4.38 per 100g,
Cherry Blossom Sports Whitener,Cherry Blossom Sports Whitener85ml,£3.80,£44.71 per litre,
Cherry Blossom Suede & Nubuck Renovator Black,Cherry Blossom Suede & Nubuck Renovator Black200ml,£5.50,£27.50 per litre,
Cherry Blossom Twin Pack Brown Round Lace 75cm,Cherry Blossom Twin Pack Brown Round Lace 75cm,£2.10,,
Cif Anti-Bacterial And Shine Multi-Purpose,Cif Anti-Bacterial And Shine Multi-Purpose700ml,£2,£2.86 per litre,
Cif Antibac Multi-Purpose Cleaning Spray Winter Warmth,Cif Antibac Multi-Purpose Clean…700ml,£2,28.6p per 100ml,
Cif Citrus Power & Shine Bathroom Mousse,Cif Citrus Power & Shine Bathroom Mousse500ml,£3,£6.00 per litre,
Cif Cream Winter,Cif Cream Winter500ml,£1.25,25p per 100ml,
Cif Ecorefill Anti-Bac & Shine,Cif Ecorefill Anti-Bac & Shine70ml,£1.50,£21.43 per litre,
Cif Floor Cleaner,Cif Floor Cleaner950ml,£1.75,£1.84 per litre,
Cif Lemon Cream Cleaner,Cif Lemon Cream Cleaner500ml,£1.50,£3.00 per litre,Buy 3 for £3
Cif Original Cream Cleaner,Cif Original Cream Cleaner500ml,£1.50,£3.00 per litre,Buy 3 for £3
Cif Perfect Finish Stainless Steel Multi Purpose Disinfectant,Cif Perfect Finish Stainless Steel…435ml,£3.50,80.5p per 100ml,
Cif Power & Shine Bathroom Spray ,Cif Power & Shine Bathroom Spray 700ml,£3,£4.29 per litre,
