name,Price Per Unit,Price Per Measure,Promotion
Cif Power & Shine Kitchen Spray,Cif Power & Shine Kitchen Spray700ml,£3,£4.29 per litre,
Cif Ultra Power Mould Stains Remover,Cif Ultra Power Mould Stains Remover500ml,£2,£4.00 per litre,
Cillit Bang Black Mould Remover Cleaner Spray ,Cillit Bang Black Mould Remover Cleaner Spray 750ml,£4,£5.33 per litre,
Cillit Bang Bleach & Hygiene Cleaner Spray,Cillit Bang Bleach & Hygiene Cleaner Spray750ml,£2.60,£3.47 per litre,
Cillit Bang Burnt On Degreaser Cleaner Spray,Cillit Bang Burnt On Degreaser Cleaner Spray750ml,£2.60,£3.47 per litre,
Cillit Bang Limescale Remover Cleaner Spray,Cillit Bang Limescale Remover Cleaner Spray750ml,£3.25,£4.33 per litre,
Cillit Bang Multipurpose Power Cleaner Spray,Cillit Bang Multipurpose Power Cleaner Spray750ml,£2.60,£3.47 per litre,
Comfort Blue Skies Fabric Conditioner 85 Washes ,Comfort Blue Skies Fabric Conditioner 85 Washes 3L,£4.50,£1.50 per litre,
Comfort Cherry Blossom & Sweet Pea Fabric Conditioner 33 Washes ,Comfort Cherry Blossom & Sweet Pea Fa…1.165L,£2.50,£2.15 per litre,
Comfort Coco Fantasy Ultra Concentrated Fabric Conditioner,Comfort Coco Fantasy Ultra Concen…870ml,£5,£5.75 per litre,
Comfort Creations Apple Blossom Fabric Conditioner 30 Washes,Comfort Creations Apple Blossom Fab…900ml,£2.25,25p per 100ml,
Comfort Creations Fabric Conditioner Cherry Blossom 30 Washes ,Comfort Creations Fabric Conditione…900ml,£2.25,25p per 100ml,
Comfort Creations Fabric Conditioner Honeysuckle & Sandalwood 30 Washes,Comfort Creations Fabric Conditioner Hone…900ml,£2.25,25p per 100ml,
Comfort Creations Fabric conditioner Passion Bloom 30 Washes,Comfort Creations Fabric conditione…900ml,£2.25,25p per 100ml,
Comfort Creations Fabric Conditioner Passion Bloom 48 Washes,Comfort Creations Fabric Conditione…1440ml,£3.75,26p per 100ml,
Comfort Creations Fabric Conditioner Strawberry and Lily 30 washes,Comfort Creations Fabric Conditioner St…900ml,£2.25,25p per 100ml,
Comfort Creations Fabric Conditioner Strawberry and Lily 48 washes,Comfort Creations Fabric Conditioner St…1440ml,£3.75,26p per 100ml,
Comfort Creations Fabric Conditioner Waterlily & Lime 30 Washes ,Comfort Creations Fabric Conditioner…900ml,£2.25,25p per 100ml,
Comfort Creations Fabric Conditioner Waterlily & Lime 48 Washes,Comfort Creations Fabric Conditioner…1440ml,£3.75,26p per 100ml,
Comfort Fabric Conditioner 58 Washes Tropical Lily,Comfort Fabric Conditioner…850ml,£5,£5.88 per litre,
Comfort Fabric Conditioner Blue Skies 160 Washes,Comfort Fabric Conditioner…4.8L,£9,£1.88 per litre,
Comfort Fabric Conditioner Blue Skies 33 Washes,Comfort Fabric Conditione…0.99L,£2.25,£2.27 per litre,
Comfort Fabric Conditioner Blue Skies Washes,Comfort Fabric Conditio…2490ml,£5.50,22.1p per 100ml,
Comfort Fabric Conditioner Honeysuckle & Sandalwood 48 Washes 1440ml,Comfort Fabric Conditioner Ho…1440ml,£3.75,26p per 100ml,
Comfort Fabric Conditioner Sunshiny Days 33 Washes,Comfort Fabric Conditioner…0.99L,£2.25,£2.27 per litre,
Comfort Fresh Sky Ultra Concentrated 78 Washes 1.178L,Comfort Fresh Sky Ultra Conce…1.78L,£4,£2.25 per litre,
Comfort Honeysuckle & Sandalwood Fabric Conditioner 55 Washes,Comfort Honeysuckle & Sandalwood Fa…1.925L,£3.25,£1.69 per litre,
Comfort Pure Ultra-Concentrated Fabric Conditioner 36 Washes,Comfort Pure Ultra-Concentrated Fab…540ml,£3.50,64.8p per 100ml,
Comfort Pure Ultra Concentrated Fabric Conditioner 58 Washes,Comfort Pure Ultra Concentrated Fab…870ml,£5,£5.75 per litre,
Comfort Sensitive Skin Fabric Conditioner Pure 160 Washes,Comfort Sensitive Skin Fabric Con…4.8L,£9,£1.88 per litre,
Comfort Sensitive Skin Fabric Conditioner Pure 33 Washes,Comfort Sensitive Skin Fabric C…0.99L,£2.25,£2.27 per litre,
Comfort Sunshiny Days Fabric Conditioner 85 Washes ,Comfort Sunshiny Days Fabric…3L,£4.50,£1.50 per litre,
Comfort Ultimate Care Fresh Sky Fabric Conditioner 36 Washes,Comfort Ultimate Care Fresh Sky Fab…540ml,£3.50,64.8p per 100ml,
Comfort Ultimate Care Fresh Sky Fabric Conditioner 58 Washes ,Comfort Ultimate Care Fresh Sky Fab…870ml,£5,£5.75 per litre,
Comfort Ultimate Care Fuchsia Passion Fabric Conditioner 36 Washes,Comfort Ultimate Care Fuchsia Passion F…540ml,£3.50,64.8p per 100ml,
Comfort Ultimate Care Fuchsia Passion Fabric Conditioner 78 Wash ,Comfort Ultimate Care Fuchsia Passion…1.178L,£4,£3.40 per litre,
Comfort Ultimate Care Heavenly Nectar Fabric Conditioner 58 Washes ,Comfort Ultimate Care Heavenly Nectar F…870ml,£5,£5.75 per litre,
Cook's Safety Matches,Cook's Safety Matches,£1,,
Cricket Firepower Refillable Lighter,Cricket Firepower Refillable Lighter,£3.30,,
Cushelle Original Toilet Tissue ,Cushelle Original Toilet Tissue 24 per pack,£13.65,56.9p each,
Cushelle Quilted 4 White Rolls,Cushelle Quilted 4 White Rolls4 per pack,£3,75p each,"Offer price £3, was £3.55"
Cushelle Quilted 9 White Rolls,Cushelle Quilted 9 White Rolls9 per pack,£5.95,66.1p each,
Cushelle Quilted Coconut ,Cushelle Quilted Coconut 16 per pack,£9.95,62.2p each,"Offer price £9.95, was £11.45"
Cushelle Quilted Tubeless Toilet Tissue 6 Rolls Equals 9 Rolls,Cushelle Quilted Tubeless Toilet Ti…6 per pack,£7.55,£1.26 each,
Cushelle Quilted White Rolls,Cushelle Quilted White Rolls16 per pack,£9.95,62.2p each,"Offer price £9.95, was £11.45"
Cushelle Toilet Tissue White,Cushelle Toilet Tissue White9 per pack,£5.95,66.1p each,
Cushelle Tubeless Toilet Tissue Double Rolls,Cushelle Tubeless Toilet Tissue Double Rolls6 per pack,£6.95,£1.16 each,"Offer price £6.95, was £8.90"
Day2 Denim Dry Wash Clothes Spray,Day2 Denim Dry Wash Clothes Spray200ml,£5.60,£28.00 per litre,
DAZ All-in-1 Pods Washing Liquid Capsules,DAZ All-in-1 Pods Washing Liquid Capsules26 per pack,£5.50,21.2p each,"Offer price £5.50, was £6.50"
Daz All In 1 Pods Whites & Colours Washing Liquid Capsules,Daz All In 1 Pods Whites & Colour…12 per pack,£3,25p each,
Daz Washing Liquid 47 Washes,Daz Washing Liquid 47 Washes1.645L,£6,£3.65 per litre,
Daz Washing Powder For Whites & Colours 40 Washes 2.6kg,Daz Washing Powder For Whites &…2.6kg,£5.75,£2.21 per kg,
Daz Washing Powder For Whites & Colours Washes,Daz Washing Powder For Whites & Colours Washes4.225kg,£9,21.3p per 100g,
Daz Whites & Colours Washing Powder 22 Washes,Daz Whites & Colours Wash…1.43kg,£3.50,£2.45 per kg,
Dettol 5 in 1 Antibacterial Washing Machine Cleaner ,Dettol 5 in 1 Antibacterial Washing Machine Cleaner 250ml,£4,£16.00 per litre,
Dettol 5 in 1 Lemon Breeze Antibacterial Washing Machine Cleaner,Dettol 5 in 1 Lemon Breeze Antibacter…250ml,£4,£16.00 per litre,
Dettol All in One Disinfectant Antibacterial Spray Crisp Linen,Dettol All in One Disinfectant Anti…400ml,£2.50,£6.25 per litre,"Offer price £2.50, was £3"
Dettol Antibacterial Disinfectant Mould & Mildew Remover Spray,Dettol Antibacterial Disinfectant M…750ml,£3.50,£4.67 per litre,
Dettol Antibacterial Disinfectant Multi Surface Cleaning Wipes,Dettol Antibacterial Disinfectant M…72 per pack,£3,4.2p each,
Dettol Antibacterial Disinfectant Multi Surface Cleaning Wipes,Dettol Antibacterial Disinfectant M…110 per pack,£3.50,3.2p each,
Dettol Antibacterial Disinfectant Multi Surface Spray Lemon & Lime,Dettol Antibacterial Disinfectant Multi…1L,£3.50,£3.50 per litre,
Dettol Antibacterial Disinfectant Multi Surface Spray Pomegranate,Dettol Antibacterial Disinfectant Mul…1L,£3.50,£3.50 per litre,
Dettol Antibacterial Disinfectant Surface Cleaning Spray,Dettol Antibacterial Disinfecta…500ml,£2.25,£4.50 per litre,
Dettol Antibacterial Disinfectant Surface Cleaning Spray Lime & Mint,Dettol Antibacterial Disinfec…750ml,£2,£2.67 per litre,"Offer price £2, was £3"
Dettol Antibacterial Laundry Cleanser Soothing Lavender,Dettol Antibacterial Laundry Cl…1.5L,£4.50,£3.00 per litre,
Dettol Antiseptic Liquid,Dettol Antiseptic Liquid750ml,£3.85,£5.13 per litre,
Dettol Big & Strong Antibacterial Bathroom Cleaning Wipes ,Dettol Big & Strong Antibacterial…25 per pack,£2.50,10p each,"Offer price £2.50, was £4"
Dettol Big & Strong Antibacterial Kitchen Cleaning 25 XL Wipes,Dettol Big & Strong Antibacterial K…,£2.50,,"Offer price £2.50, was £4"
Dettol Cleansing Surface Wipes Lime & Mint Large Wipes,Dettol Cleansing Surface Wipes…72 per pack,£3,4.2p each,
Dettol Fresh Cotton Antibacterial Laundry Cleanser,Dettol Fresh Cotton Antibac…1.5L,£4.50,£3.00 per litre,
Dettol Fresh Cotton Antibacterial Laundry Cleanser,Dettol Fresh Cotton Antibac…2.5L,£9,£3.60 per litre,
Dettol Multi Purpose Antibacterial Floor Cleaning Wipes Lemon,Dettol Multi Purpose Antibacterial…10 per pack,£1.50,15p each,"Offer price £1.50, was £2.25"
Dettol Multipurpose Cleaning Wipes Pomegranate & Lime Large Wipes,Dettol Multipurpose Cleanin…70 per pack,£2.50,3.6p each,"Offer price £2.50, was £3"
Dettol Multipurpose Wipes Citrus Zest Large Wipes,Dettol Multipurpose Wipes Citrus Zest Large Wipes70 per pack,£2.50,3.6p each,"Offer price £2.50, was £3"
Dettol Multipurpose Wipes Citrus Zest Large Wipes,Dettol Multipurpose Wipes Citrus Zest Large Wipes30 per pack,£2,6.7p each,
Dettol Neutra Air Revitalising Fresh Breeze Air Freshener,Dettol Neutra Air Revitalising Fr…300ml,£1.50,£5.00 per litre,
Dettol Power & Pure Advance Bathroom,Dettol Power & Pure Advance Bathroom1L,£2.50,£2.50 per litre,"Offer price £2.50, was £3.50"
Dettol Power & Pure Antibacterial Disinfectant Kitchen Cleaning Spray,Dettol Power & Pure Antibacterial Disinfe…1L,£2.50,£2.50 per litre,"Offer price £2.50, was £3.50"
Dettol Surface Cleanser Antibacterial Spray,Dettol Surface Cleanser Antibacterial Spray750ml,£2,£2.67 per litre,"Offer price £2, was £3.50"
Dettol Surface Cleanser Wipes Lime And Mint ,Dettol Surface Cleanser Wipes Lime And Mint 110 per pack,£3.50,3.2p each,
Dettol Tru Clean Antibacterial Wipes Crisp Pear Wipes,Dettol Tru Clean Antibacteria…50 per pack,£2,4p each,"Offer price £2, was £2.80"
Dishmatic General Purpose Refill,Dishmatic General Purpose Refill4 per pack,£2.35,58.8p each,
Dishmatic Handle Refill,Dishmatic Handle Refill,£2,,
Dishmatic Non Scratch Refill,Dishmatic Non Scratch Refill4 per pack,£2.35,58.8p each,
Domestos Bleach White & Sparkle ,Domestos Bleach White & Sparkle 750ml,£1.50,£2.00 per litre,Buy 3 for £3
Domestos Citrus Thick Bleach,Domestos Citrus Thick Bleach750ml,£1.50,£2.00 per litre,Buy 3 for £3
Domestos Original Thick Bleach,Domestos Original Thick Bleach750ml,£1.50,£2.00 per litre,Buy 3 for £3
Domestos Original Thick Bleach,Domestos Original Thick Bleach2L,£2.85,£1.43 per litre,
Domestos Pink Thick Bleach,Domestos Pink Thick Bleach750ml,£1.50,£2.00 per litre,Buy 3 for £3
Domestos Power 5 Lime Toilet Rim Block 1 Piece,Domestos Power 5 Lime Toilet Rim Block 1 Piece,£1.50,,Buy 3 for £3
Domestos Power 5 Ocean Toilet Rim Block 1pc,Domestos Power 5 Ocean Toilet Rim Block 1pc,£1.50,,Buy 3 for £3
Domestos Power 5 Pink Magnolia Toilet Rim Block 1pc,Domestos Power 5 Pink Magnoli…,£1.50,,Buy 3 for £3
Domestos Power Foam Citrus,Domestos Power Foam Citrus450ml,£3,66.7p per 100ml,
Domestos Power Foam Fresh,Domestos Power Foam Fresh450ml,£3,66.7p per 100ml,
Domestos Rimbblock Power 5 Twin Pack Ocean ,Domestos Rimbblock Power 5 Twin Pack Ocean 2 x 55g,£2.50,£2.27 per 100g,
Domestos Rimblock Winter,Domestos Rimblock Winter55g,£1.25,£2.27 per 100g,
Domestos Spray Bleach Multipurpose Cleaner,Domestos Spray Bleach Multipurpose Cleaner700ml,£2.10,30p per 100ml,
DP Soda Crystals,DP Soda Crystals1kg,£2.35,£2.35 per kg,
Draper Telescopic Squeegee,Draper Telescopic Squeegee,£6.99,£6.99 each,
Dr.Beckmann Carpet Stain Remover ,Dr.Beckmann Carpet Stain Remover 650ml,£4,£6.15 per litre,
Dr. Beckmann Glowhite Intensive Whitener Powder,Dr. Beckmann Glowhite Int…5 x 40g,£2,£10.00 per kg,
Dr. Beckmann Glowhite Ultra Fabric Stain Remover ,Dr. Beckmann Glowhite Ultra…40g,£2.20,£55.00 per kg,
Dr Beckmann Magic Leaves Laundry Detergent Sheets Bio,Dr Beckmann Magic Leaves Laun…25 per pack,£4.50,18p each,
Dr. Beckmann Magic Leaves Laundry Detergent S Non Bio 25 Washes,Dr. Beckmann Magic Leaves Laundry Det…100g,£4.50,£45.00 per kg,
Dr. Beckmann Original Colour & Dirt Collector,Dr. Beckmann Original Colour & Dirt Collector30 per pack,£3.30,11p each,
Dr. Beckmann Pet Stain & Odour Remover,Dr. Beckmann Pet Stain & Odour Remover650ml,£4,61.5p per 100ml,
Dr. Beckmann Service-It Deep Clean Washing Machine Cleaner,Dr. Beckmann Service-It Deep Clea…250g,£3.30,£13.20 per kg,
Dr. Beckmann Service-It Washing Machine Cleaner,Dr. Beckmann Service-It Washing Machine Cleaner250ml,£3.30,£13.20 per litre,
Dr. Beckmann Upholstery Stain Remover,Dr. Beckmann Upholstery Stain Remover400ml,£4,£10.00 per litre,
Dr. Oetker Bicarbonate of Soda,Dr. Oetker Bicarbonate of Soda200g,£1.59,79.5p per 100g,
Duck Active Clean Rimblock First Kiss Flowers,Duck Active Clean Rimbloc…,£1.50,,
Duck Active Clean Rimblock Tropical Summer,Duck Active Clean Rimblock Tropical Summer,£1.50,,
Duck Deep Action Gel First Kiss Flowers,Duck Deep Action Gel First Kiss Flowers750ml,£1.25,16.7p per 100ml,
Duck Deep Action Gel First Kiss Tropical,Duck Deep Action Gel First Kiss Tropical750ml,£1.25,16.7p per 100ml,
Duck Deep Action Gel Toilet Cleaner Lavender,Duck Deep Action Gel Toilet Cleaner Lavender750ml,£1.25,16.7p per 100ml,
Duck Deep Action Gel Toilet Liquid Cleaner Citrus,Duck Deep Action Gel Toilet Liquid Cleaner Citrus750ml,£1.25,£1.67 per litre,
Duck Deep Action Gel Toilet Liquid Cleaner Lavender,Duck Deep Action Gel Toilet L…,£3,,
Duck Deep Action Gel Toilet Liquid Cleaner Marine,Duck Deep Action Gel Toilet…750ml,£1.25,£1.67 per litre,
Duck Deep Action Gel Toilet Liquid Cleaner Pine,Duck Deep Action Gel Toilet Liquid Cleaner Pine750ml,£1.25,£1.67 per litre,
Duck Fresh Disc Holder First Kiss Flowers,Duck Fresh Disc Holder First Kiss Flowers,£3,,
Duck Fresh Disc Holder Tropical Summer,Duck Fresh Disc Holder Tropical Summer,£3,,
Duck Fresh Disc Refills Tropical Summer,Duck Fresh Disc Refills Tropical Summer,£3,,"Offer price £3, was £5"
Duck Fresh Discs 2 Refills Marine 12 Discs,Duck Fresh Discs 2 Refills Marine 12 Discs,£3,,"Offer price £3, was £5"
Duck Toilet Fresh Discs Duo Refills Lime,Duck Toilet Fresh Discs Duo Refills Lime72ml,£3,£4.16 per 100ml,"Offer price £3, was £5"
Duck Toilet Fresh Discs Holder Lime,Duck Toilet Fresh Discs Holder Lime36ml,£3,83.3p per 10ml,
Duck Toilet Fresh Discs Holder Marine,Duck Toilet Fresh Discs Holder Marine36ml,£3,83.3p per 10ml,
Duracell Plus AAA Alkaline Batteries LR03 ,Duracell Plus AAA Alkaline Batteries LR03 20 per pack,£15.25,76.3p each,
Duracell Plus AA Alkaline Batteries LR6,Duracell Plus AA Alkaline Batteries LR620 per pack,£15.25,76.3p each,
Duracell Plus C Alkaline Batteries,Duracell Plus C Alkaline Batteries4 per pack,£7,£1.75 each,
Duracell Plus D Batteries,Duracell Plus D Batteries4 per pack,£8,£2.00 each,
Dylon Colour Catcher 6 Protect 24 Sheets,Dylon Colour Catcher 6 Protect 24 Sheets,£3.20,,
Dylon Colour Catcher 6 Protect 40 Sheets,Dylon Colour Catcher 6 Protect 40 Sheets,£4,,
Ecover All Purpose Cleaner,Ecover All Purpose Cleaner1L,£3,£3.00 per litre,
Ecover Apple Blossom & Almond Fabric Softener 50 Washes  ,Ecover Apple Blossom & Almond Fab…1.5L,£5,£3.33 per litre,
Ecover Bio Honeysuckle & Jasmine Laundry Detergent 42 Washes,Ecover Bio Honeysuckle & Jasmine La…1.5L,£10,£6.67 per litre,
Ecover Camomile & Clementine Washing Up Liquid,Ecover Camomile & Clement…950ml,£3.50,£3.68 per litre,
Ecover Dishwasher Tablets,Ecover Dishwasher Tablets25 per pack,£5.50,22p each,"Offer price £5.50, was £7.95"
Ecover Lemon & Aloe Vera Washing Up Liquid,Ecover Lemon & Aloe Vera Washing Up Liquid450ml,£1.75,£3.89 per litre,"Offer price £1.75, was £2"
Ecover Lily & Lotus Washing Liquid,Ecover Lily & Lotus Washing Liquid450ml,£2,£4.44 per litre,
Ecover Non-Bio Laundry Powder 25 Washes,Ecover Non-Bio Laundry Powder 25 Washes1.875kg,£8.50,£4.53 per kg,
Ecover Non Bio Lavender & Sandalwood Laundry Detergent 42 Washes,Ecover Non Bio Lavender & Sandalwood…1.5L,£10,£6.67 per litre,
Ecover Pine Fresh Toilet Cleaner,Ecover Pine Fresh Toilet Cleaner750ml,£2,£2.67 per litre,
Elliotts Wooden Black Shoe Brushes Set of 2,Elliotts Wooden Black Shoe Brushes Set of 2,£4,£4.00 each,
Emma Bridgewater New Hearts Tissue,Emma Bridgewater New Hearts Tissue4 per pack,£2.50,62.5p each,
Fabulosa 4 In 1 Lemon Lavender Concentrated Disinfectant,Fabulosa 4 In 1 Lemon Lavender…220ml,£1,£4.55 per litre,
Fabulosa Antibacterial Trigger Spray Electrify,Fabulosa Antibacterial Trigger Spray Electrify500ml,£1,£2.00 per litre,
Fabulosa Concentrated Disinfectant ,Fabulosa Concentrated Disinfectant 500ml,£2,£4.00 per litre,
Fairy All In One Dishwasher Tablets Lemon,Fairy All In One Dish…19 per pack,£4,21.1p each,
Fairy All in One Dishwasher Tablets Lemon,Fairy All in One Dish…38 per pack,£10,26.3p each,
Fairy Almond Milk & Manuka Honey In-Wash Scent Booster ,Fairy Almond Milk & Manuka Hone…176g,£3,£17.05 per kg,"Offer price £3, was £6"
Fairy Almond Milk & Manuka Honey In-Wash Scent Booster ,Fairy Almond Milk & Manuka Hone…320g,£8,£25.00 per kg,
Fairy Antibacterial Washing Up Liquid Eucalyptus,Fairy Antibacterial Washing…383ml,£2,52.2p per 100ml,
Fairy Antibac Washing Up Liquid,Fairy Antibac Washing Up Liquid520ml,£2.50,48.1p per 100ml,
Fairy Apple Orchard Washing Up Liquid,Fairy Apple Orchard Washing Up Liquid1015ml,£3,29.6p per 100ml,
Fairy Citrus Washing Up Liquid,Fairy Citrus Washing Up Liquid654ml,£2,30.6p per 100ml,"Offer price £2, was £2.50"
Fairy Clean & Fresh Apple Washing Up Liquid,Fairy Clean & Fresh Apple Washing Up Liquid320ml,£1.30,40.6p per 100ml,
Fairy Fabric Conditioner 33 Washes ,Fairy Fabric Conditioner 33 Washes 1.155L,£2.25,£1.95 per litre,
Fairy Fresh Fabric Conditioner 30 Washes,Fairy Fresh Fabric Conditioner 30 Washes1050ml,£3.25,£3.10 per litre,
Fairy Fresh Fabric Conditioner 48 Washes ,Fairy Fresh Fabric Conditioner 48 Washes 1.68L,£3,£1.78 per litre,"Offer price £3, was £3.50"
Fairy Lemon Washing Up Liquid,Fairy Lemon Washing Up Liquid320ml,£1.30,40.6p per 100ml,
Fairy Lemon Washing Up Liquid,Fairy Lemon Washing Up Liquid654ml,£2,30.6p per 100ml,"Offer price £2, was £2.50"
Fairy Max Power Antibac Washing Up Liquid,Fairy Max Power Antibac Washing Up Liquid640ml,£4,62.5p per 100ml,
Fairy Max Power Original Washing Up Liquid,Fairy Max Power Original Washing Up Liquid370ml,£2,54.1p per 100ml,"Offer price £2, was £2.50"
Fairy Max Power Pomegranate Washing Up Liquid,Fairy Max Power Pomegrana…640ml,£4,62.5p per 100ml,
Fairy Max Power Tea Tree Antibacterial Anti-Leak,Fairy Max Power Tea Tree Antibacterial Anti-Leak370ml,£2,54.1p per 100ml,"Offer price £2, was £2.50"
Fairy Non Bio PODS Washing Capsules,Fairy Non Bio PODS Washing Capsules25 per pack,£7,28p each,
Fairy Non Bio Pods Washing Capsules ,Fairy Non Bio Pods Washing Capsules 13 per pack,£3.50,26.9p each,"Offer price £3.50, was £4.50"
Fairy Non Bio Pods Washing Capsules Washes,Fairy Non Bio Pods Wash…29 per pack,£9,31p each,
Fairy Non Bio Pods Washing Capsules Washes,Fairy Non Bio Pods Wash…51 per pack,£14,27.5p each,
Fairy Non Bio Washing Capsules for Sensitive Skin Washes,Fairy Non Bio Washing Capsules…33 per pack,£7,21.2p each,"Offer price £7, was £10"
Fairy Non Bio Washing Liquid for Sensitive Skin 35 Washes,Fairy Non Bio Washing Liquid for…1.33L,£6,45.2p per 100ml,"Offer price £6, was £8"
Fairy Non Bio Washing Liquid for Sensitive Skin 51 Washes,Fairy Non Bio Washing Liquid for…1890ml,£10,52.9p per 100ml,
Fairy Non Bio Washing Liquid Gel For Sensitive Skin 24 Washes,Fairy Non Bio Washing Liquid Gel Fo…840ml,£5,£5.95 per litre,
Fairy Non Bio Washing Liquid Gel for Sensitive Skin 35 Washes,Fairy Non Bio Washing Liquid Gel fo…1295ml,£8,£6.18 per litre,
Fairy Non Bio Washing Powder for Sensitive Skin 40 Washes,Fairy Non Bio Washing Powder for…2.6kg,£9,£3.46 per kg,
Fairy Non Bio Washing Powder For Sensitive Skin 50 Washes ,Fairy Non Bio Washing Powder For…3.25kg,£11,£3.38 per kg,
Fairy Original All In One Auto Dishwashing Tablet,Fairy Original All In One Auto Dishwashing Tablet60 per pack,£9,15p each,"Offer price £9, was £11"
Fairy Original All In One Dishwasher Tablets Lemon 22 pack,Fairy Original All In One Dishwas…22 per pack,£4,18.2p each,
Fairy Original Max Power Washing Up Liquid,Fairy Original Max Power Washing Up Liquid640ml,£4,62.5p per 100ml,
Fairy Original Washing Up Liquid ,Fairy Original Washing Up Liquid 1190ml,£3,£2.52 per litre,
Fairy Original Washing Up Liquid,Fairy Original Washing Up Liquid320ml,£1.30,40.6p per 100ml,
Fairy Original Washing Up Liquid,Fairy Original Washing Up Liquid654ml,£2,30.6p per 100ml,"Offer price £2, was £2.50"
Fairy Original Washing Up Liquid Green with Lift Action,Fairy Original Washing Up Liqui…1015ml,£3,29.6p per 100ml,
Fairy Outdoorable Fabric Conditioner 55 Washes,Fairy Outdoorable Fabric Conditioner 55 Washes770ml,£3.50,£4.55 per litre,
Fairy Outdoorable Fabric Conditioner Original 76 Washes,Fairy Outdoorable Fabric Condit…1064ml,£6.50,61.1p per 100ml,
Fairy Platinum All In One Lemon Dishwasher Tablets,Fairy Platinum All In One L…32 per pack,£7,21.9p each,"Offer price £7, was £10"
Fairy Platinum Dishwasher Tablets Lemon,Fairy Platinum Dishwa…21 per pack,£5,23.8p each,"Offer price £5, was £7"
Fairy Platinum Dishwasher Tablets Lemon,Fairy Platinum Dishwa…51 per pack,£11,21.6p each,
Fairy Platinum Plus Auto Dishwasher Tablets Lemon,Fairy Platinum Plus Auto Di…42 per pack,£9,21.4p each,"Offer price £9, was £11"
Fairy Platinum Plus Deep Clean Dishwasher Tablets,Fairy Platinum Plus Deep Clean Dishwasher Tablets29 per pack,£7,24.2p each,"Offer price £7, was £10"
Fairy Platinum Plus Dishwasher Tablets Deep Clean,Fairy Platinum Plus Dishwas…42 per pack,£11,26.2p each,
Fairy Platinum Plus Dishwasher Tablets Lemon,Fairy Platinum Plus Dis…18 per pack,£7,38.9p each,
Fairy Platinum Plus Dishwasher Tablets Lemon,Fairy Platinum Plus Dis…29 per pack,£10,34.5p each,
Fairy Platinum Plus Hinch Limited Edition Dishwasher Tablets,Fairy Platinum Plus Hinch Limited E…48 per pack,£11,22.9p each,
Fairy Platinum Quick Wash Original,Fairy Platinum Quick Wash Original520ml,£2.50,48.1p per 100ml,
Fairy Platinum Washing Up Liquid,Fairy Platinum Washing Up Liquid383ml,£2,52.2p per 100ml,
Fairy Pomegranate Washing Up Liquid,Fairy Pomegranate Washing Up Liquid1015ml,£3,29.6p per 100ml,
Fairy Stain Remover Pods Washing Capsules For Sensitive Skin washes,Fairy Stain Remover Pods Washing Capsul…44 per pack,£10.50,23.9p each,
Febreze 3vol Refill Orange And Spice,Febreze 3vol Refill Orange And Spice20ml,£5,£25.00 per 100ml,
Febreze 3Volution Air Freshener Blossom & Breeze Plug Starter Kit,Febreze 3Volution Air Freshener Bloss…,£6,,
Febreze 3Volution Air Freshener Blossom Plug Refill,Febreze 3Volution Air Freshen…,£5,,
Febreze 3Volution Air Freshener Cotton Fresh Plug In Refill,Febreze 3Volution Air Freshener C…,£3.50,,"Offer price £3.50, was £5"
Febreze 3Volution Air Freshener Cotton Fresh Plug In Refills Twin Pack,Febreze 3Volution Air Freshener Cotton Fr…2 per pack,£6,£3.00 each,
Febreze 3Volution Air Freshener Electrical Plug In Diffuser,Febreze 3Volution Air Freshener E…,£3.50,,
Febreze 3Volution Air Freshener Exotic Bloom Plug In Refills Twin Pack,Febreze 3Volution Air Freshener Exotic Bl…2 per pack,£6,£3.00 each,
Febreze 3Volution Air Freshener Pet Odour Eliminator Plug In Refill,Febreze 3Volution Air Freshener Pet Odo…,£3.50,,"Offer price £3.50, was £5"
Febreze 3volution Air Freshener Plug-In Starter Kit Peony & Cedar,Febreze 3volution Air Freshener Plug…20ml,£6,£30.00 per 100ml,"Offer price £6, was £10"
Febreze 3Volution Air Freshener Spring Awakening Plug In Refill,Febreze 3Volution Air Freshener Sprin…,£3.50,,"Offer price £3.50, was £5"
Febreze 3Volution Air Freshener Spring Awakening Plug In Refills Twin Pack,Febreze 3Volution Air Freshener…2 per pack,£6,£3.00 each,
Febreze 3Volution Crocus & Bluebell Plug In Refill ,Febreze 3Volution Crocus & Bluebell Plug In Refill 20ml,£3.50,£17.50 per 100ml,"Offer price £3.50, was £5"
Febreze 3Volution Fruity Tropics Air Freshener Plug Refill,Febreze 3Volution Fruity Tropics…,£3.50,,
Febreze 3Volution Peony & Cedar Plug In Refill ,Febreze 3Volution Peony & Cedar Plug In Refill 20ml,£3.50,£17.50 per 100ml,"Offer price £3.50, was £5"
Febreze 3Volution Plug In Refil Ruby Jasmin,Febreze 3Volution Plug In Refil Ruby Jasmin3 x 20ml,£3.50,£5.83 per 100ml,
Febreze 3Volution Plug Refill White Jasmine,Febreze 3Volution Plug Refill White Jasmine20ml,£3.50,£1.75 per 10ml,"Offer price £3.50, was £5"
Febreze 3Volution Smart Programming Air Freshener Starter Kit,Febreze 3Volution Smart Programming…,£6,,
Febreze Aerosol White Jasmine,Febreze Aerosol White Jasmine300ml,£3,£1.00 per 100ml,Buy 2 for £5
Febreze Air Freshener Blossom & Breeze Plug Refill,Febreze Air Freshener Bloss…,£4,,
Febreze Air Freshener Spray Spring Awakening,Febreze Air Freshener Spray Spring Awakening300ml,£2.50,83.3p per 100ml,
Febreze Air Peony & Cedar,Febreze Air Peony & Cedar300ml,£3,£1.00 per 100ml,Buy 2 for £5
Febreze Ambi Pur 3Volution Air Freshener Fresh Linen Plug In Refills ,Febreze Ambi Pur 3Volution Air Freshener…,£3.50,,
Febreze Ambi Pur 3Volution Air Freshener Lavender Plug In Refills,Febreze Ambi Pur 3Volution Air Freshe…,£3.50,,"Offer price £3.50, was £5"
Febreze Ambi Pur 3Volution Air Freshener Thai Orchid Plug In Refills,Febreze Ambi Pur 3Volution Air Freshene…,£3.50,,"Offer price £3.50, was £5"
