name,Price Per Unit,Price Per Measure,Promotion
Lenor Unstoppables Beads Fresh In-Wash Scent Booster,Lenor Unstoppables Beads Fres…176g,£3,£17.05 per kg,"Offer price £3, was £6"
Lifebuoy Multi-Surface Antibacterial Spray,Lifebuoy Multi-Surface Antibacterial Spray735ml,£2,£2.72 per litre,
Lifebuoy Multi-Surface Antibacterial Wipes,Lifebuoy Multi-Surface Antibacterial Wipes60 per pack,£2,3.3p each,
Little Duck Maxx Kitchen Towel,Little Duck Maxx Kitchen Towel3 per pack,£4.25,£1.42 each,
Little Duck Supreme Quilted Toilet Tissue,Little Duck Supreme Quilted Toilet Tissue24 per pack,£7.99,33.3p each,
Lord Sheraton Caretaker Furniture Eco Wipes,Lord Sheraton Caretaker Furniture Eco Wipes24 per pack,£3,12.5p each,
Lord Sheraton Caretaker Wood Balsam 125Ml,Lord Sheraton Caretaker Wood Balsam 125Ml125ml,£4,£3.20 per 100ml,
Lord Sheraton Leather Balsam ,Lord Sheraton Leather Balsam 125ml,£4,£3.20 per 100ml,
Marigold Bathroom Glove Med,Marigold Bathroom Glove Med,£3,,
Marigold Extra Life Kitchen Gloves Large,Marigold Extra Life Kitchen Gloves Large1pair,£2.70,,
Marigold Extra Life Kitchen Medium Gloves,Marigold Extra Life Kitchen Medium Gloves1pair,£2.70,,
Marigold Gloves for Sensitive Skin Medium,Marigold Gloves for Sensitive Skin Medium,£2.90,,"Offer price £2.90, was £3.30"
Marigold Kitchen Gloves Small   ,Marigold Kitchen Gloves Small   ,£2.70,,
Method All Floor Cleaner Squirt + Mop Wild Rhubarb,Method All Floor Cleaner Sq…739ml,£4,54.1p per 100ml,"Offer price £4, was £4.50"
Method Almond Wood Polish ,Method Almond Wood Polish 354ml,£4.50,£12.71 per litre,
Method Anti-Bac All Purpose Cleaner Peach Blossom,Method Anti-Bac All Purpose…828ml,£3,36.2p per 100ml,"Offer price £3, was £4"
Method Anti-Bac All Purpose Cleaner Wild Rhubarb ,Method Anti-Bac All Purpose…828ml,£3,36.2p per 100ml,"Offer price £3, was £4"
Method Bathroom Cleaner ,Method Bathroom Cleaner 828ml,£3,£3.62 per litre,"Offer price £3, was £4"
Method Clementine Daily Kitchen Cleaner ,Method Clementine Daily Kitchen Cleaner 828ml,£3,£3.62 per litre,"Offer price £3, was £4"
Method Daily Shower Cleaner ,Method Daily Shower Cleaner 828ml,£3,£3.62 per litre,"Offer price £3, was £4"
Method Daily Shower Passion Fruit,Method Daily Shower Passion Fruit828ml,£3,36.2p per 100ml,"Offer price £3, was £4"
Method French Lavender Multi Surface Cleaner,Method French Lavender Multi Surface Cleaner828ml,£3,£3.62 per litre,"Offer price £3, was £4"
Microban 24 Hour Sanitizing Spray Citrus Scent,Microban 24 Hour Sanitizi…400ml,£4,£1.00 per 100ml,
Mighty Big 3 Rolls Of Extra Large Sheets,Mighty Big 3 Rolls Of Extra Large Sheets3 per pack,£3.99,£1.33 each,
Milton Antibacterial Surface Spray,Milton Antibacterial Surface Spray500ml,£2.60,52p per 100ml,
Milton Baby Bottle Cleaner ,Milton Baby Bottle Cleaner 500ml,£3,60p per 100ml,
Minky M Cloth Anti-Bac Kitchen Pad,Minky M Cloth Anti-Bac Kitchen Pad,£3,,
Minky M Cloth Anti - Bacterial Cleaning Pad,Minky M Cloth Anti - Bacterial Cleaning Pad,£2.50,,
Minky M Cloth Glass & Window,Minky M Cloth Glass & Window,£3.30,,
Minky Microfibre Kitchen Cloths,Minky Microfibre Kitchen Cloths2 per pack,£3.30,£1.65 each,
Minky Multi-Purpose Microfibre Cloths,Minky Multi-Purpose Microfibre Cloths4 per pack,£3.50,87.5p each,
Miofresh Nappy & Laundry Cleanser,Miofresh Nappy & Laundry Cleanser,£4.50,,
Morrisons 10 Refuse Sacks Drawstring 70L,Morrisons 10 Refuse Sacks Drawstring 70L10 per pack,£2,20p each,"Offer price £2, was £3"
Morrisons 15L Tie Handle Pedal Bin Liners,Morrisons 15L Tie Handle Pedal Bin Liners20 per pack,£1.50,7.5p each,
Morrisons 20 Bio Caddy Bin Liners 5L,Morrisons 20 Bio Caddy Bin Liners 5L,£2,,
Morrisons 240L Flat Top Wheelie Bin Liners,Morrisons 240L Flat Top Wheelie Bin Liners10 per pack,£2.40,24p each,
Morrisons 2 Double Kitchen Rolls,Morrisons 2 Double Kitchen Rolls2 per pack,£2.25,£1.13 each,"Offer price £2.25, was £2.50"
Morrisons 2 In 1 Microfibre Flat Mop Refill,Morrisons 2 In 1 Microfibre Flat Mop Refill,£2.50,,
Morrisons 2x Non Scratch Bathroom Scourers,Morrisons 2x Non Scratch Bathroom Scourers2 per pack,£1.15,57.5p each,
Morrisons 30L Drawstring Tall Kitchen Bin Liners,Morrisons 30L Drawstring Tall Kitchen Bin Liners20 per pack,£2.90,14.5p each,
Morrisons 35 Large Tie Handle Food & Freezer Bags 35 Pack,Morrisons 35 Large Tie Handle Foo…35 per pack,£2.50,7.1p each,
Morrisons 35L Flat Top Rubble Bin Liners,Morrisons 35L Flat Top Rubble Bin Liners8 per pack,£3.40,42.5p each,"Offer price £3.40, was £3.80"
Morrisons 3Ply   Cosmetic Facial  Tissues ,Morrisons 3Ply   Cosmetic Facial  Tissues 56 per pack,£1.69,3p each,"Offer price £1.69, was £1.90"
Morrisons 3Ply   Regular Facial Tissues 72 Sheets ,Morrisons 3Ply   Regular Facial Tissues 72 Sheets ,£1.45,,
Morrisons 3Ply Regular Twin Facial Tissues,Morrisons 3Ply Regular Twin Facial Tissues2 x 72 per pack,£2.50,1.7p each,
Morrisons 45L Tie Handle Swing Kitchen Bin Liners,Morrisons 45L Tie Handle Swing Kitchen Bin Liners20 per pack,£1.75,8.8p each,
Morrisons 50L Drawstring Swing Kitchen Waste Bin Liners,Morrisons 50L Drawstring Swing…20 per pack,£1.33,6.7p each,
Morrisons 50L Drawstring Tall Kitchen Waste Bin Liners,Morrisons 50L Drawstring Tall K…20 per pack,£4.25,21.3p each,
Morrisons 50L Tie Top Refuse Sacks 20 Pack,Morrisons 50L Tie Top Refuse Sacks 20 Pack20 per pack,£2.75,13.8p each,
Morrisons 90L Tie Top Refuse Sacks 20 Pack,Morrisons 90L Tie Top Refuse Sacks 20 Pack20 per pack,£4,20p each,
Morrisons All In 1 Lemon Dishwasher Tablets,Morrisons All In 1 Lemon Dishwasher Tablets60 per pack,£5.45,9.1p each,
Morrisons All In 1 Lemon Dishwasher Tablets,Morrisons All In 1 Lemon Dishwasher Tablets30 per pack,£3,10p each,
Morrisons All In 1 Original Dishwasher Tablets,Morrisons All In 1 Original Dishwasher Tablets30 per pack,£3,10p each,
Morrisons All Purpose Cloths ,Morrisons All Purpose Cloths 10 per pack,£1.35,13.5p each,
Morrisons Aloe Vera Toilet Tissue,Morrisons Aloe Vera Toilet Tissue4 per pack,£2.60,65p each,
Morrisons Aloe Vera Toilet Tissue,Morrisons Aloe Vera Toilet Tissue9 per pack,£4.55,50.6p each,
Morrisons Antibacterial Plastic Free Wipes Citrus,Morrisons Antibacterial Plastic Free Wipes Citrus80 per pack,£1.80,2.3p each,
Morrisons Antibacterial Plastic Free Wipes Original ,Morrisons Antibacterial Plast…80 per pack,£1.80,2.3p each,
Morrisons Antibacterial Plastic Free Wipes Rhubarb,Morrisons Antibacterial Pla…80 per pack,£1.80,2.3p each,
Morrisons Antibacterial Surface Spray,Morrisons Antibacterial Surface Spray300ml,£1.50,50p per 100ml,
Morrisons Antiseptic Disinfectant,Morrisons Antiseptic Disinfectant500ml,£1.35,£2.70 per litre,
Morrisons Apple Washing Up Liquid,Morrisons Apple Washing Up Liquid450ml,75p,£1.67 per litre,
Morrisons Balm Facial Tissue 72 Sheets,Morrisons Balm Facial Tissue 72 Sheets,£1.89,,"Offer price £1.89, was £2.15"
Morrisons Bamboo Dish Brush,Morrisons Bamboo Dish Brush,£1.50,,
Morrisons Bathroom Cleaner,Morrisons Bathroom Cleaner750ml,£1.10,14.7p per 100ml,
Morrisons Berry Blitz Washing Up Liquid,Morrisons Berry Blitz Washing Up Liquid450ml,75p,£1.67 per litre,
Morrisons Berry Thick Bleach,Morrisons Berry Thick Bleach750ml,75p,£1.00 per litre,Buy 2 for £1
Morrisons Bio Caddy Bin Liners 25 Litres,Morrisons Bio Caddy Bin Liners 25 Litres10 per pack,£2.90,29p each,"Offer price £2.90, was £3.25"
Morrisons Bio Super Concentrated  Concentrated Liquid 60 Washes,Morrisons Bio Super Conce…1.8L,£5.20,£2.89 per litre,
Morrisons Bio Washing Powder 40 Washes,Morrisons Bio Washing Powder 40 Washes2.6kg,£4.40,£1.69 per kg,
Morrisons Bottle Brush,Morrisons Bottle Brush,£1,,
Morrisons Citrus Anti-Bacterial Multi-Purpose Cleaner,Morrisons Citrus Anti-Bacteri…750ml,£1.10,14.7p per 100ml,
Morrisons Citrus Shine All-Purpose Liquid Cleaner ,Morrisons Citrus Shine All-Purpose Liquid Cleaner 1L,£1.50,£1.50 per litre,
Morrisons Citrus Thick Bleach,Morrisons Citrus Thick Bleach750ml,75p,£1.00 per litre,Buy 2 for £1
Morrisons Classic White Toilet Tissue,Morrisons Classic White Toilet Tissue24 per pack,£7.99,33.3p each,"Offer price £7.99, was £10.20"
Morrisons Coconut Toilet Tissue ,Morrisons Coconut Toilet Tissue 9 per pack,£4.55,50.6p each,
Morrisons Colours & Whites Stain Removal Spray,Morrisons Colours & White…750ml,£2.50,£3.33 per litre,
Morrisons Colours Stain Remover Oxy Action Powder ,Morrisons Colours Stain Rem…1kg,£2.90,£2.90 per kg,
Morrisons Colour Super Concentrated Liquid 60 Washes,Morrisons Colour Super Concen…1.8L,£5.20,£2.89 per litre,
Morrisons Cotton Dry Air Freshener,Morrisons Cotton Dry Air Freshener250ml,£2.10,£8.40 per litre,
Morrisons Cotton Fresh Antibacterial Laundry Cleanser,Morrisons Cotton Fresh Antiba…1.5L,£2.80,£1.87 per litre,
Morrisons Cotton Fresh Candle,Morrisons Cotton Fresh Candle120g,£2.25,£1.88 per 100g,
Morrisons Daily Clean Shower Shine,Morrisons Daily Clean Shower Shine750ml,£1.10,14.7p per 100ml,
Morrisons Decorated Kitchen Towel,Morrisons Decorated Kitchen Towel2 per pack,£2.25,£1.13 each,"Offer price £2.25, was £2.50"
Morrisons Dish Cloths      ,Morrisons Dish Cloths      5 per pack,£2,40p each,Cleaning Accessories Bundle - Buy Any 2 For £2.50
Morrisons Dishwasher Cleaner,Morrisons Dishwasher Cleaner250ml,£2.25,£9.00 per litre,
Morrisons Dishwasher Salt,Morrisons Dishwasher Salt2kg,£1.95,97.5p per kg,
Morrisons Dustpan & Brush,Morrisons Dustpan & Brush,£3,,
Morrisons Easy Seal Sandwich Bags 60 Pack,Morrisons Easy Seal Sandwich Bags 60 Pack60 per pack,£2,3.3p each,
Morrisons Eco 70L Tie Refuse Sacks 20 Pack,Morrisons Eco 70L Tie Refuse Sacks 20 Pack20 per pack,£3,15p each,
Morrisons Eco Antibacterial Multi Surface Spray Rhubarb,Morrisons Eco Antibacterial Mul…750ml,£2,£2.67 per litre,
Morrisons Eco Disinfectant Spray Passionfruit,Morrisons Eco Disinfectant Spray Passionfruit750ml,£2.25,£3.00 per litre,
Morrisons Eco Floor Cleaner Orange Blossom,Morrisons Eco Floor Cleaner Orange Blossom750ml,£2,£2.67 per litre,
Morrisons Eco Kitchen Towel 200 Sheets ,Morrisons Eco Kitchen Towel 200 Sheets 2 per pack,£3.75,£1.88 each,
Morrisons Eco Non Bio Laundry Liquid Tropical,Morrisons Eco Non Bio Laundry Liquid Tropical960ml,£3.50,£3.65 per litre,
Morrisons Eco Recycled Microfibre Cloths,Morrisons Eco Recycled Microfibre Cloths3 per pack,£1.75,58.3p each,
Morrisons Eco Toilet Cleaner Spearmint,Morrisons Eco Toilet Cleaner Spearmint750ml,£2,£2.67 per litre,
Morrisons Eco Toilet Rolls,Morrisons Eco Toilet Rolls9 per pack,£4.40,48.9p each,
Morrisons Eco Washing Up Liquid Grapefruit,Morrisons Eco Washing Up Liquid Grapefruit500ml,£1.50,£3.00 per litre,
Morrisons Extra Strong Foil 10m,Morrisons Extra Strong Foil 10m10m,£2,20p per 1m,
Morrisons Extra Wear Gloves Large,Morrisons Extra Wear Gloves Large,£1.75,,"Offer price £1.75, was £2"
Morrisons Extra Wear Gloves Medium,Morrisons Extra Wear Gloves Medium,£1.75,,"Offer price £1.75, was £2"
Morrisons Extra Wear Gloves Small,Morrisons Extra Wear Gloves Small,£1.75,,"Offer price £1.75, was £2"
Morrisons Floor Wipes Apple,Morrisons Floor Wipes Apple15 per pack,£1.40,9.3p each,
Morrisons Fresh & Tropical with Coconut Oil Toilet Tissue ,Morrisons Fresh & Tropical with C…4 per pack,£2.60,65p each,
Morrisons Fresh Thick Bleach,Morrisons Fresh Thick Bleach750ml,75p,10p per 100ml,Buy 2 for £1
Morrisons Gel Air Freshener Peony,Morrisons Gel Air Freshener Peony120g,£1,83.3p per 100g,
Morrisons Gel Air Freshener Pure Linen,Morrisons Gel Air Freshener Pure Linen120g,£1,83.3p per 100g,
Morrisons Glass & Window Cleaner,Morrisons Glass & Window Cleaner750ml,£1.10,14.7p per 100ml,
Morrisons Glass Clean System Cloth,Morrisons Glass Clean System Cloth2 per pack,£2,£1.00 each,
Morrisons Greaseproof Baking Paper 10m,Morrisons Greaseproof Baking Paper 10m10m,£1.45,14.5p per 1m,
Morrisons Kind & Gentle Delicates Liquid 18 Washes,Morrisons Kind & Gentle Del…750ml,£2.79,£3.72 per litre,"Offer price £2.79, was £3.10"
Morrisons Kitchen Foil 10m,Morrisons Kitchen Foil 10m10m,£1.69,16.9p per 1m,
Morrisons Kitchen Foil 30m,Morrisons Kitchen Foil 30m30m,£4,13.3p per 1m,"Offer price £4, was £4.50"
Morrisons Kitchen Foil Non-Stick Wide 10m,Morrisons Kitchen Foil Non-Stick Wide 10m300m,£3.25,1.1p per 1m,
Morrisons Kitchen Towel    ,Morrisons Kitchen Towel    6 per pack,£3.60,60p each,
Morrisons Kitchen Towel,Morrisons Kitchen Towel4 per pack,£4.15,£1.04 each,
Morrisons Large Cleaning Cloths ,Morrisons Large Cleaning Cloths 5 per pack,£1.90,38p each,Cleaning Accessories Bundle - Buy Any 2 For £2.50
Morrisons Large Tissues 100 Sheets,Morrisons Large Tissues 100 Sheets2 per pack,£3.80,£1.90 each,
Morrisons Large White XL Tissues 100 Sheets,Morrisons Large White XL Tissues 100 Sheets,£1.80,,"Offer price £1.80, was £2"
Morrisons Lavender Air Freshener,Morrisons Lavender Air Freshener240ml,80p,£3.33 per litre,
Morrisons Lavender Dry Air Freshener,Morrisons Lavender Dry Air Freshener250ml,£2.10,£8.40 per litre,
Morrisons Lavender Fabric Conditioner 42 Washes,Morrisons Lavender Fabric Conditioner 42 Washes,£2.15,,
Morrisons Lavender Washing Powder 40 Washes,Morrisons Lavender Wash…2.6kg,£4.40,£1.69 per kg,
Morrisons Lemon Dishwasher Freshener,Morrisons Lemon Dishwasher Freshener6ml,£2.15,£35.83 per 100ml,
Morrisons Lemon Washing Up Liquid ,Morrisons Lemon Washing Up Liquid 450ml,75p,£1.67 per litre,
Morrisons Limescale Preventer Gel,Morrisons Limescale Preventer Gel1L,£3.95,£3.95 per litre,"Offer price £3.95, was £4.40"
Morrisons Limescale Prevention Tablets,Morrisons Limescale Prevention Tablets15 per pack,£2.50,16.7p each,"Offer price £2.50, was £2.80"
Morrisons Lychee & Passionfruit Super Concentrated Liquid 32 Washes,Morrisons Lychee & Passionf…960ml,£3,£3.13 per litre,
Morrisons Medium Food/Freezer Wire Ties Bags 50 Pack,Morrisons Medium Food/Freezer…50 per pack,£1.75,3.5p each,"Offer price £1.75, was £1.95"
Morrisons Medium Tie Handle Food & Freezer Bags 50 Pack,Morrisons Medium Tie Handle Foo…50 per pack,£1.80,3.6p each,
Morrisons Medium Zip Food/Freezer Bags 25 Pack,Morrisons Medium Zip Food…25 per pack,£2.30,9.2p each,
Morrisons Metal Dustpan & Brush,Morrisons Metal Dustpan & Brush,£4,,
Morrisons Microfibre Mop Refill With Abrasion,Morrisons Microfibre Mop Refill With Abrasion,£2,,
Morrisons Microwave & Roast Bags,Morrisons Microwave & Roast Bags10 per pack,£1.35,13.5p each,"Offer price £1.35, was £1.50"
Morrisons Multi Purpose Kitchen Roll,Morrisons Multi Purpose Kitchen Roll,£2.69,,
Morrisons Non-Bio Laundry Tablets,Morrisons Non-Bio Laundry Tablets20 per pack,£3.25,16.3p each,
Morrisons Non-Bio Pods Laundry Capsules,Morrisons Non-Bio Pods Laundry Capsules21 per pack,£3.70,17.6p each,
Morrisons Non-Bio Super Concentrated Liquid 32 Washes,Morrisons Non-Bio Super Conce…960ml,£3,£3.13 per litre,
Morrisons Non-Bio Super Concentrated Liquid 60 Washes,Morrisons Non-Bio Super Conce…1.8L,£5.20,£2.89 per litre,
Morrisons Non Bio Laundry Gel 24 Washes,Morrisons Non Bio Laundry Gel 24 Washes720ml,£3,£4.17 per litre,
Morrisons Non Bio Washing Powder 40 Washes ,Morrisons Non Bio Washi…2.6kg,£4.40,£1.69 per kg,
Morrisons Non Scratch Scouring Sponges ,Morrisons Non Scratch Scouring Sponges 8 per pack,£1.55,19.4p each,Cleaning Accessories Bundle - Buy Any 2 For £2.50
Morrisons No Scratch Silver Scourer 4 Pack,Morrisons No Scratch Silver Scourer 4 Pack4 per pack,£2,50p each,"Offer price £2, was £2.25"
Morrisons Ocean Breeze Fabric Conditioner 42 Washes,Morrisons Ocean Breeze Fabric…1.26L,£2.15,£1.71 per litre,
Morrisons Ocean Fresh In-Cistern Block,Morrisons Ocean Fresh In-Cistern Block2 per pack,£1,50p each,"Offer price £1, was £1.15"
Morrisons Ocean Fresh Toilet Cleaner,Morrisons Ocean Fresh Toilet Cleaner750ml,70p,93.3p per litre,
Morrisons Original Thick Bleach,Morrisons Original Thick Bleach750ml,75p,£1.00 per litre,Buy 2 for £1
Morrisons Peony Air Freshener,Morrisons Peony Air Freshener240ml,80p,£3.33 per litre,
Morrisons Pine Fresh In-Cistern Block,Morrisons Pine Fresh In-Cistern Block2 per pack,£1,50p each,"Offer price £1, was £1.15"
Morrisons Pine Fresh Toilet Cleaner,Morrisons Pine Fresh Toilet Cleaner750ml,70p,93.3p per litre,
Morrisons Polish Plastic Free Wipes ,Morrisons Polish Plastic Free Wipes 30 per pack,£1.30,4.3p each,
Morrisons Pure Fabric Conditioner 42 Washes,Morrisons Pure Fabric Conditioner 42 Washes1.26L,£2.15,£1.71 per litre,
Morrisons Pure Tumble Dryer Sheets,Morrisons Pure Tumble Dryer Sheets36 per pack,£1.70,4.7p each,"Offer price £1.70, was £1.90"
Morrisons Pvc Free Cling Film 25m,Morrisons Pvc Free Cling Film 25m25m,£1.35,5.4p per 1m,"Offer price £1.35, was £1.50"
Morrisons Pvc Free Cling Film 75m,Morrisons Pvc Free Cling Film 75m75m,£2.50,3.3p per 1m,
Morrisons Quilted Comfort Toilet Tissue,Morrisons Quilted Comfort Toilet Tissue9 per pack,£4.60,51.1p each,
Morrisons Quilted Comfort Toilet Tissue 4,Morrisons Quilted Comfort Toilet Tissue 44 per pack,£2.60,65p each,
Morrisons Quilted Toilet Rolls,Morrisons Quilted Toilet Rolls16 per pack,£7.10,44.4p each,
Morrisons Ribbed Kitchen Cloths,Morrisons Ribbed Kitchen Cloths4 per pack,£1.70,42.5p each,"Offer price £1.70, was £1.90"
Morrisons Rinse Aid,Morrisons Rinse Aid400ml,£1.89,£4.72 per litre,"Offer price £1.89, was £2.10"
Morrisons Savers 18 Toilet Rolls,Morrisons Savers 18 Toilet Rolls18 per pack,£3.79,21.1p each,
Morrisons Savers 6 Double Toilet Rolls,Morrisons Savers 6 Double Toilet Rolls6 per pack,£1.99,33.2p each,
Morrisons Savers Biological Laundry Liquid 28 Washes,Morrisons Savers Biological L…1L,£1.80,£1.80 per litre,
Morrisons Savers Biological Laundry Powder,Morrisons Savers Biolog…3.333kg,£2.55,76.5p per kg,
Morrisons Savers Biological Laundry Powder,Morrisons Savers Biolog…867g,£1.50,£1.73 per kg,
Morrisons Savers Cleaning Cloths  ,Morrisons Savers Cleaning Cloths  5 per pack,66p,13.2p each,
Morrisons Savers Dusters 8 Pack,Morrisons Savers Dusters 8 Pack8 per pack,£2,25p each,
Morrisons Savers Family Size Facial Tissues 226 Sheets,Morrisons Savers Family Size Fa…,£1.09,,
Morrisons Savers Food & Freezer Bags 100 Pack,Morrisons Savers Food & Freezer Bags 100 Pack100 per pack,£1,1p each,
Morrisons Savers Jumbo Kitchen Towel Roll,Morrisons Savers Jumbo Kitchen Towel Roll,£1.35,,
Morrisons Savers Liquid Disinfectant,Morrisons Savers Liquid Disinfectant1L,33p,33p per litre,
Morrisons Savers Sponge Scourers  ,Morrisons Savers Sponge Scourers  10 per pack,54p,5.4p each,
Morrisons Savers Washing Up Liquid,Morrisons Savers Washing Up Liquid500ml,43p,8.6p per 100ml,
Morrisons Savers Wrapping Foil 20m,Morrisons Savers Wrapping Foil 20m20m,99p,5p per 1m,
Morrisons Scouring Pads    ,Morrisons Scouring Pads    5 per pack,£1.40,28p each,"Offer price £1.40, was £1.60"
Morrisons Scouring Sponges ,Morrisons Scouring Sponges 8 per pack,£1.55,19.4p each,
Morrisons Self Seal Ice Cube Bags,Morrisons Self Seal Ice Cube Bags20 per pack,£2,10p each,
Morrisons Shea Butter Toilet Tissue,Morrisons Shea Butter Toilet Tissue9 per pack,£4.55,50.6p each,
Morrisons Shea Butter Toilet Tissue 4 Roll,Morrisons Shea Butter Toilet Tissue 4 Roll4 per pack,£2.60,65p each,
Morrisons Sink Plunger,Morrisons Sink Plunger,£2,,
Morrisons Small Zip Food/Freezer Bags,Morrisons Small Zip Food/Freezer Bags40 per pack,£3.50,8.8p each,
Morrisons Softer Sensitive Moist Aloe Toilet Tissue Wipes 40Pk,Morrisons Softer Sensitive Moist Al…,£1.15,,
Morrisons Softer Sensitive Moist Fragrance Free Toilet Tissue Wipes 40Pk,Morrisons Softer Sensitive Moist Fragrance…,£1.15,,
Morrisons Soft Grip Scrub Brush,Morrisons Soft Grip Scrub Brush,£1,,
Morrisons Solid Toilet Rim Block Lemon,Morrisons Solid Toilet Rim Block Lemon2 per pack,£1.70,85p each,
Morrisons Solid Toilet Rim Block Ocean,Morrisons Solid Toilet Rim Block Ocean2 per pack,£1.70,85p each,
Morrisons So Soft 12 Double Toilet Rolls,Morrisons So Soft 12 Double Toilet Rolls12 per pack,£8.60,71.7p each,"Offer price £8.60, was £9.90"
Morrisons Sponge Cloths    ,Morrisons Sponge Cloths    4 per pack,£1.50,37.5p each,
Morrisons Sponge Wipes     ,Morrisons Sponge Wipes     4 per pack,£1.30,32.5p each,
Morrisons Spray Window Cleaner,Morrisons Spray Window Cleaner,£4,,
Morrisons Squeegee With Sucker,Morrisons Squeegee With Sucker,£1,,
Morrisons Stainless Steel Scourer ,Morrisons Stainless Steel Scourer 4 per pack,£1.65,41.3p each,
Morrisons Steel Wool Soap Pads ,Morrisons Steel Wool Soap Pads 10 per pack,£1.25,12.5p each,
Morrisons Summer Burst Fabric Conditioner 42 Washes,Morrisons Summer Burst Fabric…1.26L,£2.15,£1.71 per litre,
Morrisons Super Absorbent  Cloths ,Morrisons Super Absorbent  Cloths 4 per pack,£1.55,38.8p each,Cleaning Accessories Bundle - Buy Any 2 For £2.50
Morrisons Supersoft XL Tissues 54 Sheets,Morrisons Supersoft XL Tissues 54 Sheets,£2,,
Morrisons The Best 20 Neutralising Tall Kitchen Bin Liners 30 Litres,Morrisons The Best 20 Neutralising Tall…20 per pack,£2.75,13.8p each,
Morrisons The Best Honeysuckle & White Amber Fabric Conditioner 33 Washes,Morrisons The Best Honeysuckle…1L,£1.95,£1.95 per litre,
Morrisons The Best Power Burst Dishwasher Tablets,Morrisons The Best Power Burst Dishwasher Tablets30 per pack,£4,13.3p each,
Morrisons The Best Ultra Kitchen Towel,Morrisons The Best Ultra Kitchen Towel2 per pack,£3.25,£1.63 each,
Morrisons The Best Ultra Kitchen Towel Roll,Morrisons The Best Ultra Kitchen Towel Roll4 per pack,£5.75,£1.44 each,
Morrisons The Best Ultra Kitchen Towel Roll Roll,Morrisons The Best Ultra Kitchen Towel Roll Roll4 per pack,£5.35,£1.34 each,
Morrisons The Best White Lavender & Patchouli Fabric Conditioner  33 Washes,Morrisons The Best White Lavend…1L,£1.95,£1.95 per litre,
Morrisons Thick Bleach Original,Morrisons Thick Bleach Original2L,£1.35,67.5p per litre,
Morrisons Thick Pine Disinfectant,Morrisons Thick Pine Disinfectant1L,£1.15,£1.15 per litre,"Offer price £1.15, was £1.30"
Morrisons Tie Handle Food & Freezer Bags Small ,Morrisons Tie Handle Food & Freezer Bags Small 60 per pack,£1.75,2.9p each,
Morrisons Tie Top Refuse Sack 70L 20 Pack,Morrisons Tie Top Refuse Sack 70L 20 Pack20 x 1 per pack,£3,15p each,
Morrisons Toilet Tissue White ,Morrisons Toilet Tissue White 9 per pack,£4.09,45.4p each,
Morrisons Toilet Tissue White ,Morrisons Toilet Tissue White 4 per pack,£1.99,49.8p each,"Offer price £1.99, was £2.55"
Morrisons        Toilet  Tissue   White ,Morrisons        Toilet  Tissue   White 2 per pack,£1.35,67.5p each,
Morrisons Tough Gloves Large,Morrisons Tough Gloves Large,£2.50,,
Morrisons Tough Towels Kitchen Roll,Morrisons Tough Towels Kitchen Roll2 per pack,£3.10,£1.55 each,
Morrisons Tropical Eco Fabric Conditioner 26 Washes,Morrisons Tropical Eco Fabric…1.26L,£1.50,£1.19 per litre,"Offer price £1.50, was £2.25"
Morrisons Tropical Lychee & Passionfruit Laundry Capsules,Morrisons Tropical Lychee & Passi…21 per pack,£3.70,17.6p each,
Morrisons Ultra Soft Regular Tissues 80 Sheets,Morrisons Ultra Soft Regular Tissues 80 Sheets2 per pack,£2.79,£1.40 each,"Offer price £2.79, was £3.10"
Morrisons Vanilla Candle ,Morrisons Vanilla Candle 120g,£2.25,£1.88 per 100g,
Morrisons Whites Stain Remover Oxy Action Powder ,Morrisons Whites Stain Remo…1kg,£2.90,£2.90 per kg,
Morrison Trigger Spray Bottle,Morrison Trigger Spray Bottle,£1.25,,
Mr Muscle Drain Foamer Odour Eliminator,Mr Muscle Drain Foamer Odour Eliminator500ml,£4,£8.00 per litre,
Mr Muscle Drain Max Unblocker,Mr Muscle Drain Max Unblocker1L,£4,£4.00 per litre,"Offer price £4, was £6"
Mr Muscle Drain Power Gel for Full Clogs ,Mr Muscle Drain Power Gel for Full Clogs 500ml,£4,£8.00 per litre,
Mr Muscle Oven Cleaner,Mr Muscle Oven Cleaner300ml,£4,£13.33 per litre,
Mr Muscle Platinum Bathroom Spray Mandarin,Mr Muscle Platinum Bathroom Spray Mandarin750ml,£2,£2.67 per litre,
Mr Muscle Platinum Kitchen Spray Citrus,Mr Muscle Platinum Kitchen Spray Citrus750ml,£2,£2.67 per litre,
Mr Muscle Platinum Shower Shine Spray,Mr Muscle Platinum Shower Shine Spray750ml,£2,£2.67 per litre,
Mr Muscle Platinum Window & Glass Spray,Mr Muscle Platinum Window & Glass Spray750ml,£2,£2.67 per litre,
Mr Sheen Leather Wipes,Mr Sheen Leather Wipes30 per pack,£2.85,9.5p each,
Mr Sheen Multi Surface Polish Magnolia & Cherry,Mr Sheen Multi Surface Polish Magnolia & Cherry250ml,£1.80,72p per 100ml,
Mr Sheen Multi Surface Polish Original,Mr Sheen Multi Surface Polish Original250ml,£1.80,72p per 100ml,
Mr Sheen Multi Surface Polish Spring Fresh,Mr Sheen Multi Surface Polish Spring Fresh250ml,£1.80,72p per 100ml,
Mr Sheen Multi Surface Wipes Magnolia & Cherry,Mr Sheen Multi Surface Wipes Magnolia & Cherry30 per pack,£2.85,9.5p each,
Mr Sheen Multi Surface Wipes Spring Fresh ,Mr Sheen Multi Surface Wipes Spring Fresh 30 per pack,£2.85,9.5p each,
M savers Thin Bleach,M savers Thin Bleach2L,50p,25p per litre,
My Spa Coconut & Frangipani Flower Scented Candle,My Spa Coconut & Frangipani…,£1.70,,
Non Silicone Leather Silk Leather Polish And Conditioner,Non Silicone Leather Silk Leath…225ml,£2,88.9p per 100ml,
Non Silicone Wood Silk Aerosol Furniture Polish,Non Silicone Wood Silk Aerosol Furniture Polish225ml,£1.50,66.7p per 100ml,
Nutmeg Home Considered Oil Burner,Nutmeg Home Considered Oil Burner,£5,,
Nutmeg Home Grey Ceramic Floral Oil Burner,Nutmeg Home Grey Ceramic Floral Oil Burner,£5,,
Nutmeg Home Habitation Floral Infusion Gel Candle,Nutmeg Home Habitation Floral Infusion Gel Candle,£6,,
Nutmeg Home Jar Cotton Blossom,Nutmeg Home Jar Cotton Blossom,£4,,
Nutmeg Home Jar Sandalwood,Nutmeg Home Jar Sandalwood,£4,,
Nutmeg Home Large Jar Berries,Nutmeg Home Large Jar Berries,£6,,
Nutmeg Home Large Jar Cotton Blossom,Nutmeg Home Large Jar Cotton Blossom,£6,,
