name,Price Per Unit,Price Per Measure,Promotion
Febreze Ambi Pur 3Volution Air Freshener Vanilla Blossom Plug In Refills ,Febreze Ambi Pur 3Volution Air…,£6,,"Offer price £6, was £10"
Febreze Ambi Pur 3Volution ZERO% Air Freshener Aqua Plug In Refills,Febreze Ambi Pur 3Volution…,£3.50,,"Offer price £3.50, was £5"
Febreze Ambi Pur Air Freshener Lavender Plug In Refill,Febreze Ambi Pur Air Freshener…20ml,£4,£2.00 per 10ml,Buy 2 for £6
Febreze Ambi Pur Air Freshener Spring Awakening Plug In Refill,Febreze Ambi Pur Air Freshener Spri…,£4,,
Febreze Ambi Pur Air Freshener Vanilla Bouquet Plug In Refill,Febreze Ambi Pur Air Freshener Vani…,£4,,
Febreze Ambi Pur Air Freshener White Jasmine Plug In Refill,Febreze Ambi Pur Air Freshener Wh…20ml,£4,£20.00 per 100ml,Buy 2 for £6
Febreze Ambi Pur Lenor Air Freshener Ocean Escape Plug In Refill,Febreze Ambi Pur Lenor Air Freshener…20ml,£4,£20.00 per 100ml,Buy 2 for £6
Febreze Antibacterial Fabric Freshener Spray Fresh Linen,Febreze Antibacterial Fabric Fr…375ml,£3,80p per 100ml,Buy 2 for £5
Febreze Bathroom Air Freshener Blossom,Febreze Bathroom Air Freshener Blossom2 per pack,£4.50,£2.25 each,"Offer price £4.50, was £5.50"
Febreze Bathroom Air Freshener Citrus Freshness,Febreze Bathroom Air Fres…7.5ml,£3,£40.00 per 100ml,Buy 2 for £5
Febreze Bathroom Air Freshener Cotton Fresh Twin Pack,Febreze Bathroom Air Freshene…2 per pack,£4.50,£2.25 each,"Offer price £4.50, was £5.50"
Febreze Bathroom Air Freshener Liquid Membrane Fresh Linen,Febreze Bathroom Air Freshener Li…7.5ml,£3,£40.00 per 100ml,Buy 2 for £5
Febreze Bathroom Air Freshener Sugar Plum,Febreze Bathroom Air Freshener Sugar Plum,£3,,
Febreze Bathroom Air Fresh Liquid Membrane Crocus & Blue Belle,Febreze Bathroom Air Fresh Liquid M…7.5ml,£3,£40.00 per 100ml,Buy 2 for £5
Febreze Bathroom Air Freshner Liquid Membrane Fruity Tropics,Febreze Bathroom Air Freshner Liqui…7.5ml,£3,£40.00 per 100ml,Buy 2 for £5
Febreze Bathroom Airfreshner Liquid Membrane Orange,Febreze Bathroom Airfreshner…7.5ml,£3,£40.00 per 100ml,Buy 2 for £5
Febreze Bathroom Blossom & Breeze Air Freshener,Febreze Bathroom Blossom…,£3,,Buy 2 for £5
Febreze Bathroom Continuous Air Freshener,Febreze Bathroom Continuous Air Freshener2 per pack,£4.50,£2.25 each,"Offer price £4.50, was £5.50"
Febreze Bathroom Cotton Fresh Air Freshener ,Febreze Bathroom Cotton Fresh Air Freshener ,£3,,Buy 2 for £5
Febreze Blossom & Breeze Air Freshener Mist Spray,Febreze Blossom & Breeze Air Freshener Mist Spray300ml,£2.50,83.3p per 100ml,
Febreze Blossoms & Breeze Car Clip Air Freshener ,Febreze Blossoms & Breeze C…,£2.50,,
Febreze Car Air Freshener Blossom & Breeze Twin Pack,Febreze Car Air Freshener Blo…2 per pack,£4,£2.00 each,
Febreze Cotton Fresh Air Freshener Mist Spray,Febreze Cotton Fresh Air Freshener Mist Spray300ml,£2.50,83.3p per 100ml,
Febreze Cotton Fresh Car Clip Air Freshener ,Febreze Cotton Fresh Car Clip Air Freshener 2ml,£2.50,£12.50 per 10ml,
Febreze Cotton Fresh Fabric Refresher Spray,Febreze Cotton Fresh Fabric Refresher Spray375ml,£3,80p per 100ml,Buy 2 for £5
Febreze Crocus & Bluebell Air Freshener Mist Spray ,Febreze Crocus & Bluebell Air Freshener Mist Spray 300ml,£3,£1.00 per 100ml,Buy 2 for £5
Febreze Fabric Freshener Spray Blossom & Breeze,Febreze Fabric Freshener Spray Blossom & Breeze375ml,£3,80p per 100ml,Buy 2 for £5
Febreze Fabric Freshener Spray Pet,Febreze Fabric Freshener Spray Pet375ml,£3,80p per 100ml,Buy 2 for £5
Febreze Fabric Fresheners Spray Fruity Tropics,Febreze Fabric Fresheners Spray Fruity Tropics375ml,£2.50,66.7p per 100ml,
Febreze Fabric Refresher Citrus Fresh,Febreze Fabric Refresher Citrus Fresh375ml,£3,£8.00 per litre,Buy 2 for £5
Febreze Fabric Refresher Pink Tulips,Febreze Fabric Refresher Pink Tulips500ml,£3,60p per 100ml,
Febreze Freshener Spray Orange,Febreze Freshener Spray Orange300ml,£2.50,83.3p per 100ml,
Febreze Fresh Linen Air Freshener Mist Spray ,Febreze Fresh Linen Air Freshener Mist Spray 300ml,£2.50,83.3p per 100ml,
Febreze Fruity Tropics Air Freshener Mist Spray,Febreze Fruity Tropics Air Freshener Mist Spray300ml,£2.50,83.3p per 100ml,
Febreze Lavender Air Freshener Mist Spray,Febreze Lavender Air Freshener Mist Spray300ml,£2.50,83.3p per 100ml,
Febreze Lavender Bathroom Air Freshener,Febreze Lavender Bathroom Air Freshener,£3,,Buy 2 for £5
Febreze Lenor Exotic Air Freshener Mist Spray,Febreze Lenor Exotic Air Freshener Mist Spray300ml,£2.50,83.3p per 100ml,
Febreze Lenor Exotic Bloom Bathroom Air Freshener,Febreze Lenor Exotic Bloom…7.5ml,£3,£40.00 per 100ml,Buy 2 for £5
Febreze Lenor Gold Orchid Air Freshener Mist Spray,Febreze Lenor Gold Orchid Air Freshener Mist Spray300ml,£2.50,83.3p per 100ml,
Febreze Mrs Hinch Air Freshener Spray Spring,Febreze Mrs Hinch Air Freshener Spray Spring300ml,£3,£1.00 per 100ml,
Febreze Mrs Hinch Bathroom Air Freshener Lenor,Febreze Mrs Hinch Bathroo…7.5ml,£3,£40.00 per 100ml,
Febreze New Car Scent Car Air Freshener ,Febreze New Car Scent Car Air Freshener ,£2.50,,
Febreze Plug Plug & Refill Cotton Fresh,Febreze Plug Plug & Refill Cotton Fresh,£4.50,,
Febreze Ruby Jasmine Air Freshener Mist Spray,Febreze Ruby Jasmine Air Freshener Mist Spray300ml,£2.50,83.3p per 100ml,
Febreze Spring Awakening Bathroom Air Freshener ,Febreze Spring Awakening Ba…,£3,,Buy 2 for £5
Febreze Spring Awakening Car Clip Air Freshener ,Febreze Spring Awakening Ca…,£2.50,,
Febreze Twin Car Clip Cotton Fresh Air Freshener ,Febreze Twin Car Clip Cotton Fresh Air Freshener 2 per pack,£4,£2.00 each,
Febreze Unstoppables Car Air Freshener Fresh,Febreze Unstoppables Car Air Freshener Fresh,£4.50,,
Febreze Unstoppables Fresh Car Air Freshener,Febreze Unstoppables Fresh Car Air Freshener,£3,,
Febreze Vanilla & Magnolia Air Freshener Mist Spray,Febreze Vanilla & Magnolia Ai…300ml,£2.50,83.3p per 100ml,
Febreze Vanilla & Magnolia Small Spaces Bathroom Air Freshener ,Febreze Vanilla & Magnolia Small Spac…,£3,,Buy 2 for £5
Febreze White Jasmine Bathroom Air Freshener,Febreze White Jasmine Bathroom Air Freshener,£3,,Buy 2 for £5
Febreze Zero% 3Volution Air Freshener Orchid Plug In Starter Kit,Febreze Zero% 3Volution Air Freshener…,£6,,
Febreze Zero% Air Freshener Flairosol Starter Kit Orchid,Febreze Zero% Air Freshener Fla…,£5,,
Finish 2 in 1 Lemon & Lime Dishwasher Freshener up to 60 Washes,Finish 2 in 1 Lemon & Lime Dishwasher…,£3,,
Finish All In One Dishwasher Tablets 52 Tabs,Finish All In One Dishw…52 per pack,£8,15.4p each,"Offer price £8, was £9.50"
Finish All In One Dishwasher Tablets Lemon,Finish All In One Dishw…84 per pack,£12,14.3p each,
Finish All In One Dishwasher Tablets Lemon 26 Tabs,Finish All In One Dishwashe…26 per pack,£5,19.2p each,
Finish All In One Dishwasher Tablets Lemon 52 Tabs,Finish All In One Dishwashe…52 per pack,£8,15.4p each,"Offer price £8, was £9.50"
Finish All In One Dishwasher Tablets Lemon 75 Tabs,Finish All In One Dishwashe…75 per pack,£11,14.7p each,
Finish Dishwasher Cleaner Lemon,Finish Dishwasher Cleaner Lemon250ml,£3.50,£14.00 per litre,
Finish Dishwasher Salt,Finish Dishwasher Salt2kg,£4,20p per 100g,
Finish Quantum All In One Dishwasher Tablets Lemon 23 Tabs,Finish Quantum All In One Dishwas…23 per pack,£6,26.1p each,
Finish Quantum All in One Lemon Tablets,Finish Quantum All in One Lemon Tablets72 per pack,£11,15.3p each,
Finish Quantum Ultimate+ Lemon Tablets,Finish Quantum Ultimate+ Lemon Tablets18 per pack,£6,33.3p each,
Finish Quantum Ultimate+ Regular,Finish Quantum Ultimate+ Regular33 per pack,£9.50,28.8p each,
Finish Quantum Ultimate All In One Lemon,Finish Quantum Ultimate All In One Lemon52 per pack,£11,21.2p each,
Finish Rinse Aid,Finish Rinse Aid400ml,£3.50,87.5p per 100ml,
Finish Ultimate All In One Dishwasher Tablets 61 Tabs,Finish Ultimate All In One Di…61 per pack,£11,18p each,
Finish Ultimate All In One Dishwasher Tablets Lemon 21 Tabs,Finish Ultimate All In One Dishwa…21 per pack,£6,28.6p each,
Finish Ultimate All In One Dishwasher Tablets Lemon 61 Tabs,Finish Ultimate All In One Dishwa…61 per pack,£11,18p each,
Finish Utimate All In One Dishwasher Tablets Lemon 39 Tabs,Finish Utimate All In One Dishwas…39 per pack,£8,20.5p each,
Flash All Purpose Blossoms And Breeze,Flash All Purpose Blossoms And Breeze1.5L,£2.99,19.9p per 100ml,
Flash Anti-Bac Speed Mop Wet Cloths Lemon,Flash Anti-Bac Speed Mop Wet Cloths Lemon12 per pack,£5,41.7p each,
Flash Anti-Bacterial All Purpose Liquid Cleaner,Flash Anti-Bacterial All Purpose Liquid Cleaner1L,£2,£2.00 per litre,"Offer price £2, was £2.50"
Flash Anti Bacterial Cleaning Spray Wipe & Done Apple Blossom,Flash Anti Bacterial Cleaning Spray…800ml,£2.50,31.3p per 100ml,"Offer price £2.50, was £3.50"
Flash Bathroom 3In1 Antibacterial Cleaning Spray,Flash Bathroom 3In1 Antibac…750ml,£2.49,33.2p per 100ml,Offer price £2.50 was £3
Flash Bathroom Spray Wipe Done Antibacterial,Flash Bathroom Spray Wipe Done Antibacterial800ml,£3.50,£4.38 per litre,
Flash Bathroom Spray Wipe Done Shower,Flash Bathroom Spray Wipe Done Shower800ml,£3.50,£4.38 per litre,
Flash Bleach Cleaning Spray,Flash Bleach Cleaning Spray800ml,£2.50,31.3p per 100ml,
Flash Bleach Clean Spray,Flash Bleach Clean Spray800ml,£2.50,31.3p per 100ml,
Flash Cleaning Spray Bicarbonate & Eucalyptus ,Flash Cleaning Spray Bicarbonate & Eucalyptus 800ml,£2.50,31.3p per 100ml,"Offer price £2.50, was £3.50"
Flash Clean with Febreze Fresh Scent Bathroom Spray,Flash Clean with Febreze Fres…800ml,£2.50,31.3p per 100ml,
Flash Duster Refills 5 Pack,Flash Duster Refills 5 Pack5 per pack,£5,£1.00 each,
Flash Duster Starter Kit And 4 Pads,Flash Duster Starter Kit And 4 Pads,£5,,
Flash Duster Xxl Starter Kit And 2 Pads,Flash Duster Xxl Starter Kit And 2 Pads,£6,,
Flash Kitchen Spray Ultra Anti-Bacterial Spray,Flash Kitchen Spray Ultra Anti-Bacterial Spray750ml,£2.49,£3.32 per litre,Offer price £2.50 was £3
Flash Lavender Floor Cleaning Liquid,Flash Lavender Floor Cleaning Liquid1.5L,£3,20p per 100ml,
Flash Lemon Floor Cleaning Liquid,Flash Lemon Floor Cleaning Liquid1.5L,£3,20p per 100ml,
Flash Liquid Wood Floor Cleaner,Flash Liquid Wood Floor Cleaner1L,£2.50,£2.50 per litre,
Flash Mandarin Spray Wipe & Done Cleaning Spray,Flash Mandarin Spray Wipe…800ml,£2.50,31.3p per 100ml,"Offer price £2.50, was £3.50"
Flash Power Mop Liquid Refill Sea Minerals ,Flash Power Mop Liquid Refill Sea Minerals 1.25L,£4,£3.20 per litre,
Flash Power Mop Wet Jet ,Flash Power Mop Wet Jet 8 per pack,£6,75p each,
Flash Sparkling Home Spray Wipe Hinched Spring Berries,Flash Sparkling Home Spray Wipe…800ml,£3,37.5p per 100ml,
Flash Speed Mop Refills Pads,Flash Speed Mop Refills Pads20 per pack,£5,25p each,
Flash Speed Mop Replacement Cloths,Flash Speed Mop Replacement Cloths12 per pack,£5,41.7p each,
Flash Spray Wipe Done All Purpose Lemon,Flash Spray Wipe Done All Purpose Lemon800ml,£3.50,43.8p per 100ml,
Flash Spray Wipe Done Antibacterial Cleaning Spray Wild Berries,Flash Spray Wipe Done Antibacterial C…800ml,£3.50,£4.38 per litre,
Flash Spray Wipe Done Glass,Flash Spray Wipe Done Glass800ml,£2.50,31.3p per 100ml,"Offer price £2.50, was £3.50"
Flash Strong & Thick Cleaning Wipes Lemon ,Flash Strong & Thick Cleaning Wipes Lemon 24 per pack,£2,8.3p each,
Flash Swd Orange And Cinammon ,Flash Swd Orange And Cinammon 800ml,£3.50,£4.38 per litre,
"Full Circle Neat Nut Walnut Scour Pads, Pack Of 2",Full Circle Neat Nut Walnut…2 per pack,£7,£3.50 each,
Glade Aerosol Beach Days,Glade Aerosol Beach Days300ml,£1.50,50p per 100ml,
Glade Aerosol Berry Pop,Glade Aerosol Berry Pop300ml,£1.50,50p per 100ml,
Glade Aerosol Clean Linen Air Freshener,Glade Aerosol Clean Linen Air Freshener300ml,£1.50,50p per 100ml,
Glade Aerosol Watermelon,Glade Aerosol Watermelon300ml,£1.50,50p per 100ml,
Glade Air Freshener Pure Clean Linen Scented Oil Plug In ,Glade Air Freshener Pure Clean Li…,£4.25,,"Offer price £4.25, was £5"
Glade Apple Cosy Cider Automatic Refill Spray,Glade Apple Cosy Cider Automatic Refill Spray269ml,£3.75,£1.39 per 100ml,
Glade Aroma Calm Candle,Glade Aroma Calm Candle,£9,,
Glade Automatic Spray Refill Cherry & Peony Air Freshener,Glade Automatic Spray Refill Cher…269ml,£3.50,£1.30 per 100ml,
Glade Automatic Spray Refill Pure Clean Linen Air Freshener,Glade Automatic Spray Refill Pure…269ml,£3.50,£1.30 per 100ml,
Glade Automatic Spray Refill Sandalwood & Jasmine Air Freshener,Glade Automatic Spray Refill Sandalwo…269ml,£3.50,£1.30 per 100ml,
Glade Automatic Spray Twin Refill Clean Linen Air Freshener,Glade Automatic Spray Twin Refill…2 x 269ml,£5.50,£1.02 per 100ml,
Glade Automatic Spray Twin Refill Relaxing Zen Air Freshener,Glade Automatic Spray Twin Refill R…2 x 269ml,£5.50,£1.02 per 100ml,
Glade Automatic Twin Refill Sensual Sandalwood & Jasmine Automatic Spray ,Glade Automatic Twin Refill Sen…2 per pack,£5.50,£2.75 each,
Glade Bubbly Berry Splash Automatic Spray Refill ,Glade Bubbly Berry Splash A…269ml,£3.75,£1.39 per 100ml,
Glade Bubbly Berry Splash Candle ,Glade Bubbly Berry Splash Candle 129g,£4,£3.10 per 100g,
Glade Electric Holder Beach Days,Glade Electric Holder Beach Days20ml,£5,£25.00 per 100ml,
Glade Electric Holder Watermelon,Glade Electric Holder Watermelon20ml,£5,£25.00 per 100ml,
Glade Electric Refill Beach Days,Glade Electric Refill Beach Days20ml,£3.50,£17.50 per 100ml,
Glade Electric Refill Berry Pop,Glade Electric Refill Berry Pop20ml,£2.50,£12.50 per 100ml,"Offer price £2.50, was £3.50"
Glade Electric Refill Watermelon,Glade Electric Refill Watermelon20ml,£3.50,£17.50 per 100ml,
Glade Exotic Tropical Blossoms Electric Scented Oil Refill ,Glade Exotic Tropical Blossoms El…20ml,£2.50,£1.25 per 10ml,"Offer price £2.50, was £3.50"
Glade Large Automatic Spray Holder Watermelon,Glade Large Automatic Spray Holder Watermelon269ml,£8,£2.97 per 100ml,
Glade Large Automatic Spray Refill Beach Days,Glade Large Automatic Spray Refill Beach Days269ml,£3.75,£1.39 per 100ml,
Glade Large Automatic Spray Refill Watermelon,Glade Large Automatic Spray Refill Watermelon269ml,£3.75,£1.39 per 100ml,
Glade Luscious Peony & Cherry Candle,Glade Luscious Peony & Cherry Candle,£4,,
Glade Peaceful Relaxing Zen Candle,Glade Peaceful Relaxing Zen Candle,£4,,
Glade Plug Ins Scented Oil Refill Sensual Sandalwood & Jasmine ,Glade Plug Ins Scented Oil Refill Sen…20ml,£2.50,£1.25 per 10ml,"Offer price £2.50, was £3.50"
Glade Refill Marshmallow,Glade Refill Marshmallow269ml,£2.50,92.9p per 100ml,
Glade Romantic Vanilla Blossom Candle ,Glade Romantic Vanilla Blossom Candle ,£4,,
Glade Sense & Spray Refill Pure Linen Air Freshener ,Glade Sense & Spray Refill Pure Linen Air Freshener 18ml,£3.50,£1.94 per 10ml,
Glade Sense & Spray Refill Relaxing Zen Air Freshener,Glade Sense & Spray Refill Re…18ml,£3.50,£1.94 per 10ml,
Glade Sense & Spray Refill Watermelon,Glade Sense & Spray Refill Watermelon18m,£3,16.7p per 1m,
Glade Sensual Sandalwood & Jasmine Candle ,Glade Sensual Sandalwoo…,£4,,
Glade Solid Gel Clean Linen Air Freshener,Glade Solid Gel Clean Linen Air Freshener150g,£1.25,83.3p per 100g,
Glade Solid Gel Lavender Air Freshener,Glade Solid Gel Lavender Air Freshener150g,£1.25,83.3p per 100g,
Glade Solid Gel Lily of the Valley Air Freshener,Glade Solid Gel Lily of the Valley Air Freshener150g,£1.25,83.3p per 100g,
Glade Solid Gel Relaxing Zen Air Freshener,Glade Solid Gel Relaxing Zen Air Freshener150g,£1.25,83.3p per 100g,
Glade Spring Candle Beach Days,Glade Spring Candle Beach Days,£4,,
Glade Spring Candle Watermelon,Glade Spring Candle Watermelon,£4,,
Glade Spring Day Clouds Candle,Glade Spring Day Clouds Candle,£5,,
Glade Stay Cool Watermelon Candle,Glade Stay Cool Watermelon Candle,£5,,
Glade Stay Cool Watermelon Sense & Spray Holder,Glade Stay Cool Watermelo…,£7,,
Glade Touch & Fresh Exotic Tropical Blossoms Refill,Glade Touch & Fresh Exotic Tr…10ml,£2.70,£27.00 per 100ml,
Glade Touch & Fresh Pure Clean Linen Air Freshener,Glade Touch & Fresh Pure Clean Linen Air Freshener10ml,£3.50,£3.50 per 10ml,
Glade Touch & Fresh Refill Cherry & Peony Air Freshener,Glade Touch & Fresh Refill Cher…10ml,£2.70,£2.70 per 10ml,
Glade Touch & Fresh Refill Clean Linen Air Freshener,Glade Touch & Fresh Refill Clean Linen Air Freshener10ml,£2.70,£2.70 per 10ml,
Glade Vanilla Blossom Automatic Spray Refill,Glade Vanilla Blossom Automatic Spray Refill,£3.75,,
Goddards Long Term Silver Polish Cloth,Goddards Long Term Silver Polish Cloth,£2.50,,
Harpic Active Fresh Toilet Cleaner Gel Citrus,Harpic Active Fresh Toilet Cleaner Gel Citrus750ml,£1.50,£2.00 per litre,
Harpic Active Fresh Toilet Cleaner Gel Pine,Harpic Active Fresh Toilet Cleaner Gel Pine750ml,£1.50,£2.00 per litre,
Harpic Active Fresh Toilet Rim Block Citrus x2,Harpic Active Fresh Toilet Rim Block Citrus x22 per pack,£2.10,£1.05 each,
Harpic Active Fresh Toilet Rim Block Lavender x2,Harpic Active Fresh Toilet Rim Block Lavender x22 per pack,£2.10,£1.05 each,
Harpic Bleach White & Shine Toilet Cleaner,Harpic Bleach White & Shine Toilet Cleaner750ml,£1.50,£2.00 per litre,
Harpic Bleach White & Shine Toilet Cleaner Citrus,Harpic Bleach White & Shine Toilet Cleaner Citrus750ml,£1.50,£2.00 per litre,
Harpic Limescale Remover Toilet Cleaner Gel,Harpic Limescale Remover Toilet Cleaner Gel750ml,£1.95,£2.60 per litre,
Harpic Power Plus Citrus Fresh Toilet Cleaner ,Harpic Power Plus Citrus Fresh Toilet Cleaner 750ml,£2,£2.67 per litre,
Harpic Powerplus Toilet Cleaner Citrus,Harpic Powerplus Toilet Cleaner Citrus680ml,£1.75,£2.57 per litre,
Harpic Powerplus Toilet Cleaner Original,Harpic Powerplus Toilet Cleaner Original680ml,£1.75,£2.57 per litre,
HG Bathroom Professional Limescale Remover,HG Bathroom Professional Limescale Remover1L,£8.60,£8.60 per litre,
Hg Bathroom Scale Away Foam Spray 3X Stronger,Hg Bathroom Scale Away Foam Spray 3X Stronger500ml,£5.30,£10.60 per litre,
HG Interior Window Cleaner,HG Interior Window Cleaner500ml,£3.90,£7.80 per litre,
If You Care FSC Certified 3 Gallon Compostable Food Waste Bags,If You Care FSC Certified 3 Gallon…30 per pack,£8.95,29.8p each,
If You Care FSC Certified Sandwich Bags,If You Care FSC Certified Sandwich Bags48 per pack,£6.95,14.5p each,
Jelly Belly Blueberry Duo Vent Air Freshener,Jelly Belly Blueberry Duo Vent Air Freshener,£5.40,,
Jelly Belly Bubblegum Air Freshener,Jelly Belly Bubblegum Air Freshener,£3.70,,
Jelly Belly Very Cherry Duo Vent Air Freshener,Jelly Belly Very Cherry Duo Vent Air Freshener,£5.40,,
Joie Reuseable Food Bags ,Joie Reuseable Food Bags 6 per pack,£5,83.3p each,
Kiwi Shoe Classic Round Lace Brown 75cm,Kiwi Shoe Classic Round Lace Brown 75cm,£1.95,,
Kiwi Shoe Passion Heel Gel Cushions,Kiwi Shoe Passion Heel Gel Cushions,£3.70,,
Kiwi Shoe Passion Heel Gel Liner,Kiwi Shoe Passion Heel Gel Liner,£3.70,,
Kiwi Sneaker Cleaner ,Kiwi Sneaker Cleaner 75ml,£4.50,£6.00 per 100ml,
Kleenex Allergy Comfort Tissues 2 pack,Kleenex Allergy Comfort Tissues 2 pack2 per pack,£4,£2.00 each,
Kleenex Allergy Wipes,Kleenex Allergy Wipes40 per pack,£2,5p each,
Kleenex AntiBacterial Water Fresh Wipes,Kleenex AntiBacterial Water Fresh Wipes40 per pack,£1.50,3.8p each,"Offer price £1.50, was £2"
Kleenex Antibac Wipes,Kleenex Antibac Wipes36 per pack,£2,5.6p each,
Kleenex Balsam Extra Large 40 Sheets,Kleenex Balsam Extra Large 40 Sheets,£1.50,,"Offer price £1.50, was £2.75"
Kleenex Balsam Tissues 2 pack ,Kleenex Balsam Tissues 2 pack 2 x 64 per pack,£4,3.1p each,
Kleenex Balsam Tissues 8 pocket pack,Kleenex Balsam Tissues 8 pocket pack,£1.50,,"Offer price £1.50, was £2"
Kleenex Balsam Tissues Single Pack 64 Sheets,Kleenex Balsam Tissues Single Pack 64 Sheets,£2,,"Offer price £2, was £2.75"
Kleenex Collection Cube Tissues 48 Sheets,Kleenex Collection Cube Tissues 48 Sheets,£1.75,,
Kleenex Extra Large Compact Tissues 2 pack,Kleenex Extra Large Compact Tissues 2 pack2 x 44 per pack,£2.50,2.8p each,
Kleenex Extra Large Compact Tissues 4 pack,Kleenex Extra Large Compact Tissues 4 pack4 x 44 per pack,£4.75,2.7p each,
Kleenex Extra Large Tissues 2 pack,Kleenex Extra Large Tissues 2 pack2 x 90 per pack,£3.50,1.9p each,"Offer price £3.50, was £4"
Kleenex Original Tissues 64 Sheets,Kleenex Original Tissues 64 Sheets,£1.25,,"Offer price £1.25, was £2.50"
Kleenex The Original Eco Box 128 Sheets,Kleenex The Original Eco Box 128 Sheets,£2.75,,
Kleenex Ultra Soft Cube Tissues 48 Sheets,Kleenex Ultra Soft Cube Tissues 48 Sheets,£2.25,,
Kleenex Ultra Soft Extra Large Compact Tissues 40 Sheets,Kleenex Ultra Soft Extra Large…,£1.50,,"Offer price £1.50, was £2.75"
Kleenex Ultra Soft Tissues 2 Pack,Kleenex Ultra Soft Tissues 2 Pack2 x 64 per pack,£4,3.1p each,
Kuhn Rikon Swiss Hob Scraper,Kuhn Rikon Swiss Hob Scraper,£7.40,£7.40 each,
Lenor Burst of Sunshine Fabric Conditioner 30 Washes,Lenor Burst of Sunshine Fabri…1050ml,£3,£2.86 per litre,
Lenor Burst of Sunshine Fabric Conditioner 48 Washes ,Lenor Burst of Sunshine Fabri…1.68L,£3,£1.78 per litre,"Offer price £3, was £3.50"
Lenor Crease Releaser Spring Awakening,Lenor Crease Releaser Spring Awakening500ml,£3,£6.00 per litre,
Lenor Exotic Bloom Fabric Conditioner 30 Washes,Lenor Exotic Bloom Fabric Conditioner 30 Washes1.05L,£3,£2.86 per litre,
Lenor Exotic Bloom In-Wash Scent Booster,Lenor Exotic Bloom In-Wash Scent Booster176g,£5,£28.41 per kg,
Lenor Fabric Conditioner Floral Fresh Scent 54 Washes,Lenor Fabric Conditioner Flor…1.9L,£3,£1.58 per litre,
Lenor Fabric Conditioner Pink Tulips & White Jasmine 50 Washes,Lenor Fabric Conditioner Pink Tulip…1.75L,£3.50,20p per 100ml,
Lenor Fabric Conditioner Spring Awakening Scent 83 Washes,Lenor Fabric Conditioner Spring A…2.9L,£4.75,£1.64 per litre,
Lenor Fabric Enhancer Pink Tulips & White Jasmine Mrs Hinch,Lenor Fabric Enhancer Pink Tulips…176g,£5,£2.84 per 100g,
Lenor Fresh Meadow Fabric Conditioner 33 Washes,Lenor Fresh Meadow Fabric…1.155L,£2.25,£1.95 per litre,
Lenor Gold Orchid Fabric Conditioner 30 Washes,Lenor Gold Orchid Fabric Conditioner 30 Washes1.05L,£3.25,£3.10 per litre,
Lenor Gold Orchid Fabric Conditioner 48 Washes ,Lenor Gold Orchid Fabric Conditioner 48 Washes 1.68L,£3,£1.78 per litre,"Offer price £3, was £3.50"
Lenor Gold Orchid In-Wash Scent Booster,Lenor Gold Orchid In-Wash Scent Booster320g,£5,£15.63 per kg,"Offer price £5, was £8"
Lenor Gold Orchid In-Wash Scent Booster,Lenor Gold Orchid In-Wash Scent Booster176g,£5,£28.41 per kg,
Lenor In-Wash Scent Booster,Lenor In-Wash Scent Booster176g,£5,£28.41 per kg,
Lenor Northern Solstice 55w Outdoorables,Lenor Northern Solstice 55w Outdoorables770ml,£3.50,45.5p per 100ml,
Lenor Outdoorable Fabric Conditioner 33 Washes,Lenor Outdoorable Fabric Conditioner 33 Washes462ml,£3,£6.49 per litre,
Lenor Outdoorable Fabric Conditioner 33 Washes,Lenor Outdoorable Fabric Conditioner 33 Washes462ml,£3,£6.49 per litre,
Lenor Outdoorable Fabric Conditioner 55 Washes,Lenor Outdoorable Fabric Conditioner 55 Washes770ml,£3,£3.90 per litre,
Lenor Outdoorable Fabric Conditioner 55 Washes,Lenor Outdoorable Fabric Conditioner 55 Washes770ml,£3,£3.90 per litre,
Lenor Outdoorable Fabric Conditioner 55 Washes,Lenor Outdoorable Fabric Conditioner 55 Washes770ml,£3,£3.90 per litre,
Lenor Outdoorable Fabric Conditioner Moonlight Lily,Lenor Outdoorable Fabric Conditioner Moonlight Lily1064ml,£6.50,61.1p per 100ml,
Lenor Outdoorable Fabric Conditioner Tropical Sunset,Lenor Outdoorable Fabric Cond…1064ml,£6.50,61.1p per 100ml,
Lenor Outdoorable Fabric Conditioner x35,Lenor Outdoorable Fabric Conditioner x35490ml,£2.50,£5.10 per litre,"Offer price £2.50, was £4.50"
Lenor Outdoorable Fabric Conditioner x55,Lenor Outdoorable Fabric Conditioner x55770ml,£5.50,£7.14 per litre,
Lenor Outdoorable Fabric Conditioner x55,Lenor Outdoorable Fabric Conditioner x55770ml,£5.50,£7.14 per litre,
Lenor Ruby Jasmine Fabric Conditioner 30 Washes,Lenor Ruby Jasmine Fabric Conditioner 30 Washes1.05L,£3.25,£3.10 per litre,
Lenor Ruby Jasmine Fabric Conditioner 48 Washes   ,Lenor Ruby Jasmine Fabric Conditioner 48 Washes   1.68L,£3,£1.78 per litre,"Offer price £3, was £3.50"
Lenor Spring Awakening Fabric Conditioner 33 Washes ,Lenor Spring Awakening Fabric…1.155L,£2.25,£1.95 per litre,
Lenor Spring Awakening In-Wash Scent Booster ,Lenor Spring Awakening In-Wash Scent Booster 570g,£8,£14.04 per kg,
Lenor Spring Awakening In-Wash Scent Booster ,Lenor Spring Awakening In-Wash Scent Booster 320g,£5,£15.63 per kg,"Offer price £5, was £8"
Lenor Spring Awakening Tumble Dryer Sheets,Lenor Spring Awakening Tumble Dryer Sheets34 per pack,£2,5.9p each,"Offer price £2, was £3"
Lenor Summer Breeze Fabric Conditioner 33 Washes,Lenor Summer Breeze Fabric…1.155L,£2.25,£1.95 per litre,
Lenor Summer Breeze Fabric Conditioner 83 Washes,Lenor Summer Breeze Fabric…2.9L,£4.75,£1.64 per litre,
Lenor Summer Breeze In-Wash Scent Booster ,Lenor Summer Breeze In-Wash Scent Booster 320g,£5,£15.63 per kg,"Offer price £5, was £8"
Lenor Summer Breeze In-Wash Scent Booster ,Lenor Summer Breeze In-Wash Scent Booster 176g,£5,£28.41 per kg,
Lenor Summer Breeze Tumble Dryer Sheets,Lenor Summer Breeze Tumble Dryer Sheets34 per pack,£2,5.9p each,"Offer price £2, was £3"
Lenor Unstoppable Fresh In-Wash Scent Booster,Lenor Unstoppable Fresh In-Wash Scent Booster570g,£8,£14.04 per kg,
Lenor Unstoppables Beads Dreams In-Wash Scent Booster,Lenor Unstoppables Beads Drea…320g,£8,£25.00 per kg,
Lenor Unstoppables Beads Fresh In-Wash Scent Booster,Lenor Unstoppables Beads Fres…320g,£8,£25.00 per kg,
