name,Price Per Unit,Price Per Measure,Promotion
Morrisons Valentines Give A Little Love Hanging Heart Photo Frame,Morrisons Valentines Give A Little Lo…,£3.50,,
Morrisons Valentines Heart Keyring,Morrisons Valentines Heart Keyring,£2,,
Morrisons Valentines Medium Bear,Morrisons Valentines Medium Bear,£6,,
Morrisons Valentines Paper Love Tokens,Morrisons Valentines Paper Love Tokens,£1.50,,
Morrisons Valentines Truth Or Dare Scratch Cards,Morrisons Valentines Truth Or Dare Scratch Cards,£2.50,,
Morrisons White Daisy Bonnet Decorations,Morrisons White Daisy Bonnet Decorations,£1,,
Morrisons White Tablecover 120cm X 180cm,Morrisons White Table…,£3,,
Morrisons Window And Wall Clings,Morrisons Window And Wall Clings,£1,,
Morrisons Wooden Croquet Set,Morrisons Wooden Croquet Set,£6,,
Morrisons Wooden Happy Easter Sign,Morrisons Wooden Happy Easter Sign,£1.50,,
Morrisons Wooden Ringtoss,Morrisons Wooden Ringtoss,£10,,
Morrisons Wooden Silver Merry Christmas Garland,Morrisons Wooden Silver Merry Christmas Garland,£5,,
Morrisons Yellow Tissue Paper Pack,Morrisons Yellow Tissue Paper Pack,£1,,
Multi-Tool Set,Multi-Tool Set,£9,,
Multicoloured Round Balloons,Multicoloured Round Balloons10 per pack,£1.50,15p each,
Mumma Mia Mother's Day Card,Mumma Mia Mother's Day Card,£2.50,£2.50 each,
Munchkin Bubble Bestie Bubble Bath Toy 36M+,Munchkin Bubble Bestie Bubble Bath Toy 36M+,£6.50,,
Munchkin Colormix Fish Color Changing Bath Toy 12M+,Munchkin Colormix Fish Color…,£7.50,,
Musical Tractor & Trailer,Musical Tractor & Trailer,£15,,
My Design Portfolio Fashion Studio,My Design Portfolio Fashion Studio,£16.99,£16.99 each,
My First 123,My First 123,£4.99,£4.99 each,
My First ABC,My First ABC,£5.99,£5.99 each,
My First Gruffalo Little Library,My First Gruffalo Little Library,£6.99,£6.99 each,
"My First Mog Books Little Library, 12mths+ Book","My First Mog Books Little Library, 12mths+ Book",£5.99,£5.99 each,
My Lil Wardrobe 12 Inch,My Lil Wardrobe 12 Inch,£17.50,,
National Trust Speke Hall Blank Card,National Trust Speke Hall Blank Card,£2.50,£2.50 each,
New Baby Boy Card,New Baby Boy Card,£2.99,£2.99 each,
"New Baby Congratulations Card, Blue",New Baby Congratu…,£2.49,£2.49 each,
"New Baby Congratulations Card, Pink",New Baby Congratu…,£2.49,£2.49 each,
New Baby Greeting Card,New Baby Greeting Card,£3.50,£3.50 each,
New Home Card,New Home Card,£2,£2.00 each,
Nickelodeon Cra-Z-Compounds Set,Nickelodeon Cra-Z-Compounds Set,£10,,
Niece Flamingo Birthday Card,Niece Flamingo Birthday Card,£2.15,£2.15 each,
Nivea Men Sensitive XL Gift Set ,Nivea Men Sensitive XL Gift Set ,£8,,
 Number 0 Rainbow Birthday Candle, Number 0 Rainbow Birthday Candle,£1.15,£1.15 each,
 Number 1 Rainbow Birthday Candle, Number 1 Rainbow Birthday Candle,£1.15,£1.15 each,
Number 2 Rainbow Birthday Candle,Number 2 Rainbow Birthday Candle,£1.15,£1.15 each,
Number 4 Rainbow Birthday Candle,Number 4 Rainbow Birthday Candle,£1.15,£1.15 each,
 Number 5 Rainbow Birthday Candle, Number 5 Rainbow Birthday Candle,£1.15,£1.15 each,
 Number 6 Rainbow Birthday Candle, Number 6 Rainbow Birthday Candle,£1.15,£1.15 each,
Number 7 Rainbow Birthday Candle,Number 7 Rainbow Birthday Candle,£1.15,£1.15 each,
Number 8 Rainbow Birthday Candle,Number 8 Rainbow Birthday Candle,£1.15,£1.15 each,
 Number 9 Rainbow Birthday Candle, Number 9 Rainbow Birthday Candle,£1.15,£1.15 each,
Nutmeg Christmas Reindeer Jumper,Nutmeg Christmas Reindeer Jumper,£10,,
Nutmeg Family Of Boys Bodysuit New Born 022290,Nutmeg Family Of Boys Bod…,£5,,
Nutmeg Football Multi Pen,Nutmeg Football Multi Pen,£1.50,,
Nutmeg Girl's Blue Jersey Gingham Dress Size 3-4 Years,Nutmeg Girl's Blue Jersey Gingh…,£4,,
Nutmeg Girls Woven Black Skirt 3 - 4 Years ,Nutmeg Girls Woven Black Skirt 3 - 4 Years ,£4,,
Nutmeg Home Eucalyptus Napkins,Nutmeg Home Eucalyptus Napkins,£1.50,,
Nutmeg Home Eucalyptus Plates,Nutmeg Home Eucalyptus Plates,£1,,
Nutmeg Home Flamingo Napkins,Nutmeg Home Flamingo Napkins20 per pack,£1.75,8.8p each,
Nutmeg Home Floral Napkins,Nutmeg Home Floral Napkins,£1.50,,
Nutmeg Home Floral Plates,Nutmeg Home Floral Plates,£1.50,,
Nutmeg Home Neutral Marble Plates,Nutmeg Home Neutral Marble Plates8 per pack,£1.75,21.9p each,
Nutmeg Home Woodland Napkins,Nutmeg Home Woodland Napkins,£1.50,,
Nutmeg Reindeer Jumper 1-1.5 Years,Nutmeg Reindeer Jumper 1-1.5 Years,£10,,
One in Million Husband Birthday Card,One in Million Husband Birthday Card,£2.95,£2.95 each,
Orchard Toys Dino-Snore-Us,Orchard Toys Dino-Snore-Us,£11.45,£11.45 each,
"Orchard Toys Magic Maths, 5yrs+","Orchard Toys Magic Maths, 5yrs+",£13.80,£13.80 each,
"Orchard Toys Match & Spell, 4yrs+","Orchard Toys Match & Spell, 4yrs+",£8.60,£8.60 each,
"Orchard Toys Pirate Ship Jigsaw Puzzle, 5-9 year olds",Orchard Toys Pirate Ship Jigs…,£11.45,£11.45 each,
"Ottolenghi Test Kitchen Shelf Love, Random House",Ottolenghi Test Kitchen She…,£30.60,£30.60 each,
Panda Hugs Birthday Greeting Card,Panda Hugs Birthday Greeting Card,£2.70,£2.70 each,
Pandas Anniversary Card,Pandas Anniversary Card,£2.25,£2.25 each,
Papillon Birthday Card,Papillon Birthday Card,£2.15,£2.15 each,
Party Recyclable Paper Straws,Party Recyclable Paper Straws50 per pack,£3.75,7.5p each,
Party Time! Birthday Card,Party Time! Birthday Card,£1.95,£1.95 each,
Party Time Congratulations Card,Party Time Congratulations Card,£2.75,£2.75 each,
Pass the Pigs Dice Game,Pass the Pigs Dice Game,£10,£10.00 each,
Paw Patrol Bath Fizzers and Sticker,Paw Patrol Bath Fizzers and Sticker,£1.50,,
Paw Patrol Bubble Wand,Paw Patrol Bubble Wand,£1,,
Paw Patrol Dinosaur Rescue,Paw Patrol Dinosaur Rescue,£8.60,£8.60 each,
"Paw Patrol Meet The Pups Sticker Activity Book, Egmont Paperbacks",Paw Patrol Meet The Pups Sticker Acti…,£7.40,£7.40 each,
Paw Patrol Mini Memory Game,Paw Patrol Mini Memory Game,£6,£6.00 each,
Paw Patrol Party Pack,Paw Patrol Party Pack6 per pack,£7,£1.17 each,
Paw Patrol Toppeez Figures,Paw Patrol Toppeez Figures5 per pack,£5.50,£1.10 each,
Pepe Jeans London Gift Set ,Pepe Jeans London Gift Set 30ml,£29,£96.67 per 100ml,
Peppa Loves Doctors and Nurses,Peppa Loves Doctors and Nurses,£8,£8.00 each,
Peppa Loves Our Planet,Peppa Loves Our Planet,£8,£8.00 each,
Peppa Pig Bath Fizzers and Stickers,Peppa Pig Bath Fizzers and Stickers,£1.75,,
Peppa Pig Bubble Wand,Peppa Pig Bubble Wand,£1,,
Peppa Pig Little Library,Peppa Pig Little Library,£6,£6.00 each,
Peppa Pig Stampers,Peppa Pig Stampers5 per pack,£5.50,£1.10 each,
Peppa Pig Wooden Dominoes,Peppa Pig Wooden Dominoes,£7,,
"Peppas Countdown To Bedtime, Ladybird Books","Peppas Countdown To Bedtime, Ladybird Books",£8.60,£8.60 each,
Peter Rabbit My First Little Library,Peter Rabbit My First Little Library,£7,£7.00 each,
"Pinch of Nom Quick & Easy 100 Delicious, Slimming Recipes",Pinch of Nom Quick & Easy 100 Del…,£20,£20.00 each,
Pink Celebration Birthday Card,Pink Celebration Birthday Card,£2.60,£2.60 each,
Pink Flower Heart Birthday Card,Pink Flower Heart Birthday Card,£2.60,£2.60 each,
Pink Honeycomb Ball Garland 7ft,Pink Honeycomb Ball Garland 7ft,£2.99,£2.99 each,
Pink Layers of Joy Birthday Card,Pink Layers of Joy Birthday Card,£2.60,£2.60 each,
Pink Paper Cups 255ml,Pink Paper Cups 255ml8 per pack,£1.49,18.6p each,
Pink Paper Napkins,Pink Paper Napkins20 per pack,£1.25,6.3p each,
Pink Paper Plates 23cm,Pink Paper Plates 23cm8 per pack,£1.50,18.8p each,
"Pixar, 1001 Stickers","Pixar, 1001 Stickers",£5.99,£5.99 each,
"Play-Doh, Crunchin T Rex","Play-Doh, Crunchin T Rex",£21.80,£21.80 each,
Play-Doh Drill 'n Fill Dentist,Play-Doh Drill 'n Fill Dentist,£18.55,£18.55 each,
Play-Doh Peppa Pig Stylin Set,Play-Doh Peppa Pig Stylin Set,£14.55,£14.55 each,
Play Baby Gadget Trio,Play Baby Gadget Trio,£11.50,,
Play Doh 4 Pack Can,Play Doh 4 Pack Can,£4,,
Playgo 2 In 1 Piano & Xylophone,Playgo 2 In 1 Piano & Xylophone,£9.25,,
Playgo Carry Along Tool Kit,Playgo Carry Along Tool Kit,£10,,
Playgo Matchi Shape Bucket,Playgo Matchi Shape Bucket,£5,,
Play Go My Carry Along Medical Centre,Play Go My Carry Along Medical Centre,£10,,
Playgo Pet Vet Care Carrier And Plush Puppy,Playgo Pet Vet Care Carrier And Plush Puppy,£10,,
Playgo Press To Learn Laptop,Playgo Press To Learn Laptop,£11,,
Play Go Rocking Ring Stacker,Play Go Rocking Ring Stacker,£5,,
Playgo Steer And Learn Driver,Playgo Steer And Learn Driver,£14,,
Playmobil 70108 Dino Explorer Carry Case,Playmobil 70108 Dino Explorer Carry Case,£15,£15.00 each,
Playmobil City Action Rescue Ambulance,Playmobil City Action Rescue Ambulance,£34.99,,
Plop Trumps 2,Plop Trumps 2,£5.99,£5.99 each,
Police Original Eau De Toilette + Shower & Shampoo Gift Set ,Police Original Eau De Toilette + S…100ml,£30,£30.00 per 100ml,
POP DISNEY FROZEN 2 VINYL FIGURES,POP DISNEY FROZEN 2 VINYL FIGURES,£10,,
"Popper Pig Game, 4yrs+","Popper Pig Game, 4yrs+",£7.99,£7.99 each,
"Popper Unicorn Game, 4yrs+","Popper Unicorn Game, 4yrs+",£7.99,£7.99 each,
Powder Blue Honeycomb Ball Garland 7ft,Powder Blue Honeycomb Ball Garland 7ft,£2.99,£2.99 each,
"Powder Blue Paper Cup, 255ml","Powder Blue Paper Cup, 255ml8 per pack",£1.99,24.9p each,
Powder Blue Paper Plates 23cm,Powder Blue Paper Plates 23cm8 per pack,£1.50,18.8p each,
Princess Age 6 Birthday Card,Princess Age 6 Birthday Card,£2,£2.00 each,
Princess Girls Cuties Set,Princess Girls Cuties Set,£3,,
Princess Girls Princess Castle,Princess Girls Princess Castle,£17.50,,
"Pringle Mens Cushioned Sport Trainer Socks, Black, Size 7-11",Pringle Mens Cushioned Sport Traine…3 per pack,£13.99,£4.66 each,
"Pringle Mens Cushioned Sport Trainer Socks, White, Size 7-11",Pringle Mens Cushioned Sport Traine…3 per pack,£13.99,£4.66 each,
"Pringle Mens Plain Socks, Black, Size 7-11","Pringle Mens Plain Socks, Black, Size 7-113 per pack",£14.99,£5.00 each,
"Pringle Mens Sports Socks, Grey, Size 7-11","Pringle Mens Sports Socks, Grey, Size 7-113 per pack",£13.99,£4.66 each,
"Pringle Mens Sports Socks, White, Size 7-11","Pringle Mens Sports Socks, White, Size 7-113 per pack",£13.99,£4.66 each,
"Pringle Womens Half Cushioned Trainer Socks, White, Size 4-8",Pringle Womens Half Cushioned Train…3 per pack,£12.95,£4.32 each,
"Pringle Womens Invisible Liner Socks, White, Size 4-8",Pringle Womens Invisible Line…3 per pack,£11.99,£4.00 each,
"Pringle Womens Plain Socks, Black, Size 4-8","Pringle Womens Plain Socks, Black, Size 4-83 per pack",£12.99,£4.33 each,
"Pringle Womens Plain Socks, Grey, Size 4-8","Pringle Womens Plain Socks, Grey, Size 4-83 per pack",£12.99,£4.33 each,
Pump Rockets,Pump Rockets,£5.99,£5.99 each,
Quentin Blake Another Year Anniversary Card,Quentin Blake Another Year Anniversary Card,£2.49,£2.49 each,
Quentin Blake Birthday Boy Birthday Card,Quentin Blake Birthday Boy Birthday Card,£2,£2.00 each,
Quentin Blake Bunnies Anniversary Card,Quentin Blake Bunnies Anniversary Card,£2.25,£2.25 each,
Quentin Blake Cake Man Birthday Card,Quentin Blake Cake Man Birthday Card,£2.40,£2.40 each,
Quentin Blake Girl Painting Easter Cards,Quentin Blake Girl Painting Easter Cards5 per pack,£3.40,68p each,
Quentin Blake Hanging Around Birthday Greeting Card,Quentin Blake Hanging Around…,£2.60,£2.60 each,
Quentin Blake Lady in Bubble Birthday Greeting Card,Quentin Blake Lady in Bubble…,£2.60,£2.60 each,
Quentin Blake Magical Flight Birthday Greeting Card,Quentin Blake Magical Flight…,£2,£2.00 each,
Quentin Blake Retirement Card,Quentin Blake Retirement Card,£2.25,£2.25 each,
Quentin Blake Wedding Card,Quentin Blake Wedding Card,£2.79,£2.79 each,
Quentin Blake Wine Birthday Card,Quentin Blake Wine Birthday Card,£2.49,£2.49 each,
Rabbit with Chick Easter Cards,Rabbit with Chick Easter Cards5 per pack,£3.40,68p each,
Rainbow Champagne Birthday Card,Rainbow Champagne Birthday Card,£2.60,£2.60 each,
Rainbow Giraffe Birthday Card,Rainbow Giraffe Birthday Card,£2.50,£2.50 each,
Rainbow High Hair Chalks,Rainbow High Hair Chalks,£6,,
Rainbow Lion Birthday Card,Rainbow Lion Birthday Card,£2.50,£2.50 each,
Rainbow Lorikeets Kissing Card,Rainbow Lorikeets Kissing Card,£1.95,£1.95 each,
Rainbow Number 3 Birthday Candle,Rainbow Number 3 Birthday Candle,£1.15,£1.15 each,
Rainbow Polka Dot Flag Banner 12ft,Rainbow Polka Dot Flag Banner 12ft,£1.99,£1.99 each,
Rainbow Polka Dot Party Bags,Rainbow Polka Dot Party Bags8 per pack,£1.20,15p each,
Rainbow Polka Dot Party Hat,Rainbow Polka Dot Party Hat8 per pack,£1.99,24.9p each,
Rainbow Polka Dot Plate 18cm,Rainbow Polka Dot Plate 18cm8 per pack,£2.35,29.4p each,
Rainbow Polka Dot Plate 23cm,Rainbow Polka Dot Plate 23cm8 per pack,£1.99,24.9p each,
Rainbow Polka Dot Table Cover,Rainbow Polka Dot Table Cover,£2.49,£2.49 each,
"Ravensburger Disney Princess, Princess Adventure 3x 49 piece Jigsaw Puzzles","Ravensburger Disney Princess, P…",£6.25,£6.25 each,
Ravensburger Harry Potter 1000 piece Jigsaw Puzzle,Ravensburger Harry Potter 1…,£14.10,£14.10 each,
"Ravensburger Marvel Avengers Assemble, 3x 49 piece Jigsaw Puzzles",Ravensburger Marvel Avengers Assemble…,£6.25,£6.25 each,
Red & White Recyclable Paper Straws,Red & White Recyclable Paper Straws25 per pack,£2,8p each,
"Red Paper Cups, 500ml","Red Paper Cups, 500ml10 per pack",£2.85,28.5p each,
Revolution Floral Mini Scented Candle Trio Gift Set,Revolution Floral Mini Scente…,£20,,
Revolution Hydration Station Skin Revival Gift Set,Revolution Hydration Statio…,£30,,
Revolution X Friends Makeup Kit Gift Set ,Revolution X Friends Makeup Kit Gift Set ,£30,,
Rex London Fairies In the Garden Temporary Tattoos ,Rex London Fairies In the Gar…2 per pack,£3,£1.50 each,
Rex London Space Age Umbrella,Rex London Space Age Umbrella,£8.95,£8.95 each,
Rick Stein's Secret France,Rick Stein's Secret France,£28,£28.00 each,
RMS Rainbow Box Of Craft,RMS Rainbow Box Of Craft,£6,,
 Roald Dahl's Marvellous Joke Book, Roald Dahl's Marvellous Joke Book,£6,£6.00 each,
Roald Dahl Whizzpopping Joke Book ,Roald Dahl Whizzpopping Joke Book ,£7,£7.00 each,
Rock Those Birthday Socks Card,Rock Those Birthday Socks Card,£2.35,£2.35 each,
"Room On The Broom, Pan MacMillan Childrens","Room On The Broom, Pan MacMillan Childrens",£8.45,£8.45 each,
RSPB Kingfisher Blank Card,RSPB Kingfisher Blank Card,£2.50,£2.50 each,
RSPBNK European Bee-Eaters Card Pack,RSPBNK European Bee-Eaters Card Pack8 per pack,£5.85,73.1p each,
RSPB Robin Blank Card,RSPB Robin Blank Card,£2.50,£2.50 each,
Rubik's Cube,Rubik's Cube,£10,,
Ryan's World Island Adventures Micro Mystery Figure,Ryan's World Island Adventure…,£2.25,,"Offer price £2.25, was £3"
Ryan's World Mystery Squishy Figure,Ryan's World Mystery Squishy Figure,£4,,
Sanderson Thinking of You Sympathy Card,Sanderson Thinking of You Sympathy Card,£2.90,£2.90 each,
Sanderson Wisteria Falls Notecard Pack,Sanderson Wisteria Falls Notecard Pack8 per pack,£5.85,73.1p each,
Sass & Belle Grey String Shopper Bag,Sass & Belle Grey String Shopper Bag,£5,£5.00 each,
Scratch Box Wild Animals,Scratch Box Wild Animals,£10.99,£10.99 each,
Set Of 3 Mini Vehicles,Set Of 3 Mini Vehicles,£6,,
Sherbert Lemon Hoppy Hop Hop,Sherbert Lemon Hoppy Hop Hop,£2.50,£2.50 each,
Shimmer & Sparkle Instaglam Beauty Make-Up Purse,Shimmer & Sparkle Instaglam…,£13,,
Silver Paper Napkins,Silver Paper Napkins20 per pack,£1.99,10p each,
Silvine A4+ Twin Wire Sketch Pad,Silvine A4+ Twin Wire Sketch Pad,£2.99,£2.99 each,
Simba Big Dino Set 10Pc,Simba Big Dino Set 10Pc,£10,,
Sissinghurst Castle Garden Blank Card,Sissinghurst Castle Garden Blank Card,£2.50,£2.50 each,
Smartest Giant in Town,Smartest Giant in Town,£8.45,£8.45 each,
Smashers Light Up Dino Egg,Smashers Light Up Dino Egg,£29,,
Son Birthday Card,Son Birthday Card,£2.49,£2.49 each,
Sorry For You Loss Sympathy Card,Sorry For You Loss Sympathy Card,£1.99,£1.99 each,
Sorry For Your Loss Sympathy Card,Sorry For Your Loss Sympathy Card,£2,£2.00 each,
Spa Dog Birthday Greeting Card,Spa Dog Birthday Greeting Card,£2.70,£2.70 each,
Spider-Man Mini Memory Game,Spider-Man Mini Memory Game,£6,£6.00 each,
Spider Man Age 4 Birthday Card,Spider Man Age 4 Birthday Card,£2.49,£2.49 each,
Spider Man Age 5 Birthday Card,Spider Man Age 5 Birthday Card,£2.49,£2.49 each,
Spider Man Age 6 Birthday Card,Spider Man Age 6 Birthday Card,£2.49,£2.49 each,
Spinmaster Kinetic Sand Figure Rainbow Mix Set,Spinmaster Kinetic Sand Figure Rainbow Mix Set,£7.50,,"Offer price £7.50, was £10"
"Spotty Sausage Dogs, 4yrs+","Spotty Sausage Dogs, 4yrs+",£9.20,£9.20 each,
Spring Flowers Cards,Spring Flowers Cards4 per pack,£2.50,62.5p each,
Spring Flower Wreath Easter Card,Spring Flower Wreath Easter Card,£2,£2.00 each,
Squeeze n Brush No Mess Paints 12 Classic Colours 3+,Squeeze n Brush No Mess Paint…,£8,£8.00 each,
Star Wars The Mandalorian Child Plush,Star Wars The Mandalorian Child Plush,£10,,
Status Cable Free Battery Operated Door Chime White,Status Cable Free Battery Ope…,£10,,
Status Carbon Monoxide Alarm,Status Carbon Monoxide Alarm,£19,,
Stop! Birthday Card,Stop! Birthday Card,£2,£2.00 each,
St. Patricks Day Oversized Hat,St. Patricks Day Oversized Hat,£8,£8.00 each,
Supertato,Supertato,£8.45,£8.45 each,
Superworm,Superworm,£8.45,£8.45 each,
" Sweet Roasting Tin, Random House"," Sweet Roasting Tin, Random House",£23.30,£23.30 each,
Table Fun Easter Gingham Fabric Bunting,Table Fun Easter Gingham Fabric Bunting,£2.50,,
Talking Tables Metallic Cups,Talking Tables Metallic Cups8 per pack,£1.50,18.8p each,
Talking Tables Silver Metallic Dot Plates,Talking Tables Silver Metallic Dot Plates8 per pack,£2,25p each,
Teamsterz Micro Motorz,Teamsterz Micro Motorz,£5,,
Thank You For Being My Teacher Card,Thank You For Being My Teacher Card,£2,£2.00 each,
That's Not My Dinosaur,That's Not My Dinosaur,£7,£7.00 each,
That's Not My Puppy,That's Not My Puppy,£7,£7.00 each,
That's Not My Unicorn,That's Not My Unicorn,£7,£7.00 each,
The Beginner's Guide to Intermittent Keto,The Beginner's Guide to Intermittent Keto,£10,£10.00 each,
"The Best Ever Baking Book, Dorling Kindersley","The Best Ever Baking Book, Dorling Kindersley",£12.30,£12.30 each,
The Dinosaur that Pooped a Pirate,The Dinosaur that Pooped a Pirate,£8,£8.00 each,
"The Flying Bath, By Julia Donaldson ","The Flying Bath, By Julia Donaldson ",£8,£8.00 each,
The Gruffalo,The Gruffalo,£7.99,£7.99 each,
The Hummingbird Bakery Cookbook,The Hummingbird Bakery Cookbook,£20,£20.00 each,
The Hungry Caterpillar Candles 3rd Birthday Greeting Card,The Hungry Caterpillar Candles 3r…,£2.25,£2.25 each,
"The Joy Of Baking, Quercus Hardbacks","The Joy Of Baking, Quercus Hardbacks",£18.40,£18.40 each,
"The Kitchen Cabinet, Random House","The Kitchen Cabinet, Random House",£20.80,£20.80 each,
The Little Book of Self-Care for New Mums,The Little Book of Self-Care for New Mums,£15,£15.00 each,
The Mindfulness Colouring Book Anti-Stress Art Therapy For Busy People Book,The Mindfulness Colouring Book…,£9,£9.00 each,
"The National Trust Book Of Baking, Pavilion,","The National Trust Book Of Baking, Pavilion,",£20.80,£20.80 each,
"The Pastry Chefs Guide, Pavilion ","The Pastry Chefs Guide, Pavilion ",£23.30,£23.30 each,
The Seedlip Cocktail Book,The Seedlip Cocktail Book,£16,£16.00 each,
The Very Embarrassing Book of Dad Jokes,The Very Embarrassing Book of Dad Jokes,£12,£12.00 each,
Tiger Who Came To Tea Book,Tiger Who Came To Tea Book,£7.99,£7.99 each,
Together - Jamie Oliver,Together - Jamie Oliver,£31.25,£31.25 each,
Tomy Active Snap!,Tomy Active Snap!,£5.30,£5.30 each,
Tomy Aquadoodle Colour Doodle Bag,Tomy Aquadoodle Colour Doodle Bag,£15,£15.00 each,
Tomy Classic Colour Aquadoodle Mat,Tomy Classic Colour Aquadoodle Mat,£20,£20.00 each,
Tomy Toomies Hide & Squeak Egg & Spoon Set,Tomy Toomies Hide & Squeak Egg & Spoon Set,£10.50,£10.50 each,
Tomy Toomies Hide & Squeak Eggs,Tomy Toomies Hide & Squeak Eggs,£10,,
TOMY Toomies Hide & Squeak Eggs Stackers,TOMY Toomies Hide & Squeak Eggs Stackers,£13.55,£13.55 each,
"Tomy Toomies Hide n Squeak Eggs, 6mths+","Tomy Toomies Hide n Squeak Eggs, 6mths+",£10,£10.00 each,
Tomy Toomies Jurassic World Spin & Hatch Dino Eggs,Tomy Toomies Jurassic World…,£11.25,,"Offer price £11.25, was £15"
"TOMY Toomies Octopals Bath Squirters, 12mths+","TOMY Toomies Octopals Bath Squirters, 12mths+",£16.99,£16.99 each,
Treasure X Dino Gold Mini Dinos Single Pack,Treasure X Dino Gold Mini Dinos Single Pack,£3.75,,"Offer price £3.75, was £5"
TSL Face Masks,TSL Face Masks10 per pack,£5,50p each,
Twist Slime Starter,Twist Slime Starter,£1.50,£1.50 each,
Unicorn Gift Wrap Sheets & Tags,Unicorn Gift Wrap Sheets & Tags2 per pack,£3,£1.50 each,
"Unique Party 12"" Glitzy Birthday Balloons with Confetti","Unique Party 12"" Glitzy Birthda…6 per pack",£2.50,41.7p each,
Unique Party Assorted Birthday Candles and holders,Unique Party Assorted Birth…18 per pack,£1.20,6.7p each,
Unique Party Gold Happy Birthday Balloon Letter Banner kit,Unique Party Gold Happy Birthday…,£7.99,£7.99 each,
Unique Party Gold Star Birthday Candles,Unique Party Gold Star Birthday Candles6 per pack,£2.50,41.7p each,
Unique Party Happy Birthday Silver Deluxe Jointed Banner,Unique Party Happy Birthday Sil…,£1.75,£1.75 each,
Unique Party Multi Colour Glitter Birthday Candles,Unique Party Multi Colour Glitter Birthday Candles12 per pack,£1,8.3p each,
Unique Party Multi colour Honeycomb Ball Garland,Unique Party Multi colour Honeycomb Ball Garland,£2.99,£2.99 each,
Unique Party Silver Happy Birthday Balloon Banner kit,Unique Party Silver Happy Bir…,£8,£8.00 each,
Uno Card Game,Uno Card Game,£8,,
Very Hungry Caterpillar Mini Board Book,Very Hungry Caterpillar Mini Board Book,£8.45,£8.45 each,
Volcano Making Kit 8+,Volcano Making Kit 8+,£14.95,£14.95 each,
Wahaca Mexican Food To Cook At Home,Wahaca Mexican Food To Cook At Home,£28.20,£28.20 each,
Watercolour Easter Eggs Lunch Napkins,Watercolour Easter Eggs Lunch Napkins16 per pack,£3.50,21.9p each,
Wedding Greeting Card,Wedding Greeting Card,£3.50,£3.50 each,
Welcome to the World Book,Welcome to the World Book,£8.99,£8.99 each,
Well Done You! Congratulations Card,Well Done You! Congratulations Card,£2.60,£2.60 each,
We're Going On A Bear Hunt,We're Going On A Bear Hunt,£7.99,£7.99 each,
Westland Gro - Sure Multi - Purpose Lawn Seed,Westland Gro - Sure Multi - Purpose Lawn Seed,£5.50,,
"Wheres the Unicorn, A Magical Search-and-Find Book","Wheres the Unicorn, A Magic…",£7.99,£7.99 each,
White Dunicel Table Cover 118x180cm ,White Dunicel Table Cover 118x180cm ,£3.50,£3.50 each,
"White Dunisoft Paper Napkins, Large","White Dunisoft Paper Napkins, Large20 per pack",£3.50,17.5p each,
Wicked Mega Jump Single Skipping Rope,Wicked Mega Jump Single Skipping Rope,£5,,
Wicked Sky Rider Pro Flying Disc,Wicked Sky Rider Pro Flying Disc,£5,,
Wisteria Sympathy Card,Wisteria Sympathy Card,£2.50,£2.50 each,
Wonderful Nan Floral Birthday Card,Wonderful Nan Floral Birthday Card,£2.25,£2.25 each,
Wooden Unicorn and Dragon Spinning Top,Wooden Unicorn and Dragon Spinning Top,£1.50,£1.50 each,
World Football Stars Top Trumps Quiz Card Game,World Football Stars Top Trumps Quiz Card Game,£11,£11.00 each,
X-Shot Excel Micro Blaster,X-Shot Excel Micro Blaster,£3,,"Offer price £3, was £4"
X Shot Dino Attack Extinct,X Shot Dino Attack Extinct,£6,,
YOLO! 40th Birthday Card,YOLO! 40th Birthday Card,£2.50,£2.50 each,
YOLO! 50th Birthday Card,YOLO! 50th Birthday Card,£2.50,£2.50 each,
YOLO! 60th Birthday Card,YOLO! 60th Birthday Card,£2.50,£2.50 each,
YOLO! 70th Birthday Card,YOLO! 70th Birthday Card,£2.50,£2.50 each,
Zuru 5 Surprise Volcano Dino Strike,Zuru 5 Surprise Volcano Dino Strike,£3.75,,"Offer price £3.75, was £5"
Zuru Bunch Balloons ,Zuru Bunch Balloons 3 per pack,£9,£3.00 each,
Zuru Dino Action T-Rex,Zuru Dino Action T-Rex,£10,,
Zuru Disney Store Mini Brands,Zuru Disney Store Mini Brands,£8.50,,
Zuru Foodie Mini Brands,Zuru Foodie Mini Brands,£8.50,,
Zuru Max Build More Constuction Bricks,Zuru Max Build More Constuction Bricks,£5,,
Zuru Oosh Crackle Foam,Zuru Oosh Crackle Foam,£2.50,,
Zuru Oosh Potions,Zuru Oosh Potions,£10,,
Zuru Oosh Putty,Zuru Oosh Putty,£4,,
Zuru Oosh Sand,Zuru Oosh Sand,£5,,
Zuru Oosh Slime,Zuru Oosh Slime,£2,,
Zuru Pet Rescue Toy,Zuru Pet Rescue Toy,£6.50,,
Zuru Rainbocorns Kittycorn Surprise,Zuru Rainbocorns Kittycorn Surprise,£10,,
Zuru Robo Alive Raptor,Zuru Robo Alive Raptor,£10,,
Zuru Robotic Baby Shark,Zuru Robotic Baby Shark,£13,,
Zuru Toy Mini Brands Capsule,Zuru Toy Mini Brands Capsule,£8,,
Zuru X Shot Excel 36Pk,Zuru X Shot Excel 36Pk,£3,,"Offer price £3, was £4"
