name,Price Per Unit,Price Per Measure,Promotion
Ella's Kitchen Organic Pear and Peach Baby Rice Baby Pouch 4+ Months,Ella's Kitchen Or…120g,£1.30,£1.08 per 100g,Buy 5 for £6
Ella'S Kitchen Raspberry + Mango Puff Pops ,Ella'S Kitchen…4 x 9g,£2.25,£6.25 per 100g,
Ella's Kitchen Organic Cheese and Apple Melty Sticks Baby Snack 7+ Months,Ella's Kitchen…16g,£1.20,75p per 10g,
"12"" Pearl Assorted Balloons","12"" Pearl Assorted Balloons8 per pack",£1.99,24.9p each,
 18th Balloons Birthday Card, 18th Balloons Birthday Card,£2.25,£2.25 each,
18th Birthday Card,18th Birthday Card,£2.15,£2.15 each,
18th Birthday Card,18th Birthday Card,£1.99,£1.99 each,
40th Birthday Card,40th Birthday Card,£1.95,£1.95 each,
40th Birthday Card,40th Birthday Card,£1.99,£1.99 each,
50th Birthday Card,50th Birthday Card,£1.95,£1.95 each,
50th Birthday Card,50th Birthday Card,£1.99,£1.99 each,
60th Birthday Card,60th Birthday Card,£1.99,£1.99 each,
Abacus 18th Birthday Card,Abacus 18th Birthday Card,£2.90,£2.90 each,
Abacus 1St Birthday - Cute Koala Card,Abacus 1St Birthday - Cute Koala Card,£2,£2.00 each,
Abacus 1st Birthday Elephant Card,Abacus 1st Birthday Elephant Card,£2,£2.00 each,
Abacus 2nd Birthday - Cheeky Monkeys Card,Abacus 2nd Birthday - Cheeky Monkeys Card,£2,£2.00 each,
Abacus 2nd Birthday - Magical Unicorn Card ,Abacus 2nd Birthday - Magical Unicorn Card ,£2,£2.00 each,
Abacus 30th Birthday Card,Abacus 30th Birthday Card,£2.90,£2.90 each,
Abacus 3rd Birthday - Fab Flamingo Card,Abacus 3rd Birthday - Fab Flamingo Card,£2,£2.00 each,
Abacus 3rd Birthday - Zebra Party Card,Abacus 3rd Birthday - Zebra Party Card,£2,£2.00 each,
Abacus 40th Birthday Card,Abacus 40th Birthday Card,£2.90,£2.90 each,
Abacus 50th Birthday Card,Abacus 50th Birthday Card,£2.90,£2.90 each,
Abacus 70th Birthday Card,Abacus 70th Birthday Card,£2.90,£2.90 each,
Abacus 80th Birthday Card,Abacus 80th Birthday Card,£2.90,£2.90 each,
Abacus 90th Birthday Card,Abacus 90th Birthday Card,£2.90,£2.90 each,
Abacus Ahoy There! Birthday Card,Abacus Ahoy There! Birthday Card,£2.25,£2.25 each,
Abacus Birthday Express Card,Abacus Birthday Express Card,£2.25,£2.25 each,
Abacus Girls Birthday Card - Dino,Abacus Girls Birthday Card - Dino,£2,£2.00 each,
Abacus Girls Birthday Card - Sloth,Abacus Girls Birthday Card - Sloth,£2,£2.00 each,
Abacus Granddaughter Cake Birthday Card,Abacus Granddaughter Cake Birthday Card,£2.50,£2.50 each,
Abacus Hearts Gift Wrap (Plastic Free Packaging),Abacus Hearts Gift Wrap (Plastic Free Packaging)2 per pack,£2,£1.00 each,
Abacus Llama Birthday Card,Abacus Llama Birthday Card,£2.25,£2.25 each,
Abacus Peonies & Pushbike Birthday Card,Abacus Peonies & Pushbike Birthday Card,£2,£2.00 each,
Abacus Peonies & Roses Birthday Card,Abacus Peonies & Roses Birthday Card,£2,£2.00 each,
Abacus Rainbow Stripe Gift Wrap (Plastic Free Packaging),Abacus Rainbow Stripe Gift Wrap…2 per pack,£2,£1.00 each,
Abacus Space Rocket Birthday Card,Abacus Space Rocket Birthday Card,£2.25,£2.25 each,
Abacus Thank You Lion & Dinosaur Notecard Pack,Abacus Thank You Lion & Dinosaur Notecard Pack2 x 4 per pack,£3.35,41.9p each,
Abacus Thank you Llama & Unicorn Notecard Pack,Abacus Thank you Llama & Unicorn Notecard Pack2 x 4 per pack,£3.35,41.9p each,
"Ambi Toys Pop Up Pals, 18mths+","Ambi Toys Pop Up Pals, 18mths+",£20,£20.00 each,
Anniversary Hearts Card,Anniversary Hearts Card,£2.15,£2.15 each,
Aquabeads Easy Starter Set 31999,Aquabeads Easy Starter Set 31999,£10,,
Astro Venture Space Capsule,Astro Venture Space Capsule,£7.50,,"Offer price £7.50, was £10"
Astro Venture Space Rover,Astro Venture Space Rover,£9,,"Offer price £9, was £12"
Astro Venture Space Shuttle,Astro Venture Space Shuttle,£15,,
A Superhero Like You,A Superhero Like You,£8,£8.00 each,
Avengers 4th Birthday Card,Avengers 4th Birthday Card,£2,£2.00 each,
Avengers 5th Birthday Card,Avengers 5th Birthday Card,£2.50,£2.50 each,
Avengers 6th Birthday Card,Avengers 6th Birthday Card,£2.50,£2.50 each,
Avenir Activity Book Dress Up Fun,Avenir Activity Book Dress Up Fun,£10.15,£10.15 each,
Avenir Activity Book Magical Water Painting,Avenir Activity Book Magical Water Painting4 per pack,£10.15,£2.54 each,
Avenir Loopie Fun Bunny Bag,Avenir Loopie Fun Bunny Bag,£14.70,£14.70 each,
Avenir Scratch Dragon,Avenir Scratch Dragon,£4.25,£4.25 each,
Avenir Sewing Doll Llama,Avenir Sewing Doll Llama,£13.99,£13.99 each,
Avenir Sewing Doll Unicorn,Avenir Sewing Doll Unicorn,£13.99,£13.99 each,
Avo Party Birthday Greeting Card,Avo Party Birthday Greeting Card,£2.70,£2.70 each,
Baby Inflatable Pool 1yrs+ ,Baby Inflatable Pool 1yrs+ ,£19,£19.00 each,
Balloon Pump ,Balloon Pump ,£3,£3.00 each,
Balloons Paper Table Cover 120cm,Balloons Paper Table Cover 120cm,£3,£3.00 each,
Baylis & Harding Signature Collection Mini Stack Gift Set ,Baylis & Harding Signature Collec…,£12,,
Baylis & Harding Wild Fig & Pomegranate Wash Bag,Baylis & Harding Wild Fig & Pomegranate Wash Bag,£30,,
Bean & Avocado Popper,Bean & Avocado Popper,£4,,
Bedtime Stories For Stressed Out Adults,Bedtime Stories For Stressed Out Adults,£18,£18.00 each,
Big Hugs Bunnies Blank Card,Big Hugs Bunnies Blank Card,£2,£2.00 each,
"Big Mamma Cucina Popolare, Contemporary Italian Recipes","Big Mamma Cucina Popolare, Cont…",£28.95,£28.95 each,
Bio Kraft  Recyclable Paper Straws,Bio Kraft  Recyclable Paper Straws20 per pack,£2,10p each,
"Birthday Banner, Blue, 12ft","Birthday Banner, Blue, 12ft",£1.75,£1.75 each,
Birthday Candles In Holders,Birthday Candles In Holders12 per pack,£1.20,10p each,
Birthday Dots Paper Napkin,Birthday Dots Paper Napkin16 per pack,£1.75,10.9p each,
Birthday Drinks Card,Birthday Drinks Card,£2.35,£2.35 each,
Birthday Monsters Gift Wrap Sheets & Tags (Plastic Free),Birthday Monsters Gift Wrap She…2 per pack,£2.50,£1.25 each,
Birthday Tweetings Card,Birthday Tweetings Card,£1.95,£1.95 each,
Bisto Best Beef Gravy Granules,Bisto Best Beef Gravy Granules230g,£3,£1.30 per 100g,
Bisto Best Pork Gravy Granules,Bisto Best Pork Gravy Granules230g,£3,£1.30 per 100g,
Blue Bio Paper Napkins,Blue Bio Paper Napkins20 per pack,£1.75,8.8p each,
Bluey & Family 4 Figure Pack,Bluey & Family 4 Figure Pack4 per pack,£15,£3.75 each,
Bluey Ice Cream Cart & Figure,Bluey Ice Cream Cart & Figure,£11.25,,"Offer price £11.25, was £15"
Bluey Wooden Memory Game,Bluey Wooden Memory Game,£7,,
Bluey Wooden YoYo,Bluey Wooden YoYo,£3,,
Bonnie The Bunny Kids Umbrella,Bonnie The Bunny Kids Umbrella,£12.30,£12.30 each,
"Book Of Funny Stories, Puffin ","Book Of Funny Stories, Puffin ",£9.80,£9.80 each,
"Book of Modern Speeches, Paperback","Book of Modern Speeches, Paperback",£17,£17.00 each,
Boys Nutmeg Christmas All Over Print Polo 1-1.5 Years,Boys Nutmeg Christmas All Ove…,£7,,
Bright & Beautiful Floral Blank Card,Bright & Beautiful Floral Blank Card,£1.85,£1.85 each,
Bright Easter Egg Oval Plastic Tray,Bright Easter Egg Oval Plastic Tray,£5.35,£5.35 each,
"Brown Bio Bagasse Cups, 240ml","Brown Bio Bagasse Cups, 240ml10 per pack",£2,20p each,
"Bubble Bottle, 1 per pack","Bubble Bottle, 1 per pack",£2,£2.00 each,
Bunnies Happy Anniversary Card,Bunnies Happy Anniversary Card,£2.50,£2.50 each,
Casdon Dyson Ball Vacuum Cleaner,Casdon Dyson Ball Vacuum Cleaner,£20.99,,
Casdon Play Cash,Casdon Play Cash,£2,,
Casdon Supermarket Till,Casdon Supermarket Till,£20,,
Champagne Anniversary Card,Champagne Anniversary Card,£2.50,£2.50 each,
Church with Daffodils Easter Cards,Church with Daffodils Easter Cards5 per pack,£3.40,68p each,
Classic Waddingtons Number 1 Playing Cards,Classic Waddingtons Number 1 Playing Cards,£2.50,£2.50 each,
Club Green God Save The King Banner,Club Green God Save The King Banner2m,£2.50,£1.25 per 1m,
Club Green Gold Crown Garland,Club Green Gold Crown Garland2.5m,£2.50,£1.00 per 1m,
Club Green King Charles Flag Bunting,Club Green King Charles Flag Bunting3m,£2.50,83.3p per 1m,
Club Green King Charles Flags,Club Green King Charles Flags6 per pack,£2,33.3p each,
Club Green Royally British Balloon Bundle 12 Pack,Club Green Royally British Balloon Bundle 12 Pack12 per pack,£4,33.3p each,
Club Green Union Jack Flags,Club Green Union Jack Flags6 per pack,£2,33.3p each,
Club Green Union Jack Party Hats,Club Green Union Jack Party Hats10 per pack,£3,30p each,
"Cocktail Dictionary, Octopus Publishing Group","Cocktail Dictionary, Octopus Publishing Group",£19.60,£19.60 each,
 Colour Flame Birthday Candles With Holders, Colour Flame Birthday Candles With Holders10 per pack,£2.49,24.9p each,
Colourful Gingham Easter Hanging Swirl,Colourful Gingham Easter Hanging Swirl3 per pack,£2,66.7p each,
"Comfort MOB, Hodder & Stoughton","Comfort MOB, Hodder & Stoughton",£23.30,£23.30 each,
Copper Holo Bottle Bag,Copper Holo Bottle Bag,£2.50,£2.50 each,
Crayola 10 Washable Kid's Paint,Crayola 10 Washable Kid's Paint,£9.50,£9.50 each,
Crayola 12 Anti Dust Coloured Chalk,Crayola 12 Anti Dust Coloured Chalk,£2,£2.00 each,
"Crayola 24 Supertips, 4yrs+","Crayola 24 Supertips, 4yrs+",£8.60,£8.60 each,
"Crayola 24 Twistable Crayons, 3yrs+","Crayola 24 Twistable Crayons, 3yrs+24 per pack",£8,33.3p each,
Crayola 9 Washable Glitter Glue,Crayola 9 Washable Glitter Glue,£5.65,£5.65 each,
Crayola Colours of the World Washable Markers,Crayola Colours of the World Washable Markers,£13,£13.00 each,
Crayola Crayons,Crayola Crayons24 per pack,£2.50,10.4p each,
Crayola Washable Kids Paint 18 Pack,Crayola Washable Kids Paint 18 Pack,£6,£6.00 each,
Cream Compostable Paper Napkins,Cream Compostable Paper Napkins125 per pack,£3.50,2.8p each,
Cream Compostable Paper Napkins,Cream Compostable Paper Napkins50 per pack,£2,4p each,
Curious Universe Mess Free Magic Painting Wild Animals,Curious Universe Mess Free Magi…,£4,,
"Cute Money Wallet Card, Pack of 4","Cute Money Wallet Card, Pack of 4",£1.50,£1.50 each,
Dad Birthday Card,Dad Birthday Card,£2.95,£2.95 each,
Dad Birthday Card,Dad Birthday Card,£2.50,£2.50 each,
Dandelion Breeze Sympathy Card,Dandelion Breeze Sympathy Card,£2.50,£2.50 each,
Dark Blue Dunicel Table Cover 118x180cm,Dark Blue Dunicel Table Cover 118x180cm,£3.50,£3.50 each,
Daughter Birthday Card,Daughter Birthday Card,£2.15,£2.15 each,
Dear Dad Memory Journal of a Lifetime Book,Dear Dad Memory Journal of a Lifetime Book,£12.99,£12.99 each,
Dear Grandad Memory Journal of a Lifetime Book,Dear Grandad Memory Journal of a Lifetime Book,£12.99,£12.99 each,
Dear Grandma Memory Journal of a Lifetime,Dear Grandma Memory Journal of a Lifetime,£12.99,£12.99 each,
Dear Mum Memory Journal of a Lifetime,Dear Mum Memory Journal of a Lifetime,£12.99,£12.99 each,
Dear Zoo- 40th Anniversary Edition,Dear Zoo- 40th Anniversary Edition,£8.45,£8.45 each,
Death by Burrito Cook Book,Death by Burrito Cook Book,£21.90,£21.90 each,
Decorative Easter Eggs Cards,Decorative Easter Eggs Cards4 per pack,£2.50,62.5p each,
Dickie Toys RC Tumbling Flippy Vehicle,Dickie Toys RC Tumbling Flippy Vehicle,£18,,
Dinosaur Birthday Card,Dinosaur Birthday Card,£1.25,£1.25 each,
Dinosaur Birthday Card,Dinosaur Birthday Card,£2.50,£2.50 each,
Dinosaurs Top Trumps Classics Card Game,Dinosaurs Top Trumps Classics Card Game,£6,£6.00 each,
"Disney Frozen, 1001 Stickers","Disney Frozen, 1001 Stickers",£5.99,£5.99 each,
Disney Frozen 2 Mini Memory Game,Disney Frozen 2 Mini Memory Game,£6,£6.00 each,
Disney Frozen 4th Birthday Card,Disney Frozen 4th Birthday Card,£3,£3.00 each,
Disney Frozen 5th Birthday Card,Disney Frozen 5th Birthday Card,£2.50,£2.50 each,
"Disney Pixar 500 Stickers, Activity book","Disney Pixar 500 Stickers, Activity book",£3.99,£3.99 each,
Disney Princess 4th Birthday Card,Disney Princess 4th Birthday Card,£2.50,£2.50 each,
Disney Princess Wrapping Paper,Disney Princess Wrapping Paper,£2,£2.00 each,
Dobble Card Game,Dobble Card Game,£12,,
"Dots Recyclable Paper Plates, 22cm ","Dots Recyclable Paper Plates, 22cm 10 per pack",£2.50,25p each,
Dragon 3D Pinata,Dragon 3D Pinata,£12.99,£12.99 each,
Dr. Oetker 18 Party Candles,Dr. Oetker 18 Party Candles,£1.55,,
Dr. Oetker 6 Celebration Candles,Dr. Oetker 6 Celebration Candles,£1.99,,
Drumond Park The Logo Board Game,Drumond Park The Logo Board Game,£8,,
"Duni Bagasse Plates, 18cm ","Duni Bagasse Plates, 18cm 10 per pack",£2.50,25p each,
Duni Bio Pastel Recyclable Paper Straws,Duni Bio Pastel Recyclable Paper Straws25 per pack,£3.75,15p each,
"Dunisilk Table Cover, Cream, 138x200cm","Dunisilk Table Cover, Cream, 138x200cm",£4,£4.00 each,
"Dunisilk Table Cover, White, 138x220cm","Dunisilk Table Cover, White, 138x220cm",£4,£4.00 each,
Duracell Alkaline Button LR44 Batteries 1.5V (76A / A76 / V13GA),Duracell Alkaline Button LR44 Batteri…2 per pack,£4.50,£2.25 each,
Duracell Alkaline Button LR44 Batteries 1.5V (76A / A76 / V13GA),Duracell Alkaline Button LR44 Batteri…4 per pack,£8,£2.00 each,
Duracell Alkaline MN21 Batteries 12V (A23 / 23A / V23GA),Duracell Alkaline MN21 Batterie…2 per pack,£5,£2.50 each,
Duracell Alkaline N Batteries 1.5V (E90 / LR1),Duracell Alkaline N Batteries 1.5V (E90 / LR1)2 per pack,£5,£2.50 each,
Duracell Battery Charger Charges In 45 Min With 2 AA And 2 AAA Batteries ,Duracell Battery Charger Charges In 45 Min…,£30,,
Duracell Battery Charger Charges In 4 Hours With 2 AA And 2 AAA Batteries ,Duracell Battery Charger Charges In 4 Hours…,£15,,
Duracell Hearing Aid Batteries Size 13,Duracell Hearing Aid Batteries Size 136 per pack,£5,83.3p each,
Duracell Hearing Aid Batteries Size 312,Duracell Hearing Aid Batteries Size 3126 per pack,£5,83.3p each,
Duracell High Power Lithium 123 Batteries 3V (CR123 / CR123A / CR17345),Duracell High Power Lithium 1…2 per pack,£10,£5.00 each,
Duracell High Power Lithium CR2 Batteries 3V (CR1H270),Duracell High Power Lithium CR2…2 per pack,£6,£3.00 each,
Duracell Lithium Coin 2016 Batteries 3V (CR2016 / DL2016),Duracell Lithium Coin 2016 Batter…2 per pack,£5,£2.50 each,
Duracell Lithium Coin 2025 Batteries 3V (CR2025 / DL2025),Duracell Lithium Coin 2025 Batter…2 per pack,£5,£2.50 each,
Duracell Lithium Coin 2032 Batteries 3V (CR2032 / DL2032),Duracell Lithium Coin 2032 Batter…2 per pack,£5,£2.50 each,
Duracell Lithium Coin 2032 Batteries 3V (CR2032 / DL2032),Duracell Lithium Coin 2032 Batter…4 per pack,£8,£2.00 each,
Duracell Optimum AAA Alkaline Batteries LR03 ,Duracell Optimum AAA Alkaline Batteries LR03 4 per pack,£5.50,£1.38 each,
Duracell Optimum AAA Alkaline Batteries LR03 ,Duracell Optimum AAA Alkaline Batteries LR03 8 per pack,£8,£1.00 each,"Offer price £8, was £9.75"
Duracell Optimum AAA Alkaline Batteries LR03,Duracell Optimum AAA Alkaline Batteries LR0312 per pack,£13,£1.08 each,
Duracell Optimum AA Alkaline Batteries LR6 ,Duracell Optimum AA Alkaline Batteries LR6 8 per pack,£8,£1.00 each,"Offer price £8, was £9.75"
Duracell Optimum AA Alkaline Batteries LR6,Duracell Optimum AA Alkaline Batteries LR612 per pack,£13,£1.08 each,
Duracell Optimum AA Alkaline Batteries LR6,Duracell Optimum AA Alkaline Batteries LR64 per pack,£5.50,£1.38 each,
Duracell Plus 9V Alkaline Batteries,Duracell Plus 9V Alkaline Batteries2 per pack,£7.50,£3.75 each,
Duracell Plus 9V Alkaline Battery,Duracell Plus 9V Alkaline Battery,£4.50,,
Duracell Plus AAA Alkaline Batteries LR03 ,Duracell Plus AAA Alkaline Batteries LR03 4 per pack,£4.75,£1.19 each,
Duracell Plus AAA Alkaline Batteries LR03,Duracell Plus AAA Alkaline Batteries LR038 per pack,£8,£1.00 each,
Duracell Plus AAA Alkaline Batteries LR03,Duracell Plus AAA Alkaline Batteries LR0312 per pack,£10.75,89.6p each,
Duracell Plus AAA Alkaline Batteries LR03 ,Duracell Plus AAA Alkaline Batteries LR03 20 per pack,£15.25,76.3p each,
Duracell Plus AA Alkaline Batteries LR6 ,Duracell Plus AA Alkaline Batteries LR6 4 per pack,£4.75,£1.19 each,
Duracell Plus AA Alkaline Batteries LR6 ,Duracell Plus AA Alkaline Batteries LR6 8 per pack,£8,£1.00 each,
Duracell Plus AA Alkaline Batteries LR6 ,Duracell Plus AA Alkaline Batteries LR6 12 per pack,£10.75,89.6p each,
Duracell Plus AA Alkaline Batteries LR6,Duracell Plus AA Alkaline Batteries LR620 per pack,£15.25,76.3p each,
Duracell Plus C Alkaline Batteries ,Duracell Plus C Alkaline Batteries 2 per pack,£4,£2.00 each,
Duracell Plus C Alkaline Batteries,Duracell Plus C Alkaline Batteries4 per pack,£7,£1.75 each,
Duracell Plus D Alkaline Batteries,Duracell Plus D Alkaline Batteries2 per pack,£4,£2.00 each,
Duracell Plus D Batteries,Duracell Plus D Batteries4 per pack,£8,£2.00 each,
Duracell Rechargeable AA 1300mAh Batteries,Duracell Rechargeable AA 1300mAh Batteries4 per pack,£14,£3.50 each,
Duracell Rechargeable AA 2500mAh Batteries,Duracell Rechargeable AA 2500mAh Batteries4 per pack,£15,£3.75 each,
Duracell Rechargeable AAA 750mAh Batteries,Duracell Rechargeable AAA 750mAh Batteries4 per pack,£14,£3.50 each,
Duracell Rechargeable AAA 900mAh Batteries,Duracell Rechargeable AAA 900mAh Batteries4 per pack,£15,£3.75 each,
Easter Activity Pack,Easter Activity Pack,£2.85,£2.85 each,
Easter Bunny Card,Easter Bunny Card,£2,£2.00 each,
Easter Bunny Gift Bag,Easter Bunny Gift Bag,£1.50,£1.50 each,
Easter Bunny Mini Treat Bags 3pk,Easter Bunny Mini Treat Bags 3pk3 per pack,£4,£1.33 each,
Easter Bunny Money Wallet ,Easter Bunny Money Wallet ,£1,£1.00 each,
Easter Colouring Book,Easter Colouring Book,£2.90,£2.90 each,
Easter Cupcake with Bunny Toppers Kit for 12,Easter Cupcake with Bunny Toppers Kit for 1212 per pack,£2,16.7p each,
Easter Egg Hunt Clue Signs 10pcs,Easter Egg Hunt Clue Signs 10pcs10 per pack,£3.50,35p each,
Easter Egg Hunt Game ,Easter Egg Hunt Game 4 per pack,£4.45,£1.11 each,
Easter Egg Hunt Kit ,Easter Egg Hunt Kit 6 per pack,£9.40,£1.57 each,
Easter Egg Hunt Kit,Easter Egg Hunt Kit,£2.85,£2.85 each,
Easter Pin The Tail On The Bunny Game,Easter Pin The Tail On The Bunny Game,£3.55,£3.55 each,
Easter Sticker Book,Easter Sticker Book100 per pack,£1.50,1.5p each,
Easter Tableware Kit,Easter Tableware Kit,£6.05,£6.05 each,
Easter Wreath Craft Set,Easter Wreath Craft Set2 per pack,£3,£1.50 each,
"Eat, Sleep, Game, Repeat! Birthday Card","Eat, Sleep, Game, Repeat! Birthday Card",£1.25,£1.25 each,
Eggcellent Birthday Greeting Card,Eggcellent Birthday Greeting Card,£2.70,£2.70 each,
Elegant Eggs Napkins,Elegant Eggs Napkins20 per pack,£2.95,14.8p each,
Elephant Fun Gift Wrap Sheets & Tags (Plastic Free),Elephant Fun Gift Wrap Sheets…2 per pack,£2.50,£1.25 each,
Elmer The Elephant,Elmer The Elephant,£7.95,£7.95 each,
Emma Bridgewater Amazing Dad Greeting Card,Emma Bridgewater Amazin…,£2.75,£2.75 each,
Emma Bridgewater Amazing Mum Birthday Card,Emma Bridgewater Amazin…,£2.75,£2.75 each,
Emma Bridgewater Another Year Anniversary Card,Emma Bridgewater Another…,£2.75,£2.75 each,
Emma Bridgewater Blue Flowers Birthday Card,Emma Bridgewater Blue Flowers Birthday Card,£2.75,£2.75 each,
"Emma Bridgewater Cream Stars Gift Bag, Small 13X13cm",Emma Bridgewater Cream Stars…,£3.15,£3.15 each,
Emma Bridgewater Easter Daffodils & Bee Cards 5pk,Emma Bridgewater Easter Daffodils & Bee Cards 5pk5 per pack,£3.40,68p each,
Emma Bridgewater Get Well Soon Card,Emma Bridgewater Get Well Soon Card,£2.75,£2.75 each,
Emma Bridgewater Happy Birthday Card,Emma Bridgewater Happy Birthday Card,£2.75,£2.75 each,
Emma Bridgewater Hearts Gift Wrap & Tag Pack,Emma Bridgewater Hearts…2 per pack,£2.05,£1.03 each,
Emma Bridgewater Hearts Paper Napkins,Emma Bridgewater Hearts Paper Napkins20 per pack,£3.60,18p each,
Emma Bridgewater Hooray Birthday Card,Emma Bridgewater Hooray Birthday Card,£2.75,£2.75 each,
Emma Bridgewater Love Anniversary Card,Emma Bridgewater Love Anniversary Card,£2.75,£2.75 each,
Emma Bridgewater Mr & Mrs Wedding Card,Emma Bridgewater Mr & Mrs Wedding Card,£2.75,£2.75 each,
Emma Bridgewater New Hearts Gift Bag,Emma Bridgewater New Hearts Gift Bag,£6.25,£6.25 each,
"Emma Bridgewater New Hearts Gift Bag, Mini 13X13cm",Emma Bridgewater New Hearts…,£3.15,£3.15 each,
Emma Bridgewater Nice Present Bottle Bag,Emma Bridgewater Nice Present Bottle Bag,£3.95,£3.95 each,
"Emma Bridgewater Nice Present Gift Bag, Medium","Emma Bridgewater Nice Present Gift Bag, Medium",£4,£4.00 each,
Emma Bridgewater Pink Heart Blank Card,Emma Bridgewater Pink Heart Blank Card,£2.75,£2.75 each,
Emma Bridgewater Polka Dot Paper Napkins,Emma Bridgewater Polka Dot Paper Napkins20 per pack,£3.60,18p each,
Emma Bridgewater Starry Skies Gift Wrap & Tags,Emma Bridgewater Starry Skies Gift Wrap & Tags2 per pack,£2,£1.00 each,
Emma Bridgewater Stars Birthday Card,Emma Bridgewater Stars Birthday Card,£2.75,£2.75 each,
Emma Bridgewater Wedding Vows Card,Emma Bridgewater Wedding Vows Card,£2.90,£2.90 each,
Emma Bridgewater Wonderful Grandma Greeting Card,Emma Bridgewater Wonderful…,£2.60,£2.60 each,
Energizer Alkaline Power AA Batteries,Energizer Alkaline Power AA Batteries24 per pack,£12,50p each,
Energizer Alkaline Power Batteries Maxi AAA,Energizer Alkaline Power Batteries Maxi AAA24 per pack,£12,50p each,
Energizer Cr2032 Lithium Batteries ,Energizer Cr2032 Lithium Batteries ,£9,,
Energizer Lr44/A76 Alkaline Batteries,Energizer Lr44/A76 Alkaline Batteries4 per pack,£7.50,£1.88 each,
Energizer Max 9V Batteries ,Energizer Max 9V Batteries 2 per pack,£6,£3.00 each,
Energizer Max AA,Energizer Max AA12 per pack,£7,58.3p each,"Offer price £7, was £9"
Energizer Max AAA Batteries ,Energizer Max AAA Batteries 4 per pack,£3.75,93.8p each,
Energizer Max AAA Batteries Alkaline,Energizer Max AAA Batteries Alkaline12 per pack,£7,58.3p each,"Offer price £7, was £9"
Energizer Max Aa Batteries,Energizer Max Aa Batteries4 per pack,£3.75,93.8p each,
Energizer Max D Batteries ,Energizer Max D Batteries 4 per pack,£6,£1.50 each,
Energizer Zink Air Hearing Aid Batteries Size 312 ,Energizer Zink Air Hearing Aid Batteries Size 312 8 per pack,£6,75p each,
Epic Birthday Card,Epic Birthday Card,£2.50,£2.50 each,
Fab Friends Birthday Greeting Card,Fab Friends Birthday Greeting Card,£2.70,£2.70 each,
Fantastically Great Women Who Changed The World,Fantastically Great Women…,£8.99,£8.99 each,
Farm Sounds,Farm Sounds,£15.65,£15.65 each,
Fire Birthday Card,Fire Birthday Card,£2,£2.00 each,
Fisher Price Laugh & Learn DigiPuppy,Fisher Price Laugh & Learn DigiPuppy6 per pack,£11.80,£1.97 each,
Fisher Price Laugh & Learn Smart Phone,Fisher Price Laugh & Learn Smart Phone,£11,,
Fisher Price Lil' Gamer,Fisher Price Lil' Gamer,£14.35,£14.35 each,
Five Minutes' Peace,Five Minutes' Peace,£9.65,£9.65 each,
Flamingo Birthday Card,Flamingo Birthday Card,£1.25,£1.25 each,
Flaunt It Birthday Greeting Card,Flaunt It Birthday Greeting Card,£2.70,£2.70 each,
Floral Cross Easter Cards,Floral Cross Easter Cards5 per pack,£3.40,68p each,
Floral Happy Birthday Card,Floral Happy Birthday Card,£2.75,£2.75 each,
Football Birthday Candles,Football Birthday Candles6 per pack,£2.49,41.5p each,
Football Boots Birthday Card,Football Boots Birthday Card,£1.25,£1.25 each,
Football Paper Cups 260ml,Football Paper Cups 260ml8 per pack,£1.99,24.9p each,
Football Paper Napkins,Football Paper Napkins16 per pack,£1.49,9.3p each,
Football Paper Plates 23cm,Football Paper Plates 23cm8 per pack,£1.99,24.9p each,
Free Gin Birthday Card,Free Gin Birthday Card,£2,£2.00 each,
"Fresh Metal Car Assortment, 1 per pack","Fresh Metal Car Assortment, 1 per pack",£2,£2.00 each,
From the Oven to the Table,From the Oven to the Table,£27,£27.00 each,
"From You To Me, Hopes & Wishes For You","From You To Me, Hopes & Wishes For You",£10.15,£10.15 each,
"From You To Me, Promises For You","From You To Me, Promises For You",£10.15,£10.15 each,
"From You To Me, The Only Bear For Me","From You To Me, The Only Bear For Me",£10.15,£10.15 each,
From You To Me - A Tale For A Sleepy Bunny,From You To Me - A Tale For A Sleepy Bunny,£10.15,£10.15 each,
Fumfings Animal Pack Farm,Fumfings Animal Pack Farm,£6,£6.00 each,
Fumfings Large Safari Animal Pack,Fumfings Large Safari Animal Pack,£6,£6.00 each,
Galt 10 Chalks,Galt 10 Chalks,£1.50,£1.50 each,
Galt 3 Non Spill Pots,Galt 3 Non Spill Pots,£5.40,£5.40 each,
Galt 6 Poster Paints,Galt 6 Poster Paints,£3.10,£3.10 each,
"Galt Brilliant Hair Bands, 6yrs+","Galt Brilliant Hair Bands, 6yrs+",£10,£10.00 each,
"Galt Card Craft, 8yrs+","Galt Card Craft, 8yrs+",£13,£13.00 each,
Galt Counting Puzzle,Galt Counting Puzzle,£13.95,£13.95 each,
Galt Discovery Puzzle,Galt Discovery Puzzle,£12.90,£12.90 each,
Galt Fill & Spill Fruit Basket,Galt Fill & Spill Fruit Basket,£18.60,£18.60 each,
Galt Flower Rings,Galt Flower Rings,£6.50,£6.50 each,
"Galt Follow Me Ball, 6mths+","Galt Follow Me Ball, 6mths+",£16,£16.00 each,
"Galt Jungle Pals Skittles 8"", 12mths+","Galt Jungle Pals Skittles 8"", 12mths+",£16,£16.00 each,
Galt Liquid Paints,Galt Liquid Paints,£11.85,£11.85 each,
Galt Monster Magnets,Galt Monster Magnets,£7.20,£7.20 each,
Galt Nail Design Case,Galt Nail Design Case,£19.40,£19.40 each,
Galt Paint box,Galt Paint box,£5.15,£5.15 each,
"Galt Pop-up Toy, 12mths+","Galt Pop-up Toy, 12mths+",£9,£9.00 each,
Galt Soap Making Kit,Galt Soap Making Kit,£13.30,£13.30 each,
Galt Squeeze n Brush - 5 Glitter Colours 3+,Galt Squeeze n Brush - 5 Glitter Colours 3+,£4.50,£4.50 each,
"Galt Toys Glow Lab, 6yrs+","Galt Toys Glow Lab, 6yrs+",£13,£13.00 each,
"Galt Toys Magnetic Lab, 6yrs+","Galt Toys Magnetic Lab, 6yrs+",£13,£13.00 each,
"Galt Toys  Rainbow Lab, 6yrs+","Galt Toys  Rainbow Lab, 6yrs+",£15,£15.00 each,
"Galt Toys Slime Lab, 5 yrs+","Galt Toys Slime Lab, 5 yrs+",£13,£13.00 each,
Galt Travel Activity Case,Galt Travel Activity Case,£14.90,£14.90 each,
