name,Price Per Unit,Price Per Measure,Promotion
"Galt Water Magic Dinosaurs, 3yrs+","Galt Water Magic Dinosaurs, 3yrs+",£7,£7.00 each,
Galt Water Magic Under The Sea,Galt Water Magic Under The Sea,£5.99,,
"Galt Water Magic Vehicles, 3yrs+","Galt Water Magic Vehicles, 3yrs+",£7,£7.00 each,
Galt Window Markers,Galt Window Markers,£5.15,£5.15 each,
"Gazillion 2L Bubble Solution, 3yrs+","Gazillion 2L Bubble Solution, 3yrs+",£6.50,£6.50 each,
"Gazillion 2L Giant Bubble Solution, 3yrs+","Gazillion 2L Giant Bubble Solution, 3yrs+",£6.99,£6.99 each,
Gazillion Incredibubble Wand,Gazillion Incredibubble Wand,£10.45,£10.45 each,
Gi-Go Baby Care Pack,Gi-Go Baby Care Pack,£4,,
"Giant Road Puzzle, 3yrs+","Giant Road Puzzle, 3yrs+",£15,£15.00 each,
Gigo Baby Care Pack,Gigo Baby Care Pack,£4.65,,
"Gin How To Drink It, Octopus Publishing Group","Gin How To Drink It, Octopus Publishing Group",£19.60,£19.60 each,
"Glass Rainbow Hanging Decoration, Multi","Glass Rainbow Hanging Decoration, Multi",£8,£8.00 each,
"Glenmuir Womens Bamboo Sports Trainer Socks, White, Size 4-8",Glenmuir Womens Bamboo Sports Train…3 per pack,£12.99,£4.33 each,
"Glenmuir Womens Bamboo Trainer Socks, Black, Size 4-8",Glenmuir Womens Bamboo Traine…3 per pack,£12.99,£4.33 each,
Glimma Girlz Styling Heads,Glimma Girlz Styling Heads,£10,,
"Glow in the Dark Mould & Paint Dinosaur, 5yrs+","Glow in the Dark Mould & Paint Dinosaur, 5yrs+",£12,£12.00 each,
Golf Happy Birthday Card,Golf Happy Birthday Card,£2.60,£2.60 each,
Good Luck Bee Awesome Card,Good Luck Bee Awesome Card,£2.45,£2.45 each,
Good Vibes Birthday Card,Good Vibes Birthday Card,£1.25,£1.25 each,
Grafix 3D Foam Sticker Shapes,Grafix 3D Foam Sticker Shapes,75p,,
Grafix Craft Carry Pack,Grafix Craft Carry Pack,£4,,
Grafix Craft Sticks,Grafix Craft Sticks80 per pack,75p,0.9p each,
Grafix Jumbo Crayons,Grafix Jumbo Crayons12 per pack,£2,16.7p each,
Grafix Pastel Gel Pens,Grafix Pastel Gel Pens8 per pack,£1.50,18.8p each,
Grafix Poster Paints,Grafix Poster Paints6 per pack,£2,33.3p each,
Grafix Splash Sprinkler W/Ball,Grafix Splash Sprinkler W/Ball,£7,,
Grafix Stamper Markers,Grafix Stamper Markers7 per pack,£2,28.6p each,
Grandad Birthday Card,Grandad Birthday Card,£2.15,£2.15 each,
Grandma Bumble Bee Birthday Card,Grandma Bumble Bee Birthday Card,£2.90,£2.90 each,
Green Science Hybrid Solar Power Water Pump,Green Science Hybrid Solar Power Water Pump,£21.99,£21.99 each,
Green Science Windmill Generator,Green Science Windmill Generator,£12.99,£12.99 each,
Grow Your Own Chilli Plants,Grow Your Own Chilli Plants,£13,£13.00 each,
"Hamlyn All Colour Cookery, 200 Tapas & Spanish Dishes","Hamlyn All Colour Cookery, 20…",£6.75,£6.75 each,
Hand Finished Candles Birthday Card,Hand Finished Candles Birthday Card,£1.50,£1.50 each,
Hand Finished Happy Birthday Card,Hand Finished Happy Birthday Card,£1.50,£1.50 each,
Hand Finished Happy Birthday Card,Hand Finished Happy Birthday Card,£1.50,£1.50 each,
Hand Finished Happy Birthday Matey Card,Hand Finished Happy Birthday Matey Card,£1.50,£1.50 each,
Hand Finished Happy Birthday To You Card,Hand Finished Happy Birthday To You Card,£1.50,£1.50 each,
Happiest Sister Birthday Card,Happiest Sister Birthday Card,£2.49,£2.49 each,
Happy Beer Day Card ,Happy Beer Day Card ,£2.35,£2.35 each,
Happy Birthday Balloon Foil Dot Card ,Happy Birthday Balloon Foil Dot Card ,£2.40,£2.40 each,
"Happy Birthday Banner, Pink ","Happy Birthday Banner, Pink ",£1.75,£1.75 each,
Happy Birthday Beer Card,Happy Birthday Beer Card,£2.60,£2.60 each,
Happy Birthday Gift Wrap Sheets,Happy Birthday Gift Wrap Sheets2 per pack,£3,£1.50 each,
Happy Birthday Gift Wrap Sheets & Tags,Happy Birthday Gift Wrap Sheets & Tags2 per pack,£3,£1.50 each,
Happy Birthday Heres to You! Card,Happy Birthday Heres to You! Card,£3,£3.00 each,
Happy Easter Banner,Happy Easter Banner,£2.30,£2.30 each,
Happy Kid Ball Tumblin Mixer,Happy Kid Ball Tumblin Mixer,£14,,
Happy Kid Create & Play Racers,Happy Kid Create & Play Racers,£10,,
Harry Potter Colouring Book,Harry Potter Colouring Book,£12,£12.00 each,
Harry Potter Glasses,Harry Potter Glasses4 per pack,£4.25,£1.06 each,
Harry Potter Greatest Witches and Wizards Top Trumps Specials Card Game,Harry Potter Greatest Witches…,£9,£9.00 each,
Harry Potter Mini Nano Figure Assortment,Harry Potter Mini Nano Figure Assortment,£2,,
Hasbro Monopoly Grab & Go,Hasbro Monopoly Grab & Go,£6.99,,
Have a Classic Cars Birthday Card,Have a Classic Cars Birthday Card,£2.35,£2.35 each,
Hawksmoor - Restaurants & Recipes,Hawksmoor - Restaurants & Recipes,£30,£30.00 each,
Hedgehog Greeting Card,Hedgehog Greeting Card,£1.25,£1.25 each,
Henry Vacuum Cleaner,Henry Vacuum Cleaner,£11.50,,
Hey Duggee Hug Squishy,Hey Duggee Hug Squishy,£5,,
Hey Duggee Toothbrush & Hand Washing Time With Duggee,Hey Duggee Toothbrush & Hand…,£13.50,,"Offer price £13.50, was £18"
Hinkler Neon Rock Painting Activity Set,Hinkler Neon Rock Painting Activity Set,£6.99,,
Hinkler Zap Extra Nail Art Activity Set,Hinkler Zap Extra Nail Art Activity Set,£6,,
Hollywood Rides Assorted,Hollywood Rides Assorted,£8,,
Honeycomb Decorations,Honeycomb Decorations3 per pack,£6.90,£2.30 each,
Horrible Science Explosive Experiments 8yrs+,Horrible Science Explosive Experiments 8yrs+,£18,£18.00 each,
Hot Wheels Monster Trucks Demolition Doubles,Hot Wheels Monster Trucks Demolition Doubles,£10.70,£10.70 each,
Hot Wheels Shark Chomp Transport,Hot Wheels Shark Chomp Transport,£17.60,£17.60 each,
Hot Wheels Shark Chomp Transporter,Hot Wheels Shark Chomp Transporter,£14,,
Husband Anniversary Card,Husband Anniversary Card,£2.89,£2.89 each,
Hy-Pro Basketball Size 5,Hy-Pro Basketball Size 5,£6,,
Hy-Pro Football Gift Set,Hy-Pro Football Gift Set,£12,,
Hy-Pro Funburst Hand Pump,Hy-Pro Funburst Hand Pump,£4.50,,
Hy-Pro Skills Goal Set,Hy-Pro Skills Goal Set,£16,,
Hy-Pro Training Goalkeeper Gloves,Hy-Pro Training Goalkeeper Gloves,£6,,
"Ice Cream Bubbles, 5yrs+","Ice Cream Bubbles, 5yrs+",£2,£2.00 each,
I Don't Want to Wash My Hands!,I Don't Want to Wash My Hands!,£7.99,£7.99 each,
If You Care FSC Certified Large Cupcake Cases,If You Care FSC Certified Large Cupcake Cases,£3,£3.00 each,
Independent and Unofficial Guide to Minecraft Top Trumps Specials Card Game,Independent and Unofficial Guid…,£8.70,£8.70 each,
Invisibobble Clear Sparkle Kids Hair Ties,Invisibobble Clear Sparkle Kids Hair Ties3 per pack,£4,£1.33 each,
Invisibobble Rainbow Kids Hair Ties ,Invisibobble Rainbow Kids Hair Ties 3 per pack,£4,£1.33 each,
"Jack & Lily Ballerina Gift Bag, Medium","Jack & Lily Ballerina Gift Bag, Medium",£4.15,£4.15 each,
"Jack & Lily Zebra Gift Bag, Medium","Jack & Lily Zebra Gift Bag, Medium",£4.15,£4.15 each,
Jaguar Birthday Card,Jaguar Birthday Card,£1.95,£1.95 each,
Joie Glitter Straws,Joie Glitter Straws,£4,,
Joie Metal Straws,Joie Metal Straws6 per pack,£8,£1.33 each,
Jungle Sounds,Jungle Sounds,£13.99,£13.99 each,
Keycraft Mini Hatching Egg Dinosaur,Keycraft Mini Hatching Egg Dinosaur,£2,£2.00 each,
"Keycraft Small Light-Up Bath Toy, 1 Each","Keycraft Small Light-Up Bath Toy, 1 Each",£3.50,£3.50 each,
Kids Christmas Fairisle Cream Jumper 1-1.5 years,Kids Christmas Fairisle Cream Jumper 1-1.5 years,£10,,
Kids Create 50 Assorted Pipe Cleaners 3+,Kids Create 50 Assorted Pipe Cleaners 3+,£1.50,£1.50 each,
Kids Create Mixed Bag Of Feathers 3+,Kids Create Mixed Bag Of Feathers 3+,£1.50,£1.50 each,
"Kidz Labs Create Your Own Mug Design Markers, 3yrs+",Kidz Labs Create Your Own Mug…,£6.90,£6.90 each,
"Kidz Labs Spy Science, 8yrs+","Kidz Labs Spy Science, 8yrs+",£13,£13.00 each,
Kraft Easter Gift Bag,Kraft Easter Gift Bag,£1.50,£1.50 each,
Lamaze Doll My Friend Emily Buggy Toy 0mths+,Lamaze Doll My Friend Emily Buggy Toy 0mths+,£15,£15.00 each,
Lamaze Flip Flap Dragon Buggy Toy 0mths+,Lamaze Flip Flap Dragon Buggy Toy 0mths+,£15,£15.00 each,
"Lamaze Freddie The Firefly Buggy Toy, 0mths+","Lamaze Freddie The Firefly Buggy Toy, 0mths+",£15,£15.00 each,
"Lamaze Freddie The Firefly Highchair Toy, 6mths+",Lamaze Freddie The Firefly…,£15,£15.00 each,
"Lamaze Gardenbug Wrist Rattle & Footfinder Set, 0mths+",Lamaze Gardenbug Wrist Rattle &…,£15,£15.00 each,
"Lamaze Musical Inchworm, 0mths+","Lamaze Musical Inchworm, 0mths+",£17,£17.00 each,
Lamaze Play & Grow Rusty the Robot Buggy Toy 0mths+,Lamaze Play & Grow Rusty the…,£15,£15.00 each,
"Large T-Rex Hatching Egg, 3yrs+","Large T-Rex Hatching Egg, 3yrs+",£6,£6.00 each,
" Large Triceratops Hatching Egg, 3yrs+"," Large Triceratops Hatching Egg, 3yrs+",£6,£6.00 each,
Lego City Electric Sports Car 60383,Lego City Electric Sports Car 60383,£9,,
Lego City Fire Rescue Boat 60373,Lego City Fire Rescue Boat 60373,£18,,
LEGO City Holiday Camper Van 60283,LEGO City Holiday Camper Van 60283,£18,£18.00 each,
Lego City Holiday Camper Van 60283,Lego City Holiday Camper Van 60283,£18,,
Lego City Mobile Police Dog Training,Lego City Mobile Police Dog Training,£18,,
Lego City Police Bike Chase 60392,Lego City Police Bike Chase 60392,£9,,
LEGO City Police Car ,LEGO City Police Car ,£9.55,£9.55 each,
Lego City Police Car 60312,Lego City Police Car 60312,£9,,
Lego City Police Helicopter Toy,Lego City Police Helicopter Toy,£10.50,,
LEGO City Race Car ,LEGO City Race Car ,£9.55,£9.55 each,
Lego City Stunt Competition 60299,Lego City Stunt Competition 60299,£18,,
LEGO City Stuntz Park ,LEGO City Stuntz Park ,£26.50,£26.50 each,
LEGO Classic Blue Baseplate 10714,LEGO Classic Blue Baseplate 10714,£8,£8.00 each,
Lego Classic Creative Monsters 11017,Lego Classic Creative Monsters 11017,£9,,
LEGO Classic White Baseplate 11010,LEGO Classic White Baseplate 11010,£8,£8.00 each,
Lego Creator Dolphin & Turtle 31128,Lego Creator Dolphin & Turtle 31128,£9,,
LEGO Creator Dolphin and Turtle ,LEGO Creator Dolphin and Turtle ,£9.55,£9.55 each,
Lego Creator Fantasy Forest Creatures 31125,Lego Creator Fantasy Forest Creatures 31125,£13,,
Lego Creator Mighty Dinosaurs,Lego Creator Mighty Dinosaurs,£13,,
LEGO Creator Super Robot ,LEGO Creator Super Robot ,£9.55,£9.55 each,
LEGO Disney Princess Annas Castle Courtyard ,LEGO Disney Princess Annas Castle Courtyard ,£9.60,£9.60 each,
Lego Disney Princess Anna's Castle Courtyard 43198,Lego Disney Princess Anna's…,£9,,
LEGO Disney Princess Elsas Castle Courtyard ,LEGO Disney Princess Elsas Castle Courtyard ,£9.60,£9.60 each,
Lego Disney Princess Twirling Rapunzel 43214,Lego Disney Princess Twirling Rapunzel 43214,£9,,
LEGO DUPLO Bath Time Fun - Floating Animal Train ,LEGO DUPLO Bath Time Fun…,£19.05,£19.05 each,
LEGO DUPLO Bath Time Fun Floating Red Panda ,LEGO DUPLO Bath Time Fun Floating Red Panda ,£9.55,£9.55 each,
LEGO DUPLO Farm Animal Care 10949,LEGO DUPLO Farm Animal Care 10949,£10.30,£10.30 each,
LEGO DUPLO Truck & Tracked Excavator 10931,LEGO DUPLO Truck & Tracked Excavator 10931,£18,£18.00 each,
Lego Friends Donut Shop 41723,Lego Friends Donut Shop 41723,£9,,
Lego Friends Forest House,Lego Friends Forest House,£25,,
Lego Friends Mobile Bubble Tea Shop 41733,Lego Friends Mobile Bubble Tea Shop 41733,£9,,
Lego Friends Mobile Fashion Boutique 41719,Lego Friends Mobile Fashion Boutique 41719,£9,,
Lego Friends Pet Clinic,Lego Friends Pet Clinic,£18,,
Lego Harry Potter Hogwarts Carriage & Thestrals 76400,Lego Harry Potter Hogwarts Ca…,£18,,
Lego Harry Potter Hogwarts Moment Potions Class 76383,Lego Harry Potter Hogwarts Mo…,£32.50,,
Lego Harry Potter Hogwarts Polyjuice Potion Mistake 76386,Lego Harry Potter Hogwarts Polyju…,£20.99,,
Lego Hogwarts Moment Transfiguration Class,Lego Hogwarts Moment Transfiguration Class,£28,,
Lego Jurassic World Blue & Beta Velociraptor 76946,Lego Jurassic World Blue & Beta Velociraptor 76946,£25,,
Lego Marvel Black Panther Dragon Flyer 76186,Lego Marvel Black Panth…,£18,,
Lego Marvel Super Heroes Black Panther Mech 76204,Lego Marvel Super Heroes Bl…,£9,,
Lego Marvel Super Heroes Iron Mech,Lego Marvel Super Heroes Iron Mech,£9,,
Lego Marvel Super Heroes Wolverine Mech,Lego Marvel Super Heroes Wolverine Mech,£9,,
Lego Minecraft Dessert 21177,Lego Minecraft Dessert 21177,£9,,
Lego Minecraft The Bee Cottage 21241,Lego Minecraft The Bee Cottage 21241,£18,,
Lego Minecraft The Bee Farm 21165,Lego Minecraft The Bee Farm 21165,£18,,
Lego Minecraft The Horse Stable,Lego Minecraft The Horse Stable,£20.99,,
Lego Minecraft The Mushroom House 21179,Lego Minecraft The Mushroom House 21179,£18,,
Lego Minecraft The Swamp Adventure 21240,Lego Minecraft The Swamp Adventure 21240,£9,,
Lego Minecraft Toy,Lego Minecraft Toy,£10.50,,
Lego Ninjago Jay's Thunder Dragon Evo 71760,Lego Ninjago Jay's Thun…,£18,,
Lego Ninjago Kai's Blade Cycle 71734,Lego Ninjago Kai's Blade Cycle 71734,£10.50,,
Lego Ninjago Kais Ninja Race Car Evo,Lego Ninjago Kais Ninja Race Car Evo,£9,,
Lego Ninjago Lloyd's Ninja Street Bike 71788,Lego Ninjago Lloyd's Ninja Street Bike 71788,£9,,
Lego Ninjago Zane's Power Up Mech Evo 71761,Lego Ninjago Zane's Pow…,£9,,
Lego Speed Champions 007 Aston Martin DB5 76911,Lego Speed Champions 007…,£20,,
Lego Speed Champions 76900,Lego Speed Champions 76900,£18,,
Lego Speed Champions Fast & Furious 1970 Dodge Charger 16912,Lego Speed Champions Fast & Furious…,£20,,
Lego Speed Champions Lamborghini Countach 76908,Lego Speed Champions Lamb…,£20,,
Lego Speed Champions Mclaren Elva,Lego Speed Champions Mclaren Elva,£18,,
LEGO Spidey Hulk vs. Rhino Truck Showdown ,LEGO Spidey Hulk vs. Rhino Truck Showdown ,£19.15,£19.15 each,
Lego Star Wars At At Vs Tauntaun Microfighters,Lego Star Wars At At Vs Tauntaun Microfighters,£18,,
Lego Star Wars Boba Fett Mini Starship 75344,Lego Star Wars Boba Fett Mini Starship 75344,£9,,
Lego Star Wars Clone Troopers 75345,Lego Star Wars Clone Troopers 75345,£18,,
Lego Star Wars Dark Trooper Attack 75324,Lego Star Wars Dark Trooper Attack 75324,£25,,
Lego Star Wars Hoth Battle Pack,Lego Star Wars Hoth Battle Pack,£18,,
Lego Star Wars Razor Crest Microfighter,Lego Star Wars Razor Crest Microfighter,£9,,
Lego Star Wars Resistance X-Wing,Lego Star Wars Resistance X-Wing,£18,,
Lego Super Heroes Hulk Mech 76241,Lego Super Heroes Hulk Mech 76241,£13,,
Lego Super Heroes Thanos Mech 76242,Lego Super Heroes Thanos Mech 76242,£13,,
Lego Super Heroes Thor Love & Thunder 76207,Lego Super Heroes Thor Love & Thunder 76207,£18,,
Lego Technic Dump Truck 42147,Lego Technic Dump Truck 42147,£9,,
Lego Technic Monster Jam Dragon 42149,Lego Technic Monster Jam Dragon 42149,£18,,
Lego The Batman Batman & Selina Kyle Motorcycle Pursuit 76179,Lego The Batman Batman & Selina Kyl…,£13,,
Light Up Unicorn Toy,Light Up Unicorn Toy,£4,£4.00 each,
Lilac Easter Plate,Lilac Easter Plate8 per pack,£1.75,21.9p each,
Lilac Easter Tablecover,Lilac Easter Tablecover,£2.50,£2.50 each,
Lilac Happy Easter Napkin,Lilac Happy Easter Napkin16 per pack,£1.50,9.4p each,
Lion & Mouse Birthday Card,Lion & Mouse Birthday Card,£2.50,£2.50 each,
LOL Surprise Foil Balloon 45cm,LOL Surprise Foil Balloon 45cm,£2.49,£2.49 each,
Look inside our World Kids Book,Look inside our World Kids Book,£9.99,£9.99 each,
"Look Inside Space, from Usborne","Look Inside Space, from Usborne",£11,£11.00 each,
"Look Inside Your Body, from Usborne","Look Inside Your Body, from Usborne",£10,£10.00 each,
Lynx All Stars Trio Gift Set,Lynx All Stars Trio Gift Set600g,£14,£2.33 per 100g,
Made In India,Made In India,£22.50,£22.50 each,
"Magical, Myths & Legends","Magical, Myths & Legends",£15,£15.00 each,
Magical Animal Rock Painting,Magical Animal Rock Painting,£15.99,£15.99 each,
Magical Unicorn Birthday Card,Magical Unicorn Birthday Card,£1.25,£1.25 each,
Magical Unicorn Napkins,Magical Unicorn Napkins16 per pack,£1.49,9.3p each,
Magical Unicorn Party Bags,Magical Unicorn Party Bags8 per pack,99p,12.4p each,
Magical Unicorn Plates 23cm,Magical Unicorn Plates 23cm8 per pack,£1.99,24.9p each,
Magical Unicorn Table Cover,Magical Unicorn Table Cover,£2.50,£2.50 each,
Magical Unicorn Temporary Tattoos ,Magical Unicorn Temporary Tattoos 2 per pack,£2.95,£1.48 each,
Magic Mixies Mixlings Single Pack,Magic Mixies Mixlings Single Pack,£6,,
Maharajah Card,Maharajah Card,£2.39,£2.39 each,
Majigg Tin of Marbles,Majigg Tin of Marbles,£3.95,£3.95 each,
"Make Your Own Origami Lights, 5yrs+","Make Your Own Origami Lights, 5yrs+",£14.50,£14.50 each,
Mamma Ohh Mother's Day Card,Mamma Ohh Mother's Day Card,£2.50,£2.50 each,
"Marble Run, 4yrs+","Marble Run, 4yrs+",£13,£13.00 each,
Mars Converters,Mars Converters,£11,,
Mars Robot,Mars Robot,£8,,
Marvel Nano Figure Assortment,Marvel Nano Figure Assortment,£1.88,,"Offer price £1.88, was £2.50"
Marvel Wrapping Paper,Marvel Wrapping Paper,£2,£2.00 each,
"Match & Spell Next Steps, 5yrs+","Match & Spell Next Steps, 5yrs+",£8.60,£8.60 each,
"Melissa & Doug Dinosaur Stamp Set, 4yrs+","Melissa & Doug Dinosaur Stamp Set, 4yrs+",£12,£12.00 each,
"Melissa & Doug Magnetic Wooden Game Fishing, 3yrs+",Melissa & Doug Magnetic Woo…,£12,£12.00 each,
Melissa & Doug Off To The Speedway Wooden Race Car Carrier,Melissa & Doug Off To The Speedwa…,£17.50,,
Melissa & Doug Reusable Puffy Stickers - Dinosaurs,Melissa & Doug Reusable Puffy Stickers - Dinosaurs,£5,£5.00 each,
Melissa & Doug Reusable Puffy Stickers - Vehicles,Melissa & Doug Reusable Puffy Stickers - Vehicles,£5,£5.00 each,
"Melissa & Doug Reusable Puffy Stickers Pirate, 4yrs+",Melissa & Doug Reusable Puffy…,£5,£5.00 each,
"Melissa & Doug Reusable Sticker Pad Dress-Up, 3yrs+",Melissa & Doug Reusable Stick…,£6,£6.00 each,
"Melissa & Doug Reusable Sticker Pad Fairies, 3yrs+","Melissa & Doug Reusable Sticker Pad Fairies, 3yrs+",£6,£6.00 each,
"Melissa & Doug Reusable Sticker Pad Habitats, 3yrs+",Melissa & Doug Reusable Stick…,£6,£6.00 each,
"Melissa & Doug Reusable Sticker Pad Play House, 3yrs+",Melissa & Doug Reusable Stick…,£6,£6.00 each,
"Melissa & Doug Reusable Sticker Pad Vehicles, 3yrs+","Melissa & Doug Reusable Sticker Pad Vehicles, 3yrs+",£6,£6.00 each,
Melissa & Doug Wooden Jumbo Beads,Melissa & Doug Wooden Jumbo Beads,£5.25,,
Melissa & Doug Wooden Play Food 22 Pieces,Melissa & Doug Wooden Play Food 22 Pieces,£17.50,,
"Melissa & Doug Wooden Stringing Beads, 4yrs+","Melissa & Doug Wooden Stringing Beads, 4yrs+",£15,£15.00 each,
Meowing Heads Smitten Kitten,Meowing Heads Smitten Kitten450g,£7,£1.56 per 100g,
"Mindful Kids, 50 Mindfulness Activities","Mindful Kids, 50 Mindfulness Activities",£10.99,£10.99 each,
Minecraft Nano Figure Blind Bag,Minecraft Nano Figure Blind Bag,£3,,
Mini Chicks Easter Decoration,Mini Chicks Easter Decoration,£1.50,£1.50 each,
Money Bank Robot,Money Bank Robot,£17.99,£17.99 each,
"Monkey Puzzle, by Julia Donaldson","Monkey Puzzle, by Julia Donaldson",£6.99,£6.99 each,
Monopoly Bid,Monopoly Bid,£5.80,£5.80 each,
Monopoly Deal Card Game,Monopoly Deal Card Game,£4.50,,"Offer price £4.50, was £6"
Monster Magnets,Monster Magnets,£4.50,,"Offer price £4.50, was £6"
Morrisons 360 White LED Icicle Lights With Clear Cable,Morrisons 360 White LED Icicle…,£25,,
Morrisons AAA Battery,Morrisons AAA Battery12 per pack,£7,58.3p each,
Morrisons AA Battery,Morrisons AA Battery12 per pack,£7,58.3p each,
Morrisons Blue Confetti Napkins,Morrisons Blue Confetti Napkins20 per pack,£1.50,7.5p each,
Morrisons Boys Thinsulate Fleece Hat One Size,Morrisons Boys Thinsulate Fleece Hat One Size,£4,,
Morrisons Bubbling Mower,Morrisons Bubbling Mower,£13,,
Morrisons Bunny Footprints,Morrisons Bunny Footprints,£1.50,,
Morrisons Bunny Garland,Morrisons Bunny Garland,£2.50,,
Morrisons Card Bunny Ears And Glasses,Morrisons Card Bunny Ears And Glasses,£2,,
Morrisons Carrot Bonnet Decorations,Morrisons Carrot Bonnet Decorations,£1,,
Morrisons Children's Easter Bonnet,Morrisons Children's Easter Bonnet,£1,,
Morrisons Chocolate Mould,Morrisons Chocolate Mould,£3.50,,
Morrisons Colouring & Activity Book,Morrisons Colouring & Activity Book,£1.25,,
Morrisons Daisy Print Vase,Morrisons Daisy Print Vase,£5,,
Morrisons Easter Bingo Game,Morrisons Easter Bingo Game,£2.50,,
Morrisons Easter Bonnet Decorating Kit,Morrisons Easter Bonnet Decorating Kit,£2.50,,
Morrisons Easter Bunny Napkins,Morrisons Easter Bunny Napkins,£1.50,,
Morrisons Easter Bunny Plates,Morrisons Easter Bunny Plates,£1.50,,
Morrisons Easter Craft Kit,Morrisons Easter Craft Kit,£2.50,,
Morrisons Easter Dominoes Game,Morrisons Easter Dominoes Game,£2,,
Morrisons Easter Gonk,Morrisons Easter Gonk,£6,,
Morrisons Easter Mug,Morrisons Easter Mug,£2,,
Morrisons Easter Paper Chains,Morrisons Easter Paper Chains,£1,,
Morrisons Easter Ribbon Pack,Morrisons Easter Ribbon Pack,£1.50,,
Morrisons Easter Sticker Sheets,Morrisons Easter Sticker Sheets,£1,,
Morrisons Easter Treat Bag Pack,Morrisons Easter Treat Bag Pack,£3,,
Morrisons Egg And Spoon Race Game,Morrisons Egg And Spoon Race Game,£5,,
Morrisons Egg Hunt Hanging Sign,Morrisons Egg Hunt Hanging Sign,£1.50,,
Morrisons Egg Hunt Sign Kit,Morrisons Egg Hunt Sign Kit,£2,,
Morrisons Egg Hunt Stick Decorations,Morrisons Egg Hunt Stick Decorations,£2.50,,
Morrisons Extra Large Bunny Gift Bag,Morrisons Extra Large Bunny Gift Bag,£1.50,,
Morrisons Extra Long Life Alkaline Batteries AA,Morrisons Extra Long Life Alkaline Batteries AA4 per pack,£3,75p each,
Morrisons Extra Long Life Alkaline Batteries AAA,Morrisons Extra Long Life Alkaline Batteries AAA4 per pack,£3,75p each,
Morrisons Extra Long Life Alkaline Batteries C,Morrisons Extra Long Life Alkaline Batteries C2 per pack,£3,£1.50 each,
Morrisons Extra Long Life Alkaline Battery 9V,Morrisons Extra Long Life Alkaline Battery 9V,£3,,
Morrisons Extra Long Life Alkaline Battery D,Morrisons Extra Long Life Alkaline Battery D2 per pack,£3,£1.50 each,
Morrisons Fillable Treat Boxes,Morrisons Fillable Treat Boxes,£2,,
Morrisons Fluffy Treat Bag Bunny,Morrisons Fluffy Treat Bag Bunny,£3.50,,
Morrisons Fluffy Treat Bag Chick,Morrisons Fluffy Treat Bag Chick,£3.50,,
Morrisons Foil Tray Bakes 4 Pack,Morrisons Foil Tray Bakes 4 Pack4 per pack,£2,50p each,
Morrisons Fruit & Veg Shopping Basket,Morrisons Fruit & Veg Shopping Basket,£5.99,,
Morrisons Garden Noughts & Crosses,Morrisons Garden Noughts & Crosses,£7.50,,
Morrisons Gingham Table Cloth,Morrisons Gingham Table Cloth,£2.50,,
Morrisons Girls Thinsulate Fleece Hat One Size,Morrisons Girls Thinsulate Fleece Hat One Size,£4,,
Morrisons Grass Effect Table Runner,Morrisons Grass Effect Table Runner,£5,,
Morrisons Hanging Egg Pack,Morrisons Hanging Egg Pack,£4,,
Morrisons Hanging Honeycomb Egg Decorations ,Morrisons Hanging Honey…,£2,,
Morrisons Hanging Pom Pom Decorations,Morrisons Hanging Pom Pom Decorations,£4,,
Morrisons Hanging Sign,Morrisons Hanging Sign,£2,,
Morrisons Heart String Light 8L,Morrisons Heart String Light 8L,£7,,
Morrisons Honeycomb Bunny Table Decoration,Morrisons Honeycomb Bunny Table Decoration,£1.50,,
Morrisons Kids Gardening Set,Morrisons Kids Gardening Set,£8,,
Morrisons Ladies Thinsulate Fleece Hat One Size,Morrisons Ladies Thinsula…,£4,,
Morrisons Ladies Thinsulate Gloves One Size,Morrisons Ladies Thinsu…,£4,,
Morrisons Lamb Bonnet Decorations,Morrisons Lamb Bonnet Decorations,£1,,
Morrisons Large Chick Gift Bag,Morrisons Large Chick Gift Bag,£1,,
Morrisons Lithium Batteries Cr2016,Morrisons Lithium Batteries Cr20164 per pack,£2.50,62.5p each,
Morrisons Lithium Batteries Cr2025,Morrisons Lithium Batteries Cr20254 per pack,£2.50,62.5p each,
Morrisons Lr44 Alkaline,Morrisons Lr44 Alkaline4 per pack,£2.50,62.5p each,
Morrisons Make Your Own Cross Stitch Decorations Set,Morrisons Make Your Own Cross…,£3,,
Morrisons Medium Daisy Gift Bag,Morrisons Medium Daisy Gift Bag,80p,,
Morrisons Mens Thinsulate Fleece Hat One Size,Morrisons Mens Thinsulate Fleece Hat One Size,£4,,
Morrisons Men Thinsulate Fleece Gloves One Size,Morrisons Men Thinsulate Fleece Gloves One Size,£4,,
Morrisons Mini Chicks Bonnet Decorations,Morrisons Mini Chicks Bonnet Decorations,£1,,
Morrisons Mother's Day Flamingo Plush Medium,Morrisons Mother's Day Flamingo Plush Medium,£6,,
Morrisons Mother's Day Medium Elephant Plush,Morrisons Mother's Day Medium Elephant Plush,£6,,
Morrisons Mother's Day Small Elephant Plush,Morrisons Mother's Day Small Elephant Plush,£4,,
Morrisons Nibble Platters 3 Pack,Morrisons Nibble Platters 3 Pack3 per pack,£2,66.7p each,
Morrisons Paint Your Own Eggs Set,Morrisons Paint Your Own Eggs Set,£3.50,,
Morrisons Paint Your Own Wooden Hanging Egg,Morrisons Paint Your Own Wooden Hanging Egg,£1,,
Morrisons Pink Spot Napkins,Morrisons Pink Spot Napkins20 per pack,£1.50,7.5p each,
Morrisons Rabbit Pencil Case Set,Morrisons Rabbit Pencil Case Set,£3.50,,
Morrisons Rainbow Baby Pool,Morrisons Rainbow Baby Pool,£15,,
Morrisons Rainbow Mini Chicks Bonnet Decorations,Morrisons Rainbow Mini Chic…,£1,,
Morrisons Rechargeable AAA Batteries 900mAh,Morrisons Rechargeable AAA Batteries 900mAh,£8,,
Morrisons Rechargeable Batteries AA,Morrisons Rechargeable Batteries AA4 x 1 per pack,£8,£2.00 each,
Morrisons Reusable Wine Glass 10Pk,Morrisons Reusable Wine Glass 10Pk,£2.50,,
Morrisons Silver Bow Christmas Clips,Morrisons Silver Bow Christmas Clips2 per pack,£3.50,£1.75 each,
Morrisons Silver Xmas Crackers,Morrisons Silver Xmas Crackers12 per pack,£4,33.3p each,
Morrisons Small Roasting Trays 2 Pack,Morrisons Small Roasting Trays 2 Pack2 per pack,£2.75,£1.38 each,
Morrisons Splash & Spray Water Pad,Morrisons Splash & Spray Water Pad,£12,,
Morrisons The Best Cheeseboard Cracker Selection,Morrisons The Best Cheesebo…250g,£3.99,£1.60 per 100g,
Morrisons Turbo Bubble Blaster,Morrisons Turbo Bubble Blaster,£10,,
